job_title,company_name,location,job_link,job_id,job_description
Data Engineer,KCS iT,"Lisbon, Portugal (Hybrid)",https://www.linkedin.com/jobs/view/3740998597/?eBP=CwEAAAGMQBoM7OXyod0hC8mxHoYOZ40AFa8g-hYET0kaXAeg-RHoiF7Yh1cIoQOU8h1SPuiBHcWhc9Wx6JDxofPAxXc-BNVOoVApVdHf066UO2-ebPP724xhMb04C9K9sv7oHtJsRJ7B2vHEcuJV4wHBGD94B-vPLMAi6UFS1qIPg1Qhie-o5KvDRX7C8WOYoigIR5XityDGmeum4VxkwOepsKaI8l43qTx9dcYVAqDMgbQGn6zX28kDNZNpkS1YHIqD7p3_UqGBsZF9N3OxeMiq3fUzFxAp0J7Kz5uav7byl4ASoZR8Qv7FTs6YtVj4QrhQQgfcSuicDuOeThPNUEPIkBc5IF4pQDK7Fr6-FTxowSkrW4p2YWX1krtwftFqN-Ph&refId=rvky%2F6rUJQiu4v14CTeAyg%3D%3D&trackingId=xm9lI7YUvLBFl0lkHOwgPQ%3D%3D&trk=flagship3_search_srp_jobs,3740998597,"About the job
            
 
@ KCS IT, we look for the ones that stands out, for those that always wants to be better and fight for it, and for those who has the same values that we do: dedication, energy, integrity, transparency, flexibility, trust, honesty, hard work, proactivity, team work.At KCS we stand for equality and value diversity. We create a safe, diverse environment where opportunities are equal for everyone! We do not discriminate based on age, ethnicity, sexual orientation, gender, disability or any factor other than merit. All applications with skills for the position are welcome!We are looking for an Amazing: Data EngineerSeniority: seniorType of position: HybridThe amazing you, will have:  Bachelor / Master in Computer Engineering or similar;+5 years of experience as Data EngineerStrong knowledge of SQL.Experience with Software Asset Management as well as Workplace; and Experience with Cloud Asset Management;Experience with ServiceNow e ITIL (mandatory)Strong communication skillsFluent in EnglishMust be in Lisbon (mandatory)
Why should you become part of our family? You can develop a career that fits you: your career development is personalized, taking in consideration your needs and goals from a short to long termInteresting Challenges Ahead: you can work for several clients from different sectors of activityFree training programs: Our training and certification programs in languages, tech, behavior and business will help you to reach your full potential fasterInternational projects in Benelux: you can gain international experience in Benelux and balance a new way of living with workType of projects (depending on the project you might find one of this types of projects):In hybrid Systems: Is important to balance work with socialization, that´s why a hybrid system works for us and for youFull Remote projects: If you want to work while you enjoy the comfort of your homeFull Onsite projects: if you prefere the company of your colleagues!Take care of your well-being: Enjoy our free nutrition, psicologist, general medicine appointments and our yoga and personal training days… all remote!
 Who are we? Founded in 2008 and based in Lisbon, KCS IT is a consulting company in the field of Information Technology and Services, focused on creating value for our clients through three main areas: Consulting, Outsourcing, Inovation and Training. Our commitment to talent development is unmistakable in the recent opening of the Porto, Leiria and Azores hubs, which aims to develop technology for the national and international market. Since 2018 we have been elected one of the 10 major companies in the “Index of Excellence”, an initiative that aims to reward organizations that invest most in the development and satisfaction of their employees."
Data Engineer,Luxoft,"Wrocław, Dolnośląskie, Poland (Hybrid)",https://www.linkedin.com/jobs/view/3761033593/?eBP=CwEAAAGMQBoM7FygzQTL3dAUEJmIqzbOjO3rbV-1B37fGT2zn8qEnVw-CxwwlpSI6qhtFCBlhjmJMAIblYLwt0dn-Vtu72nZ_GDETE-XRDkF_RgG3YlQ11OOV-FxGNC3EYVeWdSraUbnL_0VJI6KdjV2yaxQmrBEgFuaCK9Pe58gPh69BG6UEkM1OxCpVIKXQMv7nCuRSwxLFt9Jfy2aumCsWKpqOupUtNyZV10P8oQ2C-bDstXh4mdRTXi-thUi0XRFgla7TqifcBHI-4yxnS-sdZKh6lirKuREaa8Pp25cMPHrXA0HpkAsc59bwQsKsx6W_fW85WLIajdRPjyHOIapKgcugC0H5NbS8tYtR_2zVo3VTPLJSwrsyx601i-N9g&refId=rvky%2F6rUJQiu4v14CTeAyg%3D%3D&trackingId=VSJ2sPs%2BnY8kj6u9DYifFw%3D%3D&trk=flagship3_search_srp_jobs,3761033593,"About the job
            
 
Project Description:You will be working in a global team within the Markets Regulation Technology. We are working on key business intelligence/reporting programs, supporting the bank in meeting its global regulatory obligations.Responsibilities:• design and implement data solutions• develop and maintain scalable and efficient data pipelines• build reusable code, optimize and improve data processes• collaborate with team members and other teams in an agile environment• ensure the highest quality of deliverablesMandatory Skills Description:• 4+ years of experience in building data processing and reporting solutions• Solid experience of a wide range of Azure services: Azure SQL DB, Databricks (Spark) and/or Synapse, Power BI• Strong Python programming skills• Understanding of Lakehouse architectureNice-to-Have Skills:• Apache Kafka• Apache AirflowLanguages:English: C1 Advanced"
Data Engineer Freelance - Kafka (IT) / Freelance,Lawrence Harvey (LHI group limited),"Paris, Île-de-France, France (Hybrid)",https://www.linkedin.com/jobs/view/3724614307/?eBP=JOB_SEARCH_ORGANIC&refId=rvky%2F6rUJQiu4v14CTeAyg%3D%3D&trackingId=nUThVOI%2FnN85hYp98El12g%3D%3D&trk=flagship3_search_srp_jobs,3724614307,"About the job
            
 



      This job is sourced from a job board.
      Learn More



Mon client dans l'industrie financière est à la recherche d'un Data Engineer compétent en Kafka qui pourrait travailler au sein d'une équipe comprenant des Tech Leads et des Product Owners. Les principales responsabilités attendues sont les suivantes : Mettre en ?uvre des solutions techniques définies en collaboration avec les propriétaires d'épic, les leaders techniques et les architectes au sein d'une structure agile. Favoriser la communication avec les différents membres de l'équipe de la division Data. Échanger et préparer des démonstrations avec les équipes informatiques métier. Maintenir une veille technologique constante. Les compétences techniques requises comprennent : Analyser et développer des \""produits transversaux prêts à l'emploi pour nos activités\"". Principalement développer en Java jusqu'à l'intégration avec les chaînes CI/CD. Avoir une maîtrise des langages de programmation suivants : Java, Scala, Python (dans le contexte du Big Data). Être compétent dans les plateformes de configuration et de gestion des déploiements : Ansible, Terraform, etc. Avoir une bonne connaissance de l'écosystème de stockage d'objets et de Kubernetes : API S3, Helm, etc. Maîtriser l'écosystème Hadoop (HDFS, Hive, etc.), Spark, Kafka, ElasticSearch/SolR. Avoir une solide compréhension de l'écosystème de transport de données : kafka connect, etc. Maîtriser le framework Spring : Spring-Boot, Spring-Security, etc. Avoir une maîtrise du framework React pour le développement des interfaces utilisateur. Posséder des connaissances des concepts NoSQL et être compétent dans au moins une solution parmi celles-ci : Cassandra, MongoDB, Redis, PostGres. Avoir une compréhension des concepts de streaming, notamment Flink. Si vous êtes intéressé(e) par cette opportunité et que vous pensez répondre aux critères mentionnés ci-dessus veuillez envoyer votre CV a -email masqué-XX Nous restons à votre disposition pour répondre à toutes vos questions supplémentaires. Cordialement, Gael Kisombe Lawrence Harvey is acting as an Employment Business in regards to this position. Visit our website and follow us on Twitter for all live vacancies (lawharveyjobs)"
Ingénieur intégration DevOps,Orange Business,"Lannion, Brittany, France (Hybrid)",https://www.linkedin.com/jobs/view/3778382081/?eBP=CwEAAAGMQBoM7AlQ3GY0uSHPbK6HitHHdLcBZu718y4k51cWxG4OHO5lge67K8MIwe0Yjqbk0uFW1kt_TeqO1-bC_M4QJm_6lkvHdNLYSWpChPPrIT8-b1MlDsv_f2Xu0x6tgG2o2dBZMQoEtGbYBgcmwnoLiq8Q81v_jcAbM2dDmW60aAx9UY3fV9qyJO0QGFJaTYDbyU25_ZViZx9vWpe58YlSeq3lYHojpn-fhYYba5ukDmPTOVPc4Sun1Ok6XxFsAZkmsav5nUFOqfNE0ZliA7vqh-VK24_0Gk59Szj-yrFZLjBwqZ5HG5JruO2SilCJOuDu3hzsppdxXsR7sC02_QUpBA67qaS6Gsk4FEzC1Zvv2P1uM4aL2caD3BBFfg&refId=rvky%2F6rUJQiu4v14CTeAyg%3D%3D&trackingId=%2Fgo4ZjeDAJnIvI7SaAa3qw%3D%3D&trk=flagship3_search_srp_jobs,3778382081,"About the job
            
 
Pour soutenir la croissance de notre équipe spécialisée sur le développement logiciel et l'intégration de solutions digitales pour les entreprises, nous sommes à la recherche d'un ingénieur qualification et tests automatiques.Intégré à l'équipe projet, vous interviendrez en tant que consultant sur l’intégration des composants logiciels d’une solution de transfert d’argent et de paiement sécurisé d’Orange déployée dans plusieurs pays dans le monde.Vos activités principales : Préparation des environnements d’intégration et de qualification, en partie avec de l’automatisationMaintien et évolution de l’outillage, des jeux de données et des configurationsPréparation des mises en production et soutien à l’équipe d’exploitation si nécessaireAppropriation des nouvelles fonctionnalités à déployerInteractions avec le Product Owner, le Scrum Master, les architectes, les équipes de développements et de qualificationParticipation aux cérémonies Agile et au reporting hebdomadaire avec le responsable intégration-validationSupport à l’équipe de qualificationSupport occasionnel en production et préanalyse des problèmes constatés
Profil De formation Bac+4 ou BAC+5, vous justifiez d'une première expérience de 2 ans minimum en tant qu’intégrateur ou développeur.Compétences : Doté d'un excellent relationnel (oral et écrit),Vous savez travailler de manière autonome sur les projets qui vous sont confiésVotre flexibilité et votre esprit d'équipe vous permettront une bonne intégration au sein du projetVous êtes force de proposition dans la réalisation de vos tâches, et aimez les défisOrganisé et rigoureux, vous appliquez les bonnes pratiques du test
Compétences techniques nécessaires : Maîtrise du système Linux et du scripting BashMaîtrise de l’outil de versioning de code source GitMaîtrise d’un outil d’intégration et déploiement continu tel que Gitlab-CI, Jenkins ou TFSCompétences sur les API REST et la mise en œuvre d’outil de tests tels que SoapUI, JMeter ou PostmanCompétences sur le déploiement de composants logiciels en conteneurs avec Docker, Kubernetes ou OpenShiftExpérience significative avec ELK et en particulier LogstashExpérience sur base de données NoSQL et si possible sur MongoDB
Compétences qui seraient un plus : Compétences en développement Javascript sous NodeJSConnaissances d’un outil d’automatisation tel que Ansible ou TerraformConnaissances des outils de supervision : Kibana, Prometheus, Grafana
Chez Orange, seules vos compétences comptent :Quel que soit votre âge, genre, origine, religion, orientation sexuelle, neuroatypie, handicap ou apparence, nous encourageons la diversité au sein de nos équipes car c’est une force pour le collectif et un vecteur d’innovation.Nous sommes une entreprise handi-accueillante : n'hésitez pas à nous faire part de vos besoins spécifiques."
Data Engineer,BITMARCK,"Essen, North Rhine-Westphalia, Germany (Hybrid)",https://www.linkedin.com/jobs/view/3772976218/?eBP=CwEAAAGMQBoM7DKs4tvLRc1EKoJoBVFbjUTV955CXeghMnxWzmbChPaktEZtBu-zGsFSsz49eiRgLhW77zWFwjhXKIksiHICVflqKhQIekvNQ2aXBZAWTJp7LcyesoR3nT_WRyH8p22zqxXT_CNgeu01Xd7xJA89In_B0SlpvtiFGeMHSkL9n04EANNpyY82mnn2r5v2sy_aVEL0zy_ADdQ_sjEV8yQSWtF53lvu7Bw46kA7AcnaoDrnTKIugG9cju8dBFgdy2A5sZdQdfcRTlF4ILtcoq4NA0WTHWtuYeLvvyf-k5lPdN16gg4iXbr1A2rcoskjiFjxM-1fvdm8_m_b8As4ulLycBpeWF5NaUXShKNeV2-1Hei-7XKH574MZebT&refId=rvky%2F6rUJQiu4v14CTeAyg%3D%3D&trackingId=gsTdoPPiUD6HT4C10Z5g3w%3D%3D&trk=flagship3_search_srp_jobs,3772976218,"About the job
            
 
Digitalisiere die GKVWir digitalisieren und vernetzen für das Wichtigste im Leben – Gesundheit. Es gibt kaum ein spannenderes Zukunftsfeld als die IT. Und kein wertvolleres als die Gesundheit. Verbinde beide Themen und mache daraus eine Karriere, bei der sich die Frage nach der Sinnhaftigkeit gar nicht erst stellt. Unterstütze uns dabei, Kunden zu beraten, Prozesse zu sichern und Teams zu organisieren. Unser Business entwickelt sich stetig weiter – mit uns kannst du das auch. Deine Projekte – das machst du bei uns: Gestalte und optimiere Prozesse für den Datenaustausch der größten Datendrehscheibe der GKV.Begleite den kompletten Lebenszyklus von eigenentwickelten Anwendungen und Plattformen für den synchronen und asynchronen Datenaustausch und entwickle diese im Team weiter.Plane und entwickle neue innovative Plattformen für den Datenaustausch auch im Cloud-Kontext.Die Störungsanalyse und Dokumentation im Datenaustausch ist ein wichtiger Bestandteil
Unsere Benefits – das bieten wir dir: Branche mit Zukunft: Bei uns arbeitest du in zwei Zukunftsmärkten – IT und Gesundheit. Fachliche und persönliche Weiterentwicklung: Mit unserer Personalentwicklung hast du die Chance, dich fachlich und persönlich weiterzuentwickeln. Gutes Betriebsklima und Netzwerk: Teamwork wird bei uns großgeschrieben! Wir arbeiten gerne zusammen, egal von welchem Standort aus. Freiräume und Zeit für Regeneration: Wer Leistung bringen will, muss sich wohlfühlen. Wir arbeiten in einer 39-Stunden Woche, haben flexible Arbeitszeiten und bieten dir 30 Tage Urlaub. Wir legen sogar noch 3 weitere betriebsfreie Tage oben drauf. Gesundheitsmanagement: Um gute Ideen zu haben, braucht es einen freien Kopf. Gesundheits-Camp oder Firmenlauf sind nur zwei Angebote unseres Gesundheitsmanagements. Moderne Hard-/Software: Werde ein Teil unseres agilen und offenen Teams und nutze die neuesten Technologien für deine Arbeit.Benefits: Bei uns ist deine tarifliche Vergütung gesichert. Dazu gibt es Firmentickets, eine Sabbatical-Regelung, JobRad-Leasing, Kindergartenzuschuss und viele weitere Vorteile.
 Dein Background – das bringst du mit: Mehrjährige Erfahrung im Bereich Data Engineering unter Einsatz von Apache Nifi, im Datenaustausch und in der Entwicklung von Schnittstellen macht dich zum Profi.Kenntnisse in folgenden Programmiersprachen (Bsp.: Python, Groovy)REST, SOAP, https und JSON, Linux Shell-Skript, AWK, SQL, sind keine Fremdworte für dich.Du hast den Mut, dich und deine Motivation auch bei fehlenden Teil-Qualifizierungen bei uns vorzustellen. Rufbereitschaften in einem rollierenden System sind kein Problem für Dich.
Jedes Bit macht Gesundheit smart."
Data Engineer | Amsterdam | tot 78k | Greenfield omgeving,blooming people,"Amsterdam, North Holland, Netherlands (Hybrid)",https://www.linkedin.com/jobs/view/3766688190/?eBP=CwEAAAGMQBoM7IBMlL7aDXUEs85dejes1FYpTdsxT1YhfKphON75orbzOOKuFUEvVaWusUil7nPxnKgqPAwlsnjgCNuF46Iko4_SiBKljx88fnG4mfWhXn1aPKQ-UZS6wbsvGridZrhPr8LtnnFO84koqZGH7zRKWRXAhul3tAa9Pqug5rR2Vek8KWGvR-KaR_PUJYV5s3yx71HyvSxuli108_mkmbmaPxEkbPUll_hKnds3ym9_0pPx06Bk5Xcr499C7uMyg4e9IDwg2vY-NcRnHlpG613oejz1IwYuLvxRWKRkPKJraGfFtSjnlOzq31knIQwLG_hjBa-g0GG5XSF6LpdCfQC-2GV_HFTThk151N855RvUkLy-Aw8aWJYOWXRT&refId=rvky%2F6rUJQiu4v14CTeAyg%3D%3D&trackingId=2iC36Y7DOq9zKdPGe8DV%2FQ%3D%3D&trk=flagship3_search_srp_jobs,3766688190,"About the job
            
 
Wil jij je stempel drukken bij het creëren van een compleet nieuw data landschap?Ben jij iemand die goed weet wat er moet gebeuren en niet bang is voor verantwoordelijkheid?Zoek jij naar een snelgroeiende omgeving waar veel uitdagingen op je pad zullen komen?Zou jij het gaaf vinden om de kern van de groei op het gebied van data te zijn binnen een verbindende organisatie die ook internationaal een steeds grotere rol speelt?
 Lees dan snel verder over jouw nieuwe uitdaging als Data Engineer! Over jouw nieuwe werkgeverWat hebben de Hogeschool van Amsterdam, een internationale kunstverzameling, een Covid-19 testcentrum en jaarlijks 1,5 miljoen klanten met elkaar gemeen? Je raad het nooit, maar deze toffe organisatie! Ruim 125 jaar geleden werd deze organisatie opgericht in de hoofdstad van Nederland. Hier verzorgen zij voor hun klanten de publieke en verbindende functie en helpen zij dagelijks aan creatieve oplossingen. Hoe het gister was, is morgen weer helemaal anders, deze dynamische organisatie is niet van het stilzitten en wil van data continu kunnen leren.Ruim 350 medewerkers op het hoofdkantoor werken gezamenlijk aan het doel om de belangen van hun klanten voorop te zetten en denken zij dagelijks mee over steeds betere concepten en oplossingen. Hoewel de organisatie al 125 jaar bestaat, is de organisatie nog jong van hart. Met veel werknemers die een Hotelschool achtergrond hebben, mag je er zeker van zijn dat naast de dagelijkse werkzaamheden gezelligheid centraal staat.De organisatie is helemaal data (aan)gedreven. Hierin onmisbaar geworden is hun Data en Analytics Platform. Dit platform en jouw werk is essentieel om structuur te brengen in de oplossingen die aan de 1,5 jaarlijkse klanten worden aangeboden.Over jouw nieuwe rol als Data Engineer Jij zal je voornamelijk bezighouden met het verzamelen, transformeren en laden van data zodat deze gebruikt kunnen worden voor een verbeterde besluitvorming. Je zal geheel op je eigen manier vorm mogen geven aan een compleet nieuw data landschap. Data is namelijk iets wat nog niet veel gebruikt werd binnen deze operationele organisatie tot een paar jaar geleden, en jij kan hiermee direct impact maken voor de groeiende toekomst van dit bedrijf en jouw carrière. Je bent voortdurend op zoek naar nieuwe technologieën en methodieken om de data-architectuur te verbeteren. Daarnaast stuur je een sterke Data Analytics & Engineering consultancy aan op de inhoud. Daarnaast ben je een onmisbare schakel in het inrichten van een gloednieuw Data & Analytics Platform. Je gaat data pipelines maken en door middel van het sterke Azure Synapse platform zal je de data transformeren en klaar zetten. Je krijgt de kans om juniors te begeleiden en uiteindelijk een eigen datateam te creëren. Jij draagt direct bij in het ervoor zorgen dat deze organisatie data gedreven gaat worden en je krijgt de kans om dit volledig op je eigen manier in te richten!  Wie ben jij? Naast sterke technische skills ben je ook communicatief een uitblinker en weet je goed externe bureaus aan te sturen die je gaan helpen in het bereiken van een succesvolle Data Engineering omgeving;Je hebt ongeveer 5 jaar ervaring in een Data Engineering of Business Intellingence positie;Je hebt ervaring in git development (DTAP);Je hebt kennis van de agile werkwijze;Je hebt ervaring met CI/CD (Azure DevOps is een pré);Je hebt ervaring met tooling zoals: Azure Databricks, Azure Data Factory, Azure Data Lakehouse en T-SQL.
 Wat krijg je daarvoor terug? Bijdragen aan het succes van een bedrijf wat met jouw hulp meer datagedreven wilt worden;Bij een sterke marktleider de kans krijgen om ze ook op het gebied van data een sterspeler te maken;Het coördineren van verschillende migraties van on prem naar de cloud;Goed salaris tot ongeveer 6.000,- op basis van 40 uur, afhankelijk van senioriteit en werkervaring;Mogelijkheid tot 32-urige werkweek;Flexibele werktijden en –plekken;Uitstekende primaire en secundaire arbeidsvoorwaarden, zoals 25 vakantiedagen met 13 ADV dagen, ontwikkelingsmogelijkheden, een goede pensioenregeling en een winstdeling."
Data Engineer,MERITIS,"Île-de-France, France (Hybrid)",https://www.linkedin.com/jobs/view/3767627899/?eBP=CwEAAAGMQBoM7DVJ1TGT9Zyyc8rgPm_THQadDIWUtGS-CxZpzxXB-D4Cjm68yTw_3UFOPpytRD6JyDqm05nZ0XqHauVhAOLrosB9Yg2U_VfG6YbH9quZxIcuHhcprzG9IfffGrbDDDQ_dqMv8n5Wtbr-LUG-FHqomPKXbiFIlIRFQqXzF6jDrktEAUsuFjQ0yYk1mHf3oCC9tpBovwr7b-A_q7KSbUXVmQe_HlSlialUnevuWXX7zg-wyYH4v6bIsehvi16ciHjkcTOzC53QZwrc9tJn9cH5iAq0dNA1NnrjbXAfrtWPh-y4VzCM8wVn7s2WfSOwGx2ydV2AmDp1jJiY0cwiyN9UcaOvePXCiLggzDpZk2CvlivZsan5nKf8yK9v&refId=rvky%2F6rUJQiu4v14CTeAyg%3D%3D&trackingId=7N8dLALKTgFcGENuf0DUOg%3D%3D&trk=flagship3_search_srp_jobs,3767627899,"About the job
            
 
Descriptif de l’entreprise :​Meritis est un cabinet de conseil, pilotage et développement IT fondé en 2007 présent à Paris, Sophia-Antipolis, Aix-en-Provence, Montpellier, Toulouse, Nantes... Et bientôt sur de nouveaux territoires ! Notre mission ? Connecter les meilleurs talents aux entreprises pour leur donner un temps d’avance.​Nous accompagnons nos clients dans l’intégralité de leurs besoins en transformation numérique à travers de nombreux domaines d’expertises : Software Engineering, Finance, Pilotage de projets, Devops, Data, Cloud, Cybersécurité ou encore Agilité.​Intervenant aussi bien dans les secteurs de la Banque, de l'Assurance, des Télécommunications que de l'Industrie ou des Transports, aujourd'hui 40% des entreprises du CAC40 sont clientes Meritis.​Fort de nos valeurs d’exigence, d’humilité, de bienveillance et de proximité, nous comptons aujourd’hui plus de 900 collaborateurs.​Nous mettons un point d’honneur à être proche de nos collaborateurs et à les accompagner de manière individualisée quelles que soient leurs fonctions dans l’entreprise.Certifiée Great Place To Work depuis 2013, notre conception du bien-être au travail va bien au-delà d'un simple label, ce sont nos collaborateurs qui en parlent le mieux : https://www.glassdoor.fr/Avis/Meritis-Avis-E1163008.htm.​Nous recherchons un Data Engineer Spark/Scala H/F, ayant au moins 4 ans d'expérience, pour intervenir chez notre client leader du secteur du retail, pour les accompagner dans l'établissement d'une stratégie de gestion de données ambitieuse pour le groupe et ses marques en développant des données et des pipelines de donnéesVos missions : Créer et maintenir une architecture optimale de pipeline de données Assembler de grands ensembles de données complexes qui répondent aux besoins fonctionnels / non fonctionnels de l’entrepriseConstruire l’infrastructure requise pour optimiser l’extraction, la transformation et le chargement de données provenant de sources très diverses au moyen des technologies « big data » SQL et AWS Travailler avec les Data Scientists et l’IT pour résoudre les problèmes techniques liés aux données et répondre à leurs besoins d’infrastructure de donnéesTravailler avec les experts en analyse de données pour améliorer la fonctionnalité des systèmes de données
Ce poste est à pourvoir en CDIEnvironnement technique : Framework : SparkLangages de programmation : Scala, Python, SQLBases de données : NoSQL, Teradata,...Cloud : AWS (EC2, EMR, RDS, Redshift)
Ce poste est-il fait pour vous ? : Vous êtes diplômé d'un Bac +5 et justifiez d'au moins 4 ans d'expérience en tant que Data EngineerVous avez de l'expérience sur les outils Python, SQL Server et avez de l'expérience sur GCPVous parlez anglais courammentVous avez une passion pour le domaine de la Data et souhaitez monter en compétences
Vos différences sont nos atouts. C’est pourquoi Meritis est engagée en faveur de la diversité et de la non-discrimination. Tous nos métiers sont accessibles aux personnes en situation de handicap. Si vous avez une question ou pensez être victime ou témoin d’une discrimination, vous pouvez contacter ethiquegroup@meritis.fr. »"
