job_title,company_name,location,job_link,job_id,job_description
Data Engineer,Lynx Analytics,"San Francisco, CA (Remote)",https://www.linkedin.com/jobs/view/3641777500/?eBP=JOB_SEARCH_ORGANIC&refId=Yl0fj3JHOQuAJZVhed8Kzg%3D%3D&trackingId=3mZu5EV6q7dMaUchD%2Fzgeg%3D%3D&trk=flagship3_search_srp_jobs,3641777500,"About the job
            
 
Company OverviewLynx Analytics was founded in 2010 by a group of INSEAD students and professors with a strong research background in graph analytics. Several of our founders since then became professors and faculty directors of analytics centers at leading US universities. Our founding purpose? To apply graph theory to simplify and solve complex, real-world business problems.Our mission has evolved over the years, and we currently offer a range of cutting edge data analytics and AI solutions to help companies transform their operations and optimise their commercial performance. Back then, graph theory was mostly the purview of social networking sites. We wanted to expand this technology and help companies leverage their communities to unlock greater growth.Lynx has offices in Singapore, US, Hong Kong, Hungary, and operations in several other countries such as Canada, Germany, Indonesia. We work with some of the world's largest companies and are constantly looking to expand our knowledge base and geographical footprint. Lynx Analytics' technology is deployed with various Clients internationally and has significant growth potential.We have a diverse and inclusive global team comprising Professors, PhDs, MSc's, and MBAs from Ivy Leagues, INSEAD and NUS with a broad spectrum of experience in start-ups and blue-chip companies (Google, Databricks, ZS, Abbvie, Amgen, Vodafone, Morgan Stanley, Palantir, Katana Graph to name but a few). It is the combination of our industry insight and experience, scalable proprietary technology, and highly qualified people that drives our compelling value proposition.We are looking for ambitious, innovative, empathetic and relentless team players to explore the career opportunities that we offer as we continue to scale our operations.Key ResponsibilitiesA Data Engineer's responsibility is to implement and deploy data analysis pipelines at various clients of Lynx Analytics. This includes participating in the activities below: Understand deeply the business problem that we are trying to solve by our analytical solutionThrough continuous consultations with employees of our client, discover the client's existing data sources that are relevant to the problem we try to solve. This includes discussions with client IT, data owners, future business users, etc. Working together with the IT teams of the client, define the technical architecture for the analytical solution that we are to deploy for the client. Implement the data ingestion subsystem: this is the system responsible for moving all the necessary data sources to a single location where the actual analysis will happen. Implement the data analysis pipelines. Integrate the results into business UIs developed by Lynx or pre-existing client software systems
Requirements Relevant tertiary qualification, preferably at Masters level or above, in Engineering or another relevant discipline with strong academic resultsStrong programming skillsExperience in GCP, Airflow and SparkSolid experience in Python and SQLGood problem-solving skillsGood communication skills
DESIRABLE Experience in Big DataA minimum of 3 years of experience in Data Science or AnalyticsIndustry experience in working for a big enterprise (like our clients)
What We Offer Opportunity to work on creating innovative, leading-edge data science pipelines using our state of the art, in-house built big graph toolWork closely with the developers of the (big graph) tool you will be building uponBe a member of a very strong team with mathematicians, ex-Googlers, Ivy League professors, MBA alumni and telecommunications industry expertsStartup atmosphere"
Entry Level Data Engineer (Remote),SynergisticIT,"Augusta, GA (Remote)",https://www.linkedin.com/jobs/view/3767593225/?eBP=JOB_SEARCH_ORGANIC&refId=t9HE8VvUb%2BJaHM%2Brfs1tnA%3D%3D&trackingId=BBVyQzOjuLLUvcYfYJMTtQ%3D%3D&trk=flagship3_search_srp_jobs,3767593225,"About the job
            
 
The Job Market is Challenging due to almost 300,000 Tech Layoffs since October 2022 due to which thousands of laid off Techies are competing with existing Jobseekers. Entry level Job seekers struggle to get responses to their applications forget about getting client interviews. As the Saying goes ""when the Going gets tough the Tough get going” Candidates who want to make a tech career they need to differentiate themselves by ensuring they have exceptional skills and technologies to be noticed by clients.Since 2010 Synergisticit has helped Jobseekers differentiate themselves by providing candidates the requisite skills and experience to outperform at interviews and clients. Here at SynergisticIT We just don't focus on getting you a Job we make careers.All Positions are open for all visas and US citizensWe are matchmakers we provide clients with candidates who can perform from day 1 of starting work. In this challenging economy every client wants to save $$$'s and they want the best value for their money. Jobseekers need to self-evaluate if they have the requisite skills to meet client requirements and needs. Clients now post covid can also hire remote workers which increases even more competition for jobseekers.We at Synergisticit understand the problem of the mismatch between employer's requirements and Employee skills and that's why since 2010 we have helped 1000's of candidates get jobs at technology clients like apple, google, PayPal, western union, Client, visa, Walmart labs etc. to name a few.We have an excellent reputation with the clients. Currently, We are looking for entry-level software programmers, Java Full stack developers, Python/Java developers, Data analysts/ Data Scientists, Machine Learning engineers for full time positions with clients.Who Should Apply Recent Computer science/Engineering /Mathematics/Statistics or Science Graduates or People looking to switch careers or who have had gaps in employment and looking to make their careers in IT IndustryWe assist in filing for STEM extension and also for H1b and Green card filing to Candidates We also offer optionally Skill and technology enhancement programs for candidates who are either missing skills or are lacking Industry/Client experience with Projects and skills. Candidates having difficulty in finding jobs or cracking interviews or who wants to improve their skill portfolio. If they are qualified with enough skills and have hands on project work at clients then they should be good to be submitted to clients. Shortlisting and selection is totally based on clients discretion not ours.please check the below links to see success outcomes of our candidateshttps://www.synergisticit.com/candidate-outcomes/We regularly interact with the Top Tech companies to give our candidates a competitive advantage-Please see us exhibiting at Oracle Cloud world /Oracle Java one (Las vegas) -2023/2022 and at Gartner Data Analytics Summit (Florida)-2023https://youtu.be/Rfn8Y0gnfL8?si=p2V4KFv5HukJXTrnhttps://youtu.be/-HkNN1ag6Zk?si=1NRfgsvL_HJMVb6Qhttps://www.youtube.com/watch?v=OAFOhcGy9Z8https://www.youtube.com/watch?v=EmO7NrWHkLMhttps://www.youtube.com/watch?v=NVBU9RYZ6UIhttps://www.youtube.com/watch?v=Yy74yvjatVgFor preparing for interviews please visit https://www.synergisticit.com/interview-questions/We are looking for the right matching candidates for our clientsPlease apply via the job postingREQUIRED SKILLS For Java /Full Stack/Software Programmer Bachelor's degree or Master's degree in Computer Science, Computer Engineering, Electrical Engineering, Information Systems, IT Highly motivated, self-learner, and technically inquisitive Experience in programming language Java and understanding of the software development life cycle Project work on the skills Knowledge of Core Java, JavaScript, C++ or software programming Spring boot, Microservices, Docker, Jenkins and REST API's experience Excellent written and verbal communication skills 
For data Science/Machine learning PositionsRequired Skills Bachelor's degree or Master's degree in Computer Science, Computer Engineering, Electrical Engineering, Information Systems, IT Project work on the technologies needed Highly motivated, self-learner, and technically inquisitive Experience in programming language Java and understanding of the software development life cycle Knowledge of Statistics, SAS, Python, Computer Vision, data visualization tools Excellent written and verbal communication skills 
Preferred skills: NLP, Text mining, Tableau, PowerBI, TensorFlowIf you get emails from our skill enhancement team please ask them to take you off their distribution list and make you unavailable as they share the same database with the client servicing team.No phone calls please. Shortlisted candidates would be reached out. No third party or agency candidates or c2c candidates"
GSA Data Engineer,Nike,"Beaverton, OR (Remote)",https://www.linkedin.com/jobs/view/3693334852/?eBP=JOB_SEARCH_ORGANIC&refId=t9HE8VvUb%2BJaHM%2Brfs1tnA%3D%3D&trackingId=UZZUQDg5G3RhO9LWMh2EtQ%3D%3D&trk=flagship3_search_srp_jobs,3693334852,"About the job
            
 
Work options: RemoteTitle: GSA Data EngineerLocation: Remote, USDuration: 1 Year ContractJob Duties Engineer data solutions in support of Sustainability reporting and analytics initiativesEngage with product owner, analysts, visualization developers, and business partners to understand capability requirements, and to develop and support data solutions based on product backlog priorities 
SkillsPreference will be shown to candidates who can provide a link to their open-source code portfolio (a link to your profile on github.com, bitbucket.com, gitlab.com, or another public VCS is sufficient)Required Technical CompetenciesCandidates should have demonstrated, in a professional capacity, all of the competencies listed for each of the following three subject areas:General Purpose Python Programming Python has been your primary coding language (daily use) for at least 3 yearsYou have authored distributable Python packages (packages that can be built, installed, and distributed using setup tools, pip, and twine)You have a solid understanding of how pip dependency resolution worksYou are proficient in authoring and automating unit and integration tests for Python packages using (minimally) unit tests, pytest, and toxYou are meticulous about code quality, including readability, know your PEP8 guidelines inside and out, and are capable of authoring code which will pass validation by commonly used static analysis tools including mypy and flake8 Database Design and SQLYou are proficient in authoring readable, well-structured, SQL SELECT statements using ISO/ANSI-standard SQLYou have hands-on professional experience in data warehouse design and modeling, including authoring DDL statements. Version Control and CI/CDYou have experience with trunk-based development (feature branching) using git for version control, with fully automated deployments (CI/CD).
Database Design and SQL You are proficient in authoring readable, well-structured, SQL SELECT statements using ISO/ANSI-standard SQLYou have hands-on professional experience in data warehouse design and modeling, including authoring DDL statements. Version Control and CI/CDYou have experience with trunk-based development (feature branching) using git for version control, with fully automated deployments (CI/CD).
Desired Technical Competencies General Purpose Python Programming You have a deep understanding of Python’s standard library and python internals. You understand python memory management, how CPython implements built-in data structures, and which data structures are best suited for different scenariosYou understand and can compare/contrast CPython’s built-in concurrency models, when to use each, and what obstacles might prevent the use of each mechanism
Database Design, SQL, and Object Relational Models You are adept at performance-tuning SQL queries for both OLAP and OLTP databasesYou understand and are prepared to discuss how and when/where to utilize more esoteric and/or modern SQL features such as window functions and common table expressions.You understand and are prepared to discuss the performance implications of columnar vs relational databases.You have hands-on experience in managing database schema migrations (ideally using SQLAlchemy’s ORM + Alembic). 
Version Control and CI/CD  You have experience with trunk-based development (feature branching) using git for version control, with fully automated deployments (CI/CD)
Cloud Infrastructure and Amazon Web Services  You have hands-on experience using boto3 to interact with Amazon Web Services’ resource APIs, particularly Amazon S3 (Simple Storage Service).You have hands-on experience authoring unit and integration tests utilizing local stack to emulate AWS resources.You have hands-on experience using HashiCorp Terraform to manage cloud infrastructure.You have hands-on experience developing serverless ASGI applications using AWS lambda and AWS API Gateway 
Web API Server and Client Development You have experience planning and executing the design and development of web APIs using a modern Python ASGI framework (preferably FastAPI).You have authored, validated, and maintained OpenAPI documents describing your web APIs accurately.You have experience developing and testing Python web API client libraries based on an OpenAPI document.
Distributed Computing and Apache Spark You have experience using Apache Spark for the ingestion and manipulation of data sets that are too large to process efficiently in memory.You have hands-on experience translating algorithms and procedures designed by topical subject matter experts, having varying levels of engineering experience, into well-designed data pipelines.You have experience configuring and tuning Spark clusters to optimize use of computing resources for varying workloads.You understand and can discuss: when and why to use distributed computing frameworks, such as Apache Spark, versus alternate concurrency models such as asyncio or multiprocessing. 
Database Design, SQL, and Object Relational Models You have experience modeling databases using SQLAlchemy’s ORM framework.You have experience managing database versions and schema migrations using SQLAlchemy with Alembic. 
Required Soft SkillsCandidates should have demonstrated, in a professional capacity, all or most of the following skills: You are proficient in communicating effectively and efficiently within a hybrid remote/in-person team structure:You are meticulous about managing your calendar to accurately reflect your free/busy hoursYou respect and seek to learn digital communications etiquette—including region-specific, industry-specific, and organization-specific etiquetteYou proactively initiate constructive discussions while curating and targeting your communications with respect for your colleagues’ time and schedulesYou are adept at discovering and navigating the complex bureaucratic resources of a large organization."
Remote Work - Need Azure Fabric Data Engineer,Steneral Consulting,United States (Remote),https://www.linkedin.com/jobs/view/3759325599/?eBP=JOB_SEARCH_ORGANIC&refId=t9HE8VvUb%2BJaHM%2Brfs1tnA%3D%3D&trackingId=cgMuPKJcUsFw36JHdbs8ow%3D%3D&trk=flagship3_search_srp_jobs,3759325599,"About the job
            
 
The client is placing heavy emphasis on Microsoft and Azure Fabric experienceInformation Management Engineer – Take the identified information management sources and assist migration to the Client Data Lake, Azure Fabric. The engineer will transform information management (de-dup, clean and enrich).Take the identified data sources and bring them into our Data Lake, Azure Fabric. Once the data is in, the engineer will need to be able to transform data (de-dup, clean and enrich the data). We are focused on using a medallion data model for data architecture. The tools we are working with are: Delta Parquet files, python, spark, notebooks, T-SQL, Fabric lakehouse/warehouse, Dataflows Gen2, Data Pipelines, Direct Lake, shortcuts, ADF."
Data Engineer - Remote | WFH,Get It Recruit - Information Technology,"Cedar Park, TX (Remote)",https://www.linkedin.com/jobs/view/3775426204/?eBP=JOB_SEARCH_ORGANIC&refId=t9HE8VvUb%2BJaHM%2Brfs1tnA%3D%3D&trackingId=frcAedTbwqUPmCwVpUZ9%2BQ%3D%3D&trk=flagship3_search_srp_jobs,3775426204,"About the job
            
 
We are a dynamic and innovative company looking for a talented individual to join our team as a Data Engineer. In this role, you'll play a crucial part in supporting our Data and Process Governance Policies and Standards, contributing to the optimization of workflows and data processing to deliver impactful insights to the shop floor. If you're passionate about data engineering, visualization, and maintaining a technical foundation, we'd love to hear from you.ResponsibilitiesCollaborate with cross-functional teams to implement and support Data and Process Governance Policies and Standards.Foster a strong business insight mindset to enable data visualizations that enhance decision-making.Maintain the technical foundation of data visualizations and optimize workflows through knowledge of industry-standard applications and database theory.Drive the interconnectivity between industrial automation data, MIS, and the data warehouse.Implement an end-to-end vision for the flow of production field data through the organization.Merge new systems or methods with existing data structures.Partner with Supply Chain to define, document, implement, and maintain business processes and data workflows.Develop and implement data visualizations and reporting solutions based on user needs and feedback.Collaborate with engineers and developers to create insightful data reports for business.Work closely with the manager, regional automation, or process engineers, depending on the site.RequirementsProven experience managing complex projects and collaborating with cross-functional teams.Strong knowledge of data governance concepts and implementation.Expertise in data access management, change management, and data historian/time series data.Proficiency in SQL, MSSQL, TSQL, and data modeling for maintaining data integrity between multiple schemas.Experience with ETL processes, with knowledge of Denodo/data virtualization being preferred.Proficiency in Python and query optimization.Hands-on experience working with big data sets.Familiarity with Tableau Server/Desktop/Prep setup and dashboard building.Strong data cleaning and wrangling skills.Initiative-driven, self-motivated, results-oriented, and able to work independently.Effective communication skills, both written and verbal, as this is a client-facing role.EducationBachelors would be a plus but not required; associates with relevant experience are welcome.Join our team and contribute to transforming the way we utilize data! This is a remote position, offering a collaborative and innovative work environment. We look forward to receiving your application.Employment Type: Full-Time"
Data Engineer - Remote | WFH,Get It Recruit - Information Technology,"Cleveland, OH (Remote)",https://www.linkedin.com/jobs/view/3765609897/?eBP=JOB_SEARCH_ORGANIC&refId=t9HE8VvUb%2BJaHM%2Brfs1tnA%3D%3D&trackingId=nEy9SPNFXNyFPtDjQnBptQ%3D%3D&trk=flagship3_search_srp_jobs,3765609897,"About the job
            
 
Join an innovative team at a leading company in the engineering and manufacturing industry, where we are committed to leveraging data for continuous improvement and operational excellence. This hybrid position allows you to enjoy the flexibility of remote work on Mondays and Fridays.Why Join UsAt our company, we prioritize your well-being and professional growth. We offer a comprehensive benefits package, including excellent health benefits, a 6% 401(k) match, generous paid vacation and sick time, 12 paid holidays, and more.Role OverviewAs a Data Engineer, you will play a pivotal role in transforming raw data into actionable insights, driving improvements in engineering and manufacturing processes, enhancing product quality, and optimizing operational efficiency. Collaborate with dynamic cross-functional teams to extract, analyze, and visualize data, influencing strategic decisions through your valuable insights.Key ResponsibilitiesData Collection and Integration:Gather, clean, and integrate data from diverse sources, including production databases, sensor data, and external datasets.Data AnalysisConduct exploratory data analysis to identify patterns, trends, and anomalies.Perform statistical analysis and hypothesis testing to derive meaningful insights.Data VisualizationCreate informative and visually appealing dashboards and reports using tools like Tableau, Power BI, or Python libraries.Predictive ModelingDevelop predictive models to forecast manufacturing performance, quality, and operational outcomes.Root Cause AnalysisInvestigate production issues and quality concerns by analyzing data to identify root causes and recommend corrective actions.Performance MonitoringEstablish and maintain key performance indicators (KPIs) to track manufacturing and engineering metrics.Generate regular reports to communicate performance trends to stakeholders.Cross-functional CollaborationCollaborate with engineering, manufacturing, and quality assurance teams to understand their data needs and provide analytical support.Continuous ImprovementSuggest process improvements and optimizations based on data analysis.Data Security And ComplianceEnsure data security and compliance with relevant regulations, such as GDPR or industry-specific standards.Infrastructure And DevelopmentBuild and maintain the infrastructure for collecting, storing, and processing data.Design, develop, and manage data pipelines, ETL processes, and data warehouses.Required ExperienceProven experience as a Sr. Data Analyst and/or Data Engineer in an engineering or manufacturing environment.Proficiency in data analysis tools and programming languages, such as Python, R, SQL, and Excel.Strong data visualization skills with tools like Tableau or Power BI.Excellent knowledge of statistical analysis and machine learning techniques.Ability to communicate complex findings and insights effectively to both technical and non-technical stakeholders.Strong problem-solving skills and attention to detail.Familiarity with manufacturing processes and quality control is a plus.Experience with enterprise ERPs (SAP S4HANA, Oracle EBS), CRMs (Salesforce, Hubspot), and IoT.Proficient in working with cloud computing platforms including AWS, GCP, and Azure.Expertise in configuring and optimizing cloud-based data solutions for scalability, reliability, and performance.Bachelor's Degree in Data Science, Statistics, Engineering, or Computer Science Required.Apply Now and be part of a team shaping the future of data-driven innovation in engineering and manufacturing!Employment Type: Full-Time"
