job_title,company_name,location,job_link,job_id,job_description
Consultant Strategy & Transformation (mensch),bynd,"Hamburg, Germany (Hybrid)",https://www.linkedin.com/jobs/view/3755246051/?eBP=CwEAAAGMTrHQcKlxI8cp0wLcbXMjlB7O1_P3imkO03d9pweKdVh31NQuAwyZS14bnj-JYS856Sr6czpn07Sd4sbW7cqY286aDGfY-p325S_Pps147K0H99KuFKmPvGfinEYcZXaXRS-oB4aeTx8BNBO2WCtx1RjzEBgZsSuMuKs1J9qGNoD6vbqBefByPePQO8i8Y_d-G_QEPZVm3MIFsB2c2yXIE7_y9hmHWjxHxJbq-6fbL7idyMofsX5KOI4RiLJZQgugi4D7x3DQRjd5jztqvqPJFymZpyhFqC02vlznalbpWXwiwBM9shlvsqiFsbl4MEvY-L3AxJXEaopXAWyVE9fjbcPkrbpYmNU6NchqqFXQWnt_NYqP84U-JiGjB-eHUJs&refId=baiwHeb3l%2Fl%2BPSjfKlQBUg%3D%3D&trackingId=mDfMD06gx%2BiNhHkipuKN8A%3D%3D&trk=flagship3_search_srp_jobs,3755246051,"About the job
            
 
„Wir sind ein innovatives und dynamisches Team, das kundenzentrierte Beratung mit einer Can-Do-Mentalität verbindet.“ Wir wollen gemeinsam mit dir zusammen Marketing-Organisationen nachhaltig transformieren.Wie wir das erreichen? Unser Ziel ist es, Unternehmen in den Fokus ihrer Konsument*innen zu rücken und datenbasiertes Wachstum zu generieren. Dafür begleiten wir unsere Kund*innen ganzheitlich: von der Strategiekonzeption bis hin zur erfolgreichen Umsetzung.Was das für uns bedeutet? Wir entwerfen kundenzentrierte Strategien und schaffen mithilfe einer effektiven Technologie- und Datenarchitektur sowie durch Datenanalysen messbaren Erfolg. Aufgrund unserer Erfahrung und Leidenschaft erkennen wir dabei Marketing-Trends frühzeitig und leben genau die Agilität vor, die zur Umsetzung unserer Visionen notwendig ist.Bist du dabei? Hey, bei uns bist du genau richtig! Wir schätzen deine individuelle Perspektive und freuen uns über Bewerbungen unabhängig von Geschlecht, Nationalität, ethnischer und sozialer Herkunft, Religion/Weltanschauung, Behinderung, Alter oder sexueller Orientierung. Bei uns hast du die gleichen Chancen wie alle anderen, denn wir setzen uns aktiv für Vielfalt und Chancengleichheit ein.Dein Profil passt nicht 100%ig auf unsere Stellenausschreibung? – das macht nichts.Wir sind gespannt auf deine Bewerbung!Deine Aufgabe bei uns: ganzheitlich & zukunftsorientiert Du unterstützt aktiv – bei der Umsetzung von Beratungsprojekten im Bereich der digitalen Marketing-Transformation.Du identifizierst Trends – führst eigenverantwortlich quantitative und qualitative (Potential-) Analysen durch, leitest daraus Optimierungsmaßnahmen ab und unterstützt die gewonnen Erkenntnisse in innovative Strategien zu überführen.Du zeigst hohe Lernbereitschaft und Engagement – um deine Fähigkeiten im Bereich der digitalen Marketing-Transformation zu entwickeln und zu vertiefen.Du bringst frische Ideen und innovative Impulse – um aktiv zur ganzheitlichen Weiterentwicklung von bynd beizutragen.
Darum bist du die beste Wahl: Berater*in & Visionär*in Du verfügst über ein erfolgreich abgeschlossenes Diplom- oder Masterstudium.Du hast mindestens ein Jahr Berufserfahrung in der Beratung oder im Bereich Marketing.Du bringst die Fähigkeit zur analytischen und konzeptionellen Denkweise mit, schätzt die Zusammenarbeit im Team und bist in der Lage, komplexe Zusammenhänge schnell zu erfassen.Dein Sprachgefühl und deine zwischenmenschlichen Fähigkeiten sind ausgeprägt, und du besitzt fortgeschrittene Kenntnisse in der Anwendung von PowerPoint und Excel.Du beherrschst Deutsch und Englisch fließend, sowohl mündlich als auch schriftlich.Selbstverständlich – aber zur Sicherheit erwähnt – erwarten wir von einem Consultant ein hohes Maß an Verantwortungsbewusstsein, Belastbarkeit, Serviceorientierung, Teamplayer-Mentalität und einen professionellen Umgang mit Kunden und Partnern.
Darum sind wir die beste Wahl: Entwicklung & SelbstverwirklichungBei bynd [bɪˈjɒnd] möchten wir, dass du gemeinsam mit uns wächst. Deinen Möglichkeiten sind bei uns keine Grenzen gesetzt – sowohl fachlich als auch persönlich.Da wir mit Unternehmen aller Größe und aus unterschiedlichsten Branchen zusammenarbeiten, bieten wir dir eine breite Auswahl an abwechslungsreichen und anspruchsvollen Aufgaben. Bei uns kannst du kontinuierlich neue Erfahrungen sammeln und dich in spannenden Projekten entfalten. Deinen persönlichen Entwicklungspfad gestaltest du dabei in deiner eigenen Geschwindigkeit. Was wir dir dafür bieten: Die Möglichkeit, die strategische Entwicklung von bynd proaktiv mitzugestalten.Kurze Entscheidungswege und eine offene Unternehmenskultur, denn wir arbeiten über alle Positionen hinweg stets auf Augenhöhe.Gelebte Zusammenarbeit durch außergewöhnliche Events, ein großartiges Team und eine „Offene Tür“ Atmosphäre.Mobile-Office Möglichkeit, bei der du bis zu 80% mobil arbeiten kannst.32 Tage Urlaub und flexibler Überstundenausgleich."
Consultant Strategy Execution (all genders are welcome),Workpath,"Munich, Bavaria, Germany (On-site)",https://www.linkedin.com/jobs/view/3778548379/?eBP=JOB_SEARCH_ORGANIC&refId=baiwHeb3l%2Fl%2BPSjfKlQBUg%3D%3D&trackingId=nzxsLOrXk%2FD%2BRanp8e9vTw%3D%3D&trk=flagship3_search_srp_jobs,3778548379,"About the job
            
 
We are a Munich-based SaaS company and support leading enterprises with our software platform at every step from agile goal management with OKR to end-to-end strategy execution centered around outcomes. With the help of our technology, customers develop greater adaptability and effectiveness in strategy execution. This enables organizations to meet the demands of dynamic markets and a new working world. With user-centric workflow tools and its associated analytics suite, we link goals, metrics, and projects to center teams and organizations around shared outcomes. In addition, our international ecosystem of partners, training, events, and enablement content provides the desired culture change and internal knowledge building to holistically guide companies in their transformation.Workpath is backed by industry experts with many years of experience in leadership and technology. Together we shape the future of work. Join us now!Your future teamWe are passionate about enabling large organizations to implement their strategies more efficiently. By changing their way of working, we empower them to provide every employee more focus and purpose in what they are doing. We value ownership, embrace pragmatism, like seeing the impact of our work and we are eager to learn something new every day - does this sound like you? Then join us at the forefront of driving Customer Success at Workpath.Your meaningful outcomesFirst of all, we are not your typical SaaS company, and this is not a standard CSM role. As a Consultant Strategy Execution at Workpath, you will be responsible for a designated set of customers, ensuring they maximize the value they receive from us. You will guide them through transforming their strategy execution process and implementing the Workpath platform. This means your role ranges from being a change consultant and a strategy execution advisor to an account manager, ensuring a transition of our customers to outcome-focused organizations.Your most important goals Provide advice and guidance how to implement and establish the strategy execution process based on OKRs with the support of our solution and your expertise (every customer onboarding can be seen as individual transformation project)Share insights on how to successfully and sustainably integrate OKRs with other existing processes (e.g KPIs, Performance Management, Project Management, Portfolio Management)Identify customer needs and challenges from conversations and data-sets to position additional Workpath services or software offerings that will help them overcome these challenges
What else? Define metrics to track your customers’ success with the Workpath platformFacilitate Business Reviews to share valuable insights with your customers top-level ExecutivesAnalyze customer data to avoid churn and drive adoption and retentionCollaborate with the Account Team (SDR, AE, CE) to strategically plan for renewals and expansionsLiaise between customers and our Product team to shape the future development of our strategy execution platform
What We Are Looking ForEnergy and motivation matter most to us, we do not believe there is a one-size-fits-all profile for this role. However, drawing from our team’s experience, we have an idea what works well: You have worked in management consulting or a similar role. There you have gained experience in one or more areas such as strategy, strategy execution, transformation, change management, new work and/or agile methodologies. The only hard requirements we have is that you are an owner of your work, you can work independently and that you are an excellent communicator in German and English, conversing with senior leaders at ease.What Sets You Up For Success In This Role You embrace ownership and accountability, take charge and drive scalability for the Customer Success teamYour fast learning and pragmatic mindset helps you adapt to dynamic situations and create innovative formats and processesYou excel in a team environment, leveraging collective strengths but simultaneously thrive when working independently
Discover Our Perks And Benefits Enjoy an attractive salary package with competitive OTE and VSOP, a public transportation allowance, a subsidy to your Urban Sports Club membership, as well as a personal development budgetAccelerate your growth with a steep learning curve through high responsibility from Day 1 and continuous coaching and mentoring from senior colleaguesGain unique insights into Europe’s leading companies and, their challenges in strategy execution and build a network with their top-level leadersWork flexibly from our hubs in Munich and Berlin or the comfort of your home anywhere in GermanyGo explore the world with 40 days of workation per year thanks to our ""Workpath Anywhere"" programThrive in a dynamic agile work environment with a supportive team, open feedback culture and flat hierarchiesRecharge your batteries with initiatives like 2 Mental Health Days per year und free usage of OpenUp to support your mental health
Apply now!Join our mission of shaping tomorrow’s working world by unleashing the potential of millions of employees in businesses all over the world. We are looking forward to meeting you soon. In case you have any questions, don't hesitate to reach out to"
Management consultant,Bisnez,"The Randstad, Netherlands (Hybrid)",https://www.linkedin.com/jobs/view/3775445149/?eBP=CwEAAAGMTrHQcD2gtydlEjEhwvvDGFHUO4S-XFvp3xbqDxXpi33zOB7_e68mD2hkgxa0gNpBteoyAUuCvjVcJwwsAI2a1HQlskkLulGhTWRrg4SfxuJdNoPEJlx2pDMojmGjXBbJ54_6sBcoxSWwrUMEpZre6ksh8c8pNHke0lhZ8ojILfHEPHKfntk3m_UrGnt8G1DqBm_T1ZrWFX1a1vdhz50W58qR7-80gqcTEsRqGUKtOJCKVn4Q4-VeVd1cJcehC6lYjLeKDjSZWUwGeTliFxJZAr09b7T_aJ4cQPDAT97GDTMnaZ5NXr4rxddkHsznlLydviiEw6J5u8vJZOIHt-NmXPWs5hgtkakLbPfn6-GKPVgcKrfd9yJJ4DP-mdAp2ZE&refId=baiwHeb3l%2Fl%2BPSjfKlQBUg%3D%3D&trackingId=a98%2Fhgw2TjS2aCdwl4E9vg%3D%3D&trk=flagship3_search_srp_jobs,3775445149,"About the job
            
 
Als senior management consultant adviseer je onze opdrachtgevers bij complexe verandertrajecten. Denk bijvoorbeeld aan het inrichten van data governance binnen een financiële instelling, of adviseer je een overheidsinstelling rondom data gedreven werken.Maar na het opleveren van het advies is het werk nog niet gedaan. We zijn niet voor niets een veranderbureau! Eigenlijk begint het dan pas: jij zorgt dat het advies wordt omzet in concreet resultaat. Je hebt vanuit je adviesrol een belangrijk rol bij de implementatie. Van het inrichten van processen, het ontwerpen van een nieuwe organisatiestructuur tot het begeleiden van de organisatie bij de verandering. Als management consultant doe je wat nodig is om de opdrachtgever verder te helpen. We ontzorgen en gaan pas weg als het werkt.Als management consultant bij Bisnez adviseer je directies en management op strategisch niveau. Soms doe je dat zelfstandig of in teamverband met collega’s vanuit Bisnez, maar het kan ook zijn dat je als senior adviseur onderdeel bent van een projectteam van de opdrachtgever.Naast het uitvoeren van opdrachten bij onze opdrachtgevers, ben je gedreven om mee te bouwen aan Bisnez. Als senior management consultant bij Bisnez ben je dé gesprekspartner van klant en prospect; je gaat aan de slag als sparringpartner op directieniveau voor onze opdrachtgevers. Naast het uitvoeren van opdrachten, breng je ook nieuwe relaties tot stand. Daarvoor schrijf je mee aan goed onderbouwde offertes en rapporten. Vanuit jouw specialisatie in procesmanagement, datamanagement, informatiemanagement, governance of control krijg je bij ons de vrijheid om te ondernemen.Is dit jouw profiel? Een afgeronde WO-opleiding (bijv. bedrijfs-/bestuurskunde, organisatiewetenschappen, informatiemanagement of vergelijkbaar)Minimaal 10 jaar ervaring in het uitvoeren van adviesopdrachten en het begeleiden van implementatietrajecten op strategisch/tactisch niveau in de publieke sector (gemeenten, Rijksoverheid, zorginstellingen, onderwijs etc.), financiële instellingen (bank- en verzekeringswezen) en/of corporates.Affiniteit met thema’s gericht op de bedrijfsvoering van organisaties (processen, governance, informatie-/datamanagement, financieel management en control)Toegang tot een goed, eigen netwerkJe weet als geen ander vanuit de inhoud de relatie vorm te gevenJe beschikt over een groot relatienetwerk, bij voorkeur binnen het Bank- en verzekeringswezen, Overheid, Zorg, Energiemarkt, Infrastructuur of UtilitiesJe bent gedreven om het relatiebestand van Bisnez uit te breiden
De volgende eigenschappen vinden wij belangrijk: TeamspelerPrestatie gedrevenEen hunter met oog voor kansenGevoel voor het managen van relatiesResultaatgerichtOndernemendJe beschikt over de ‘gun-factor’ dankzij je positieve instelling en hands-on mentaliteitJe neemt van nature snel en soepel de leiding op jeEmotioneel intelligentGevoel voor je omgevingVol overtuigingskrachtDe drive om mee te willen bouwen aan een groeiende, ambitieuze organisatie
Dit is wat wij bieden... Wij hebben een rotsvast vertrouwen in ons aannamebeleid en bieden je bij een match daarom meteen een vast contract aan.Al onze collega’s krijgen een vast salaris met mooie bonusregeling, inclusief een marktconform pakket aan secundaire arbeidsvoorwaarden zoals leaseauto (en/of reizen met OV), iPhone, laptop, pensioenvoorziening etc.De mogelijkheid om jezelf verder te ontwikkelen, zowel door coaching als verschillende interne en externe opleidingsmogelijkheden.Veel verantwoordelijkheidWerken binnen een hecht team van ambitieuze mensen, van jonge professionals tot ervaren management consultants die uitblinken in hun vak. Allemaal collega’s die je met raad en daad bijstaan.Een team dat elkaar zowel binnen als buiten werktijd opzoekt, bijvoorbeeld tijdens één van de door ons georganiseerde teamevents zoals het jaarlijkse weekend weg met alle collega’s en hun partners, borrels en diners, skiën in de Alpen of fietsen in de Elzas.
Meer weten of reageren?Herken jij jezelf in bovenstaande vacature? Spreekt onze verbondenheid en ambitie om opdrachtgevers iedere dag weer het beste van onszelf te geven jou aan, reageer dan op deze vacature. Wij werken alleen met vaste contracten, niet met ZZP- constructies. Heb je nog vragen, neem contact op met Annette Kramer en Janet Husen via solliciteren@bisnez.com."
Business Consultant,Hot ITem Conclusion,"The Randstad, Netherlands (On-site)",https://www.linkedin.com/jobs/view/3764224766/?eBP=CwEAAAGMTrHQcFcnMNM2SnnkntDIiX81bEqvzJeE8nSCjB2IQq8VOUpsneOuvuxE8CQntQ3qHYIvy8KNkRXO-c0sRdKKdclBYfCT6QrR2XX_WYWPwmm4ihKJqsnhhc_N6yhGKmjn3ZGMpxnn0Q3dbU2cuxG94YPzHGxq5b30IYCVyOnvyHFoAZ-UAN3UaRxkn54burHZ7yRQ-acQmu5wHKB6L8U_RID5VapKSHyST0wTzKEgeFuEBGKa-yDNQUlkSoVYs7V8BzNlrL9CayCUi1BiW-Z-mZzwLV_eofFTQtAhT8iq6sl7Pehj640mYw7V5SvShRxOZ1hjjBbu0RDIfQ3euku-_u3iYPW6AZu-S90RPMC42ivwLZD09qGrNNRWTmUYQtg&refId=baiwHeb3l%2Fl%2BPSjfKlQBUg%3D%3D&trackingId=VEi7xVijpFL28cj8OmkC5Q%3D%3D&trk=flagship3_search_srp_jobs,3764224766,"About the job
            
 
Wat ga je doenAls Business Consultant ben je de sparringpartner op C-level, bij organisaties in verschillende branches. Door jouw kennis weet je snel inzicht te verkrijgen in de kern van de uitdaging die de klant heeft. Op basis van de huidige situatie, de organisatiedoelen en jouw visie ben je in staat een passend organisatiemodel en KPI-besturingsmodel te bedenken dat leidt tot focus en betere prestaties. Denk hierbij aan de herinrichting van teams, het veranderen van KPI’s en het verbeteren van processen.Met jouw kennis en bevlogenheid creëer je in alle lagen van de organisatie draagvlak voor de veranderingen. Ook zorg je voor de implementatie van het besturingsmodel en de nieuwe manier van werken. Zo wordt er daadwerkelijk vanuit een eenduidig besturingskader door de managers geacteerd. Jij weet de kennisontwikkeling van het gehele team een boost te geven door jouw expertise.Wie zijn wijHot ITem gelooft in wendbare, datagedreven organisaties die de concurrentie voorblijven door zich snel te kunnen aanpassen aan nieuwe ontwikkelingen. Alles wat wij doen heeft tot doel om de performance van mensen, afdelingen en organisaties onderscheidend te verbeteren. Dit doen wij samen met onze klanten, op basis van kwalitatief goede data en inzicht in de cruciale zaken.Al ruim 25 jaar ervaren we dat onze filosofie écht werkt. We staan voor een scherpe aanpak waarin we doorbraken creëren op het gebied van prestatieverbetering en rusten niet tot de baten zijn geïncasseerd door de klant.Wat bieden wij Een salaris passend bij jouw ervaring en expertiseEen contract voor onbepaalde tijd met mogelijkheid tot parttime werkenEen leasebudget en bonusregelingLaptop en telefoon van de zaakOnkostenvergoeding én internetvergoedingSabbatical opties en een goede pensioenregeling27 vakantiedagen en 2 prestatieverlofdagenAandacht voor een persoonlijk ontwikkelingsplan en veel mogelijkheden om kennis uit te bouwen via cursussen, trainingen en opleidingenFlexibel werken: regie over je eigen werktijden - naast thuis en bij de klant, bieden we je een goed bereikbare werkplek in Amsterdam met een prachtig uitzicht over het IJWekelijkse stoelmassage, een gym, Hot ITem sloep, dakterras en café waar je altijd even een praatje kunt maken met je collega’s
Wat breng jij mee HBO/WO werk- en denkniveauOvertuigingskracht, communicatieve vaardigheden, flexibiliteit en inlevingsvermogenAnalytische vaardigheden, klantgerichtheid en organisatiebewustzijnMinimaal 5 jaar ervaring in een soortgelijke rol van Business ConsultantAffiniteit met factbased besturing en data-oplossingenAmbitie om klanten naar een hoger plan te tillen, samen met je teamUitstekende kennis van de Nederlandse taal"
Strategy Consultant (all genders),Ray Sono,Greater Munich Metropolitan Area (Hybrid),https://www.linkedin.com/jobs/view/3765600012/?eBP=CwEAAAGMTrHQcO_ueDnas3ClVtBbM5xB_JabUmn4HWce4X-IJjctda_Tm0C4a9AqnDFAYO9ffcrK8IlBo5jcNeQ62oooeWHwLP_QapRHnYNk08ljDPgwsx74ITmMSexSJeWtSmYYtNaYMAg7xw2HuAcUO-2AK_J-7lKv2PL1o6u0Ih2KK19-G-YLjISiToA164jjATwPvmf0esWAyZWHs6PfUGNgBs8fPfJwc8xYFw2EinwvKj3ugdU2p_rUdSmzoyB0_7t4isxpoBnhe2WBJr8kbSRen1P4U5xEYaDEBbVuznch7yBf5koNxn1OuH3dNOeSiH3Ye_07lfU1BmG6IEFOYZLO822Dq1AHo5CZdvO4zOjOads3plMy_TKzb5uvP4h3y1g&refId=baiwHeb3l%2Fl%2BPSjfKlQBUg%3D%3D&trackingId=7Qq8nYLMzzpFKHuS9XqGSw%3D%3D&trk=flagship3_search_srp_jobs,3765600012,"About the job
            
 
Digitale TransformationsbegleitungSeit 1992 gestalten wir die digitale Welt von Unternehmen und Organisationen unterschiedlichster Größen und Branchen. Lokal, national und global. Wir sind dabei weit mehr als nur Berater, Ideen- und Impulsgeber oder reiner Umsetzer. Wir verstehen uns als Wegbereiter und Wegbegleiter in der Digitalisierung. Wir beraten bei zentralen Fragen der digitalen Transformation und bauen Marken in allen Kanälen, für relevante Touchpoints, unterschiedliche Devices und in internationalen Märkten auf. Daraus ergeben sich spannende Projekte in abwechslungsreichen und interdisziplinären Positionen.An den Standorten München, Berlin, Frankfurt, Köln oder vor Ort beim Kunden wirken wir an den digitalen Herzstücken namhafter Unternehmen mit: Audi, Austrian Airlines, Bayern Tourismus, BMW, BRITA, BSH Hausgeräte, Deutsche Bahn, Linde, MAN, McDonald’s, National Geographic Deutschland, Voith, WMF und Zeppelin.Strategic Design: Die Unternehmensberatung in der DigitalagenturAls Strategy Consultant (all genders) bist du Teil unseres Strategic Design Teams. Wir fungieren häufig als erster Kontaktpunkt bei neuen Herausforderungen auf Kundenseite, die wir in lösbare Arbeitspakete herunterbrechen. Dabei bedienen wir uns qualitativer und quantitativer Empirie, vielfältiger Innovationsmethoden und smartem Projektmanagement. Unsere Projekte sind meist langfristig angelegt (6+ Monate) und „interessant komplex“. Du bist dabei in Kontakt mit vielen Menschen, Bedürfnislagen und Anforderungen.In deiner Rolle als Strategy Consultant (all genders) …... begleitest und treibst du Innovations-, Produktentwicklungs- und Transformationsprozesse.... bewertest und entwickelst du bestehende digitale Produkte und Produkt-Portfolios mit den passenden Metriken und Methoden – hinsichtlich Geschäftsmodell/Business Case, Customer Need, technischer Machbarkeit und Profitabilität.... analysierst du Kommunikations- und Kollaborationsprozesse, um die Schlüsselstellen für Optimierungs- und Veränderungsmaßnahmen aufzudecken.... konzipierst du Schulungen und Trainings für verschiedene Zielgruppen von der Operativen bis zum Management.... verantwortest du Marktrecherchen, Zielgruppen- und Customer Journey-Analysen.... hältst du überzeugende Präsentationen und (remote) Workshops.Damit du dir unseren Arbeitsalltag besser vorstellen kannst, hier einige unserer typischen Fragestellungen: Wie kann mit Hilfe von KI die Wartung von Kernkomponenten im Stahlwerk optimiert werden?Welche Auswirkungen hat die Digitalisierung im Eisenbahn-Güterverkehr – und welche IoT-Anwendungen können den verschiedenen Marktteilnehmer*innen potenziell den größten Benefit erzeugen?Wie können wir mit einem Kommunikationskonzept dafür sorgen, dass die Unternehmensführung erfährt, was die mehr als 1.000 Mitarbeiter*innen, die für die Wartungs- und Reparaturaufgaben ständig unterwegs sind, im Arbeitsalltag bewegt – und dass sich die Mitarbeiter*innen gehört fühlen?
Das bringst du mitWir sind ein buntes Team mit unterschiedlichen Expertisen – und überzeugt, dass du auch ohne einen bestimmten Studienabschluss oder einschlägige Praxiserfahrung ein wertvolles Team-Mitglied sein kannst.Ob du wissenschaftliche*r Mitarbeiter*in bist und gern im „echten Leben“ wirken möchtest; ob du dich als Agenturtier langfristig niederlassen magst; ob du als Startup-Produktmanager*in etwas mehr Branchenabwechslung im Arbeitsalltag brauchst – erzähl uns, warum wir dich unbedingt kennenlernen sollten und welche unserer Fragestellungen dich besonders interessiert!Das ist uns wichtig Du hast Interesse daran, unsere Kunden auf ihrem Weg der digitalen Transformation zu begleiten und dich in ihre Herausforderungen einzuarbeiten.Du kannst auf ein Set an Methoden zurückgreifen, aber hast keine Angst vor dem weißen Blatt Papier. Deine Erfahrung teilst du gern und aktiv mit dem Team.Du arbeitest dich mit Begeisterung in technische Fragestellungen ein.Es macht dir Spaß, dich in Wort und Schrift präzise auszudrücken.
 Darum wirWir als Ray Sono sind etablierter Player im Markt der Digitaldienstleister, der sich das Startup-Gen, den Innovationsgeist und die ungebrochene Begeisterung für digitale Themen bis heute bewahrt hat. Hierbei setzen wir für unsere Mitarbeitenden auf abwechslungsreiche, inhaltlich anspruchsvolle und innovative Projekte. Zu den spannenden Themen bieten wir unseren Rays außerdem: Flexible Arbeitszeiten ohne Kernarbeitszeit, mobiles Arbeiten, und das bei vollem Überstundenausgleich ab der ersten MinuteArbeiten an schönen Orten – Möglichkeit für mehrere Wochen im Jahr Workation im europäischen AuslandEinen individuellen Entwicklungsplan und entsprechende WeiterbildungsangeboteEine starke interdisziplinäre Mannschaft mit großem Teamgeist, unter der man Zuhörer*innen oder Mentor*innen finden kannDu möchtest mit dem Rad zur Arbeit? Auch hier unterstützen wir mit unserem Partner JobRad die Möglichkeit, ein modernes Fahrrad über Leasing zu erhalten.Mit unserem eigenen Feel-Good-Team arbeiten wir jeden Tag daran, dass es den Rays immer gut geht. Hierzu zählen Verpflegung in den Offices, After-Works, Sommer- wie auch Winterfeste und noch vieles mehr!"
