job_title,company_name,location,job_link,job_id,job_description
Data Engineer,The National Lottery,"Dublin, County Dublin, Ireland (Hybrid)",https://www.linkedin.com/jobs/view/3778438502/?eBP=JOB_SEARCH_ORGANIC&refId=5ICqMn2qjuypwEXQ7aOd3Q%3D%3D&trackingId=crxPciMEHtZIubb6RObbLg%3D%3D&trk=flagship3_search_srp_jobs,3778438502,"About the job
            
 
Basic Function & Purpose of the RolePremier Lotteries IrelandJob Description for Data EngineerDepartment : Business IntelligenceReporting to Data Warehouse ManagerBasic Function and Purpose of this RoleThe role of Data Engineer is a key role in the Business Intelligence team reporting to the Data WarehouseManager. This role will oversee the design, development, implementation and support of data services, datawarehousing and Business Intelligence solutions in National Lottery.Responsibilities of the Job HolderImplementing a programme of work and management of the delivery of BI solutions using latest MicrosoftAzure platform technologies. Ensuring the accuracy of the collection and documentation of end-userrequirements for large complex and some smaller ad-hoc projects and developing and maintaining strongrelationships with key internal stakeholders to understand their systems and BI / Data related challenges.Main Tasks1. Maintain, design & create cloud-based BI using Microsoft Azure environments2. Design, create and maintain optimized data models for business intelligence and reporting3. Hands-on development using the following technologies:  TSQL, SparkSQL Azure Data Factories, Synapse Python / Databricks Spark / HadoopJira
4. Data Warehouse day-to-day administration including reviewing ETL load jobs for consistency, quality,and performance monitoring5. Responsibility for implementation of best practices as they relate to Business Intelligence solutiondesign and data quality / governance strategies6. Plan and analyse automated solutions and processes7. Research data warehousing/business intelligence trends and technological innovations in order tomake appropriate development recommendations8. Working closely with other development & technical staff9. Provide support to business users and application developersQualifications and Desired SkillsFormal qualifications A degree in Computer Science or a related discipline with an InformationTechnology focus.Advanced Certificate/Qualification in Business Intelligence / Data AnalyticsExperience 5+ years of IT experience within the Data Warehouse / Business IntelligencedomainKnowledgeable in business processes and functionsAwareness of systems and application architectureExperience of software development lifecycleExceptional analytical, conceptual, and problem-solving abilitiesStrong understanding of relational database structures, data modelling, datatheories, principles and practicesExperience working in a team-oriented, collaborative environmentExperience in the gaming industrySpecial Skills or Knowledge Exceptional analytical, conceptual, and problem-solving abilitiesEffective communication and interpersonal skillsKnowledge of Machine Learning technologies & algorithmsExcellent organisational skillsExperience working in agile scrum, continuous integration, and deliveryTechnical Skills Very strong SQL & Python development skillsExperience with Azure Data Factories, Synapse, Databricks, Python, PowerBI,Hadoop & Azure Data Lake Gen 2Comfortable with Azure DevOps, GitHub and GIT source control methodologiesExperience with PowerBI is desirableStrong development and design skillsAgile or CI/CD developmentKnowledge of data warehouse methodologies and medallion architectureWorking RelationshipsInternal Head of Analytics, Data Warehouse Manager, BI Developers, Lead Testers, TestManagers, Project Managers, Head of ProgrammesExternal Suppliers, Service Providers, ContractorsThree sentences that describe the person who will get this job  Effective team player - positive attitude, flexible and hard working Willingness to learn and embrace innovative technologies Technically astute specialising in SQL & Python"
Senior Data Engineer/Architect,Vivid Resourcing,Brussels Metropolitan Area (Hybrid),https://www.linkedin.com/jobs/view/3780133935/?eBP=JOB_SEARCH_ORGANIC&refId=5ICqMn2qjuypwEXQ7aOd3Q%3D%3D&trackingId=rx%2FJsiETWLLC14aYQN%2BG5w%3D%3D&trk=flagship3_search_srp_jobs,3780133935,"About the job
            
 
Role: Senior Data Engineer/ ArchitectLocation: BrusselsI'm currently representing an international company based in Brussels looking for an expert Data Architect to autonomously design, implement and manage the data infrastructure to support data-driven decision making processes and business strategies. You won't be expected to just doing one task repetitively, as you'll have exposure across various different projects and therefore will be challenged to evolve yourself around different tools and technologies which you may find below.What you need: Bachelor's degree in Computer Science, Software Engineering, or a related field (or equivalent work experience).Proven experience (4+ years) as a Data Engineer Expert in ETL processes, integration & data management tools (Snowflake, Power Automate..)Hands on experience with Microsoft Power Platform is a plusFamiliarity with version control systems, such as Git.Ability to work projects from A to Z autonomously.Excellent communication skills, both written and verbal in Dutch OR FrenchStrong Analytical and logical skillsExposure to C#, Python, SQL, Powershell is a plus
Offer: Competitive salary (4000-5000 gross)Full benefits package- (Company car, fuel card, meal vouchers, phone subscription etc.)Flexible work hours and remote work options - up to 3 days p/wCareer growth opportunities and professional development programs.Collaborative and inclusive work culture fostering creativity and innovation.
If you feel you're right for this role or would at least like to know a little more about this role, please don't hesitate to reach out to: david.tran@vividresourcing.comThanks!"
AWS Data Engineer,Capgemini,"Podedwórze, Lubelskie, Poland (Hybrid)",https://www.linkedin.com/jobs/view/3740412713/?eBP=JOB_SEARCH_ORGANIC&refId=5ICqMn2qjuypwEXQ7aOd3Q%3D%3D&trackingId=Nvo4iv191tg3Qayxk1aqZw%3D%3D&trk=flagship3_search_srp_jobs,3740412713,"About the job
            
 
We work in a hybrid model! Recruitment process for this position is conducted online.Software Center jest częścią Grupy Capgemini.Wspieramy naszych klientów, wykorzystując wiedzę, doświadczenie i zaangażowanie naszych specjalistów. Nasze biura znajdują się we Wrocławiu, Poznaniu i Gdańsku. Realizujemy projekty z wielu branż — od logistycznej, motoryzacyjnej, rozrywkowej, po publiczną i chemiczną. Jesteśmy ekspertami w wielu technologiach, tj. Java, Cloud, .NET, React czy testowanie.Department DescriptionInsights & Data practice delivers cutting-edge data centric solutions.Most of our projects are Cloud & Big Data engineering. We develop solutions to process large, also unstructured, datasets, with dedicated Cloud Data services on AWS, Azure or GCP.We are responsible for full SDLC of the solution: apart from using data processing tools (e.g., ETL), we code a lot in Python, Scala or Java and use DevOps tools and best practices. The data is either exposed to downstream systems via API, outbound interfaces or visualized on reports and dashboards.Within our AI CoE we deliver Data Science and Machine Learning projects with focus on NLP, Anomaly Detection and Computer Vision.Additionally, we are exploring the area of Quantum Computing, searching for practical growth opportunities for both us and our clients.Currently, over 250 of our Data Architects, Engineers and Scientists work on exciting projects for over 30 clients from different sectors (Financial Services, Logistics, Automotive, Telco and others)Come on Board!Your Future Tasks design and implementation of solutions processing large and unstructured datasets (Data Mesh , Data Lake or Streaming Architecture);implementation, optimization and testing of modern DWH/Big Data solutions based on AWS cloud platform and Continuous Delivery / Continuous Integration environment;data processing efficiency improvement, migrations from on-prem to public cloud platforms.
Frequently Used Technologies AWS CloudPython/ PySparkGlueRedshiftSnowflakeSQLTerraform
Our Requirements at least 3 years of experience in Big Data or Cloud projects in the areas of processing and visualization of large and unstructured datasets (in different phases of Software Development Life Cycle);practical knowledge of the AWS cloud in Storage, Compute (+Serverless), Networtking and DevOps areas supported by commercial project work experience;theoretical AWS cloud knowledge supported with certificates (for example DVA-C01, SAA-C02, SAP-C01, VDS-C01, DAS-C01);familiarity with several of the following technologies: Glue, Redshift, Lambda, Athena, S3, Snowflake, Docker, Terraform, CloudFormation, Kafka, Airflow, Spark;At least basic knowledge of one of this programming languages: Python/Scala/Java/bash;Very good command of English (German language would be an advantage).
What have we prepared for you? permanent employment contract from the first day;hybrid, flexible working model;equipment package for home office;private medical care and life insurance;access to our NAIS benefit platform;possibility of using increased tax-deductible costs in the case of creative work.
Personal And Professional Development 70+ training tracks with certification opportunities (e.g., MS Azure, AWS, Google) on our NEXT training platform.Platform with free access to Pluralsight, TED TalksCoursera materials and trainings.Free access to Udemy Business account with ability to use during and outside working hours.
Would you like to discover a world of unlimited possibilities and continuous innovation? At Capgemini, we're proud to be a global leader in working with companies to transform and manage their business by harnessing the power of technology. We are guided everyday by the purpose of unleashing human energy through technology for an inclusive and sustainable future.It's time to #Get the Future You Want!Your life is in your hands, and you have the opportunity to improve it, develop yourself, and simply — join us!Do you want to get to know us better? Visit our Capgemini Software website!Do you have any additional questions about working at Capgemini?Check Our Instagram — @capgeminipl Facebook profile — Capgemini Polska.You can also find us on TikTok! — @capgeminipl."
Data Engineer expérimenté 3 ans minimum SPARK/SCALA/PYTHON/AWS/Agile/Anglais (IT) / Freelance,Worldwide People Ltd,"Pessac, Nouvelle-Aquitaine, France (Hybrid)",https://www.linkedin.com/jobs/view/3724626293/?eBP=JOB_SEARCH_ORGANIC&refId=5ICqMn2qjuypwEXQ7aOd3Q%3D%3D&trackingId=1ciCv%2B%2FB%2FZl4RPnNnxe%2FHg%3D%3D&trk=flagship3_search_srp_jobs,3724626293,"About the job
            
 



      This job is sourced from a job board.
      Learn More



Data Engineer expérimenté 3 ans minimum SPARK/SCALA/PYTHON/AWS/Agile/Anglais Data Engineer expérimenté 3 ans minimum SPARK/SCALA/PYTHON/AWS/Agile/Anglais Data Engineer expérimenté 3 ans minimum SPARK/SCALA/PYTHON/AWS/Agile/Anglais Data Engineer expérimenté 3 ans minimum SPARK/SCALA/PYTHON/AWS/Agile/Anglais"
Senior Data Engineer,Jefferson Frank,"Helsinki, Uusimaa, Finland (Hybrid)",https://www.linkedin.com/jobs/view/3736341805/?eBP=JOB_SEARCH_ORGANIC&refId=5ICqMn2qjuypwEXQ7aOd3Q%3D%3D&trackingId=Bq%2B%2B9QEtFEJxhY6f%2BnxABw%3D%3D&trk=flagship3_search_srp_jobs,3736341805,"About the job
            
 
Company OverviewMy client is a dynamic and innovative company specialising in creating world-class data platforms and data-driven solutions for our clients. We work on challenging projects in diverse industries and domains, utilising the latest methods and technologies to deliver exceptional results. Our collaborative and supportive team environment encourages continuous learning and professional growth.Job DescriptionAs a Data Solutions Developer at my client, you will be a key contributor in the implementation of cloud data platforms and the development of data solutions. You will work collaboratively with a team of developers, designers, data scientists, and clients to clarify requirements, define the best approach, and collectively shape the end product.Key Responsibilities  Collaborate closely with cross-functional teams to clarify complex requirements, determine the optimal path forward, and collectively influence the final result. Contribute to the implementation of cloud data platforms, selecting the most suitable technologies and ensuring continuous delivery. Write and maintain high-quality code, participate in code reviews, and assist in the development of the team's best practices. Assume your share of responsibility for the team and project, demonstrating a vision and drive that goes beyond mere coding.
Qualifications  At least 4 years of hands-on experience working with data technologies and software development, with proficiency in AWS or Azure, Python (software development), ETL, and SQL. Appreciation for experience with technologies such as Spark, DataBricks, Snowflake, and real-time data integrations. A strong desire and capacity to learn new data and software development technologies and methodologies. Excellent collaboration skills, characterised by knowledge sharing, peer support, and a willingness to seek help when needed. Effective communication skills and fluency in Finnish (required) and English.
Benefits  Competitive compensation and a comprehensive benefits package. Exciting opportunities to work on innovative projects. Continuous learning and professional development. A supportive and collaborative team environment. Access to cutting-edge data and software development technologies."
Freelance Data Engineer,Foxtek,"The Hague, South Holland, Netherlands (Hybrid)",https://www.linkedin.com/jobs/view/3774831407/?eBP=JOB_SEARCH_ORGANIC&refId=5ICqMn2qjuypwEXQ7aOd3Q%3D%3D&trackingId=aipTRgs0GN4XW3XcJmyt0w%3D%3D&trk=flagship3_search_srp_jobs,3774831407,"About the job
            
 
🚀Freelance Data Engineer Required🚀Work for key financial players in the Netherlands🏦My client is looking for a Data Engineer to join their ongoing project creating built-in controls for their data monitoring processes as well as dealing with legacy sources📊In terms of skills, they're looking for 👇💠Azure💠Data Factory & Databricks💠SQL (Oracle/ Databricks)Details💠6 Month Project (with the possibility of extension)💠32 Hours Per Week💠Hybrid Remote (1 Day a week on-site - The Hague)If you'd be interested in hearing further details about the project then get in touch! 🗣️🇳🇱 +31 20 808 5278🇬🇧 +44 117 248 2000📧 jack.webb@foxtekrs.com"
Data Engineer - One Client Core team,ING Hubs Poland,"Warsaw, Mazowieckie, Poland (Hybrid)",https://www.linkedin.com/jobs/view/3778380181/?eBP=JOB_SEARCH_ORGANIC&refId=5ICqMn2qjuypwEXQ7aOd3Q%3D%3D&trackingId=OcWS5%2BadKvjR0RfgOmrKWw%3D%3D&trk=flagship3_search_srp_jobs,3778380181,"About the job
            
 
We are looking for you if, you have: Hands-on experience building complex data pipelines,Knowledge of data manipulation and transformation,Experience with Apache Airflow, Spark, Python,Experience in setting up and optimizing both SQL and noSQL data stores, as well as familiarity with object storage services (e.g., S3). Knowledge of software engineering best practices,Deployment and provisioning automation tools (e.g., Docker, Kubernetes, CI/CD).
You'll get extra points for: Experience working in cloud environment (e.g., Azure DevOps, GCP),Knowledge of MLOps architecture and practices,Experience managing and further developing distributed systems and clusters for batch processing. Familiarity with data streaming frameworks (Kafka/Flink),Familiarity with monitoring and observability (ELK stack),Agile way of working,Comfortable working in the international and cross-functional teams.
Your responsibilities: Design, build, and maintain our big data infrastructureDevelop data processing scripts using PySparkIntegrate various data sources, ensuring data integrity and consistency.Develop and implement data architectures, data models, and data ingestion pipelines.Troubleshoot data issues, providing robust solutions to ensure optimal performance and reliability.Continuously optimize our systems for performance and cost-effectiveness.Document technical specifications, procedures, and outcomes.Use Azure DevOps for CI/CD, task tracking, version control, and other DevOps practices.Evidence IT risk related to data assets.Improve data products based on customer feedback.
Information about the team:You will work as a data engineer in our core Analytics squad – One Client Core (OCC) within the ING Analytics Wholesale Bank Global Tribe. The squad provides curated data on Wholesale banking (WB) clients via various channels that include API, dashboards, and databases. Target audience is everyone in WB who wants to use data to build products, automated services, dashboards, reports, and models. You will be part of the squad consisting of the data analysts, engineers, and product manager."
Data Engineer,HP,"Sant Cugat del Vallès, Catalonia, Spain (Hybrid)",https://www.linkedin.com/jobs/view/3779113883/?eBP=JOB_SEARCH_ORGANIC&refId=5ICqMn2qjuypwEXQ7aOd3Q%3D%3D&trackingId=DiHliHW28nzhXebt1MA%2BEQ%3D%3D&trk=flagship3_search_srp_jobs,3779113883,"About the job
            
 
We are looking for a Data Engineer to join our team and help us build and maintain scalable data pipelines and systems. You will be responsible for designing, developing, testing, and deploying data solutions that meet the needs of our clients and stakeholders. You will also collaborate with data analysts, data scientists, and other data engineers to ensure data quality, reliability, and performance.If you are interested in working on petabytes of data from millions of devices. If solving complex data issues excites you this is the opportunity for you.Responsibilities Leads the team to write, deploy, and maintain software to build, integrate, manage, maintain, and quality-assure data.Architects, designs, implements, and maintains reliable and scalable data solutions in the AWS cloud environment using Scrum/Agile methodology.Implement data ingestion, transformation, and processing workflows using ETL tools and frameworks.Researches and promotes new tools and techniques to shape the future of the data engineering environment.Ensure data security, privacy, and compliance with relevant regulations and policies.Monitor, troubleshoot, and debug data issues and performance bottlenecks. Guides team to deploy secure and well-tested software that meets privacy and compliance requirements; develops, maintains, and improves CI / CD pipeline.Document and communicate data engineering processes and solutions to stakeholders and users.Represents the data engineering team for all phases of larger and more-complex development projects.Works with following site-reliability engineering standard methodologies: on-call rotations for services they maintain, responsible for defining and maintaining SLAs. Design, build, deploy and maintain infrastructure as code. Containerizes server deployments.Actively contributes to improve developer velocity.
Knowledge & Skills Demonstrable coding expertise in one or more object-oriented programming languages (e.g., Python, Scala, Java, etc.)Deep and hands-on experience (5+ years) designing, planning, productionizing, maintaining, and documenting reliable and scalable data infrastructure and data products in complex environments.Hands on experience with: Expert in AWS tools and services such as S3, Glue, Lambda, EMR, Redshift, Athena, etc.Experience with other cloud platforms and services such as Azure, GCP, etc. is a plus.Experience with data quality, testing, and validation tools and techniquesExperience with data visualization and reporting tools such as QuickSight, Tableau, Power BI, etc.Strong analytical and problem-solving skillsExcellent communication and collaboration skill 
Understanding Data Structures & Algorithms & their performanceExperience designing and implementing large-scale distributed systems.Deep knowledge and hands-on experience in technologies across all data lifecycle stagesInternal client management and ability to lead large organizations via influence .Ability to effectively communicate product architectures, design proposals and negotiate options at senior management levels.
Education & Experience Bachelor's or Master's degree in Computer Science, Information Systems, Engineering, or equivalent.
About HPYou’re out to reimagine and reinvent what’s possible—in your career as well as the world around you.So are we. We love taking on tough challenges, disrupting the status quo, and creating what’s next. We’re in search of talented people who are inspired by big challenges, driven to learn and grow, and dedicated to making a meaningful difference.HP is a technology company that operates in more than 170 countries around the world united in creating technology that makes life better for everyone, everywhere.Our history: HP’s commitment to diversity, equity and inclusion – it's just who we are.From the boardroom to factory floor, we create a culture where everyone is respected and where people can be themselves, while being a part of something bigger than themselves. We celebrate the notion that you can belong at HP and bring your authentic self to work each and every day. When you do that, you’re more innovative and that helps grow our bottom line. Come to HP and thrive!"
Senior Data Engineer (f/m/d) Azure Cloud - Expert Services,E.ON,"Essen, North Rhine-Westphalia, Germany (Hybrid)",https://www.linkedin.com/jobs/view/3772366586/?eBP=JOB_SEARCH_ORGANIC&refId=5ICqMn2qjuypwEXQ7aOd3Q%3D%3D&trackingId=0%2BGtzHV%2BywzQMdUgcp3JAw%3D%3D&trk=flagship3_search_srp_jobs,3772366586,"About the job
            
 
Job DescriptionDo you love data and technology? Do you think we all need to become more sustainable? Are you ready to drive and boost the green energy transition? Then this is the right job for you. Your energy shapes the future!Being aware of the enormous responsibility we have for our customers, our assets, and the environment, we are analyzing and developing solutions, utilizing advanced big data and machine learning technologies to provide the best service, improve the efficiency and make things smarter, better, and cleaner.What You Are Responsible For Develop and execute a comprehensive data architecture and machine learning operations (MLOps) ssolutions aligned with the organization's goals and objectives. Serve as primary point of contact for the leadership team and mentor other team members to learn new skillsSupport individual projects and initiatives at the initial stage when being set-up working with the team on a fitting architecture. Take ownership of the technical evaluations of new candidates in the hiring processStay up-to-date with industry trends and emerging technologies related to data architecture and engineering. Evaluate and recommend new tools, technologies, and methodologies to enhance data management and analysis capabilities. 
What You Are Good At You have 3+ years of professional experience in a leading data architecture or engineering role. You have a degree/PhD in Computer Science or a related technical discipline or other significant work experience and you love mathematics and statistics. You have extensive knowledge of Azure, AWS and GCP cloud environments, architecture best practices and tools relevant for machine learning / AI use casesYou have extensive knowledge and hands-on experience of Infrastructure-as-Code frameworks, such as Terraform and/or ARM templates. You have proven experience in ETL processes, data extraction, transformation, and loading. Familiarity with Azure Data Factory, Azure Databricks, and Azure Synapse Analytics are a plus. You have extensive knowledge and hands-on experience of DevOps, CI/CD pipelines and deployment best practices. You have knowledge of Machine Learning frameworks like scikit-learn, Tensor Flow, PyTorch, Azure ML, etc. (including ML interpretability). You have excellent programming skills in Python, SQL,You enjoy collaborating internationally and across cultural borders. You have excellent communication and presentation skills. You are fluent in English and German. You have extensive knowledge in the energy industry (considered as plus)
What you can expect from a Career in E.ON Digital Technology We offer the unique opportunity to combine your love for technology with your passion to work on a topic of high relevance for society. You will be able to contribute to E.ONs ambitious digitalization strategy, to apply and broaden your expertise on a variety of assignments, to work with cutting edge technology and to have the opportunity to grow your career internationally across the wider organization.InclusionIt is important to us that people with disabilities have access to a fair application process, providing them with an opportunity to shine. Therefore, our representative body for severely disabled people will be included in the process from an early stage. Please let us know via the application form if you require technical or organisational adjustments during the application process. We will strive to make the required aids available.Should you not be able to apply online and want to speak someone in person, please contact your local recruiter."
