job_title,company_name,location,job_link,job_id,job_description
Senior Data Engineer,Mavie Recruitment,Antwerp Metropolitan Area (Hybrid),https://www.linkedin.com/jobs/view/3773501441/?eBP=CwEAAAGMQCtRABhTt89zL1awvveDD_3w3q_h3r9fMNBVYMbvPAnUmvLwMUVkJ8bBgxubCE1AeYo1dVK0xHo4SjpPYGZuZuE14upD5mK94DOAXrW73LxSHpjG_gBzOqgQ79chf_t3fShbfIrVWTHeD_QdAc5d7qGTT_-zGTd8G5tXqmIJkRE3Qnc5n5dp4gRFUeqf3hbmeu2pMWgNpgRbOytjAHegmc7MH79vH3eFO5PRnXommUKLxuETAyLNeLpHJ-T8RZVm0Cit1AfJktA-HhtyF0BGX_PGWRgd7W6TfEidrFjEF0qn4R3L_7ifA-mLKLNCXGOFsV4kLjAtIAJBJVMGUQyak3DeGaWL27vld90lG7DG2WhuXKtjIrZ3aubZi5Atmm0&refId=FpRCaotmX%2FOEwB4pjwvAng%3D%3D&trackingId=dMvUOvVskrWL2nN2o7i8cQ%3D%3D&trk=flagship3_search_srp_jobs,3773501441,"About the job
            
 
Het ontwikkelen van data rapporteringen en analytics voor industriële omgevingen waar klanten vooral met modern technologieën werken boeit jou ontzettend.We spreken hier over een start-up bedrijf op zoek naar gedreven data engineers om hun team uit te bouwen en vorm te geven. Vind jij je in onderstaande beschrijving, neem dan contact op!  Jouw verantwoordelijkheden Je hebt al wat ervaring opgedaan:
 Je hebt 2+ jaren ervaring in data engineering en/of software engineering Kwaliteit van onze opleveringen is voor ons extreem belangrijk: Je hebt ervaring in software engineering best practices (CI/CD, documentation, testing) Je bent vertrouwd met het werken in agile omgevingen Je houdt van een uitdaging waarin je complexe vraagstukken van klanten tot een technisch efficiënte oplossing brengt Je hebt ervaring met de tech stack waar we in werken (of relevante andere ervaring): Apache Spark, Databricks, Azure, Kubernetes, PowerBI, Python/Scala/Java, PostgreSQLZowel streaming data vanuit meerdere bronnen als batch data laten je hart sneller slaan Je hebt een sterke interesse in of ervaring met: sensordata, operationele rapportering voor manufacturing opgevingen, OT-datastromen, Historian databases (OsiSoft PI, Wonderware)
Het aanbod:Een brutosalaris in lijn met je ervaring, aangevuld met de nodige voordelen: Wagen met tankkaart/oplaadkaart Maaltijdvergoeding Netto onkostenvergoeding 20+12(ADV) vakantiedagen Cafetariaplan Groeps -en hospitalisatieverzekering Flexibiliteit in thuis en kantoorwerk Opleidingstrajecten intern en extern De kans om certificaten te behalen. Meer informatie nodig? No worries, die geef ik met plezier!"
Senior Data Engineer (all genders),Austrian Lotteries,"Vienna, Austria (Hybrid)",https://www.linkedin.com/jobs/view/3774495763/?eBP=CwEAAAGMQCtRABCH2i0qVT9Ci0snEx1BkJ0nYALURmIK3E3mD8265fgn28899iGuadR6PYIjS-2Zh0evveRl9d19yOrbrORfhLpizpM2-ZeIcXTD-aSFMsarvy4jlVPS9exwo1I3mEKjhHryZD9YyuMdwMWkaomzJkxFO-YT_hvsGEuT5eRZKYKLUwaixeQNE_-53lEZyW0hkTZSV0aXNwO1_EZ17jqdwKmwYUyKJ2N0F5Cz9J1TB7eSeaPbpfsBIkgZi_XvL4Yr96t35wQvQrY3F-ZfYvyW9M57_pwtuK7tDcHegBJP4m7u0y48MtgmaQqwJYPxwOThXsiKePUK8FwrDQA5jCRDuhzmKPpNgVQ62VRpLw_aCb5K4D0gMskcyTlzR6k&refId=FpRCaotmX%2FOEwB4pjwvAng%3D%3D&trackingId=qBXqYK5H3FHbMzuW2aiqjA%3D%3D&trk=flagship3_search_srp_jobs,3774495763,"About the job
            
 
Als führende Kraft in der Welt des legalen Glücksspiels in Österreich ist es unsere Mission, leidenschaftliche Hingabe für Mensch, Spiel und Umwelt zu beweisen. Wir entwickeln unsere Glücksspielprodukte (wie etwa Lotto, Bingo oder Brieflos) täglich verantwortungsbewusst und mit großem Engagement weiter.Zur weiteren Verstärkung unseres Teams suchen wir eine:n Senior Data Engineer (all genders)Dein Beitrag zum Glück: Du arbeitest in interdisziplinären Teams mit agilen Methoden hautnah bei spannenden Projekten mit, unterstützt bei der Evaluierung der Anforderungen unserer internen Stakeholder und setzt diese mittels unterschiedlicher Tech-Stacks um.Mit hohem Qualitätsbewusstsein bist du für die Konzeption und Implementierung von Datenpipelines zur Sicherstellung effizienter und effektiver Datenflüsse zuständig.Deine Expertise bringst du bei technologischen Entscheidungen ein.Du hast Spaß daran neue Technologien kennenzulernen und bei der kontinuierlichen Weiterentwicklung eines modernen Environments mitzuarbeiten (Data Lake)
Darum bist du unser Gewinn: Abgeschlossene Ausbildung mit IT-Background (HTL/FH/Uni, etc.)Mehrjährige Berufserfahrung in den Bereichen Data Engineering sowie relationale Datenbanken und SQL (idealerweise Oracle)Datenmodellierung, ETL-Prozesse, Data Pipelines, Python, Spark und Databricks sind für dich nicht nur Begriffe, sondern du hast sie auch schon produktiv eingesetztInteresse für Plattform-Technologien und -Services wie AWS oder AzureHohes Security-Bewusstsein, Lösungskompetenz sowie ausgeprägte TeamorientierungBegeisterung für Neues und die Motivation zur kontinuierlichen Weiterbildung
Mit diesen Technologien arbeiten wir: Databricks, AWS Cloud, Python, Spark, SQL, dbt (Data Build Tool), GitLab CI/CD, Terraform, OpenMetadata, Lakehouse, JIRADein Jackpotmodernes Arbeitsumfeld in unserem Innovation Hub l gute öffentliche Verkehrsanbindung, Citynähe l kollegiale Atmosphäre im motivierten Team l flexible Arbeitszeiten und umfangreiche Home-Office-MöglichkeitInteresse? Mach den nächsten Schritt und bewirb Dich online mit Motivationsschreiben, Lebenslauf und Zeugnissen. Wir freuen uns auf Dich!Als Arbeitgeber l(i)eben wir in unseren Teams Vielfalt und bieten motivierten Persönlichkeiten ein spannendes und abwechslungsreiches Umfeld - wir freuen uns besonders über Bewerbungen von Menschen mit Behinderungen.DienstortWien ZentraleEintrittab sofortBeschäftigungsartVollzeitGehaltQualifikationsabhängigesJahresbruttogehalt abEUR 70.000,--KontaktMartina CodemoTel.: +43 664 88911739"
Data Management Engineer with Collibra - EY GDS Spain - Hybrid,EY,"Málaga, Andalusia, Spain (Hybrid)",https://www.linkedin.com/jobs/view/3778695781/?eBP=CwEAAAGMQCtRADDUECzgOy2wz1N9j-sIhJATI6aDiaVsXDXKMq1Lq-ywPmpxIG4MpXMbkDEZ1KoAT-65qez0vHOwEEm3cyjhoUqzl2gz4DsPwJMEh68x_MQHjCnZkZorl-2y9KWSWP4LSQsk3YQMZVADSQ-pT6TMevDAFAoDXL0Cn9YLoyWt12yCCqv2C7HIgWUAWulMnObFGht8gKAhm5S0i764k8zjonDIecgW2yHVrbls29fHUUyGzfWn3H3zNwAehLtveRl8Xdz-1WVtmTmuWkIxXFJq6thmjDjykbAJEe-S6RT_wKGh44NzS09Zh4YvHO6A_99VWkFcvdSUfT_Fb7ou&refId=FpRCaotmX%2FOEwB4pjwvAng%3D%3D&trackingId=%2BxRuHq3RhB9iXxlNpwWbGg%3D%3D&trk=flagship3_search_srp_jobs,3778695781,"About the job
            
 
Data Management Engineer with CollibraWe are looking for Data Management Engineer, an experienced Collibra developer who presents self-motivated working style with strong personal ownership of problem resolution. We are looking for a top-notch technology savvy specialists willing to move our projects on the new track!As a member of our team in the EY GDS Spain office in Malaga, you’ll have a chance to extend your knowledge & experience by working on interesting projects with the newest technologies and approaches. You’ll support clients in choosing the most suitable business solution and take part in digital transformation. Your Key Responsibilities You will be responsible for the support of Data Management programmes. You will automate various processes configuring Collibra software and integrating it into client environment. Your work will be based on key DAMA framework good practices (Data Governance, Data Quality, Metadata Management). You will support building the data management business cases that will inspire the organisation to learn and operate by DAMA standards. 
Skills And Attributes For Success Ability to discuss, agree and document requirements and implement them by configuring and integrating Collibra software. Participating in a cross-functional initiatives and collaborating across various domains. Interacting with engineers, product/project managers and partners from all over the world.Ability to work independently and as part of a team.
To qualify for the role, you must have Commercial experience with at least one of Collibra products/components: Data Catalogue, Data Lineage, Data Governance, Data Protection and Security, Data Quality.1+ years of commercial experience in technical implementation of one of areas: Data Governance, Data Quality, Metadata Management.3+ years of commercial experience in IT services, preferably in activities connected with Data Management (e.g. Data Warehousing, Data Visualisation, Data Stewardship etc.).Understanding of DAMA standardsUnderstanding of the importance of governance and security rules while handling dataAbility to build a strong data governance case and story tellingVery good English verbal and written (min C1)
Ideally, you’ll also have Experience with other Data Management tools like: Informatica, Purview, Ab initio, Alation, Profisee is a plus.DAMA/Collibra certifications.Experience with BI tools like Power BI or Tableau.Working knowledge of SQL.Experience in Collibra in workflow development and Collibra Administration.Intermediate level Cloud hands-on experience.
What We Look ForAs we are a dynamic team of passionate specialists, and we work in international teams all over the world, we will look for the same business acumen. Facing with customers, we are ""out of box thinking"" professionals.  Our top performers have a team player  attitude and they cope with challenges on the daily basis. If  it all sounds familiar to you - we are looking forward to seeing you on board.What We OfferIn EY GDS Spain, you will collaborate with our teams on exciting projects and work with well-known brands from across the globe. We’ll introduce you to an ever-expanding ecosystem of people, learning, skills, and insights that will stay with you throughout your career.  Continuous learning: You’ll develop the mindset and skills to navigate whatever comes next. Success as defined by you: We’ll provide the tools and flexibility, so you can make a meaningful impact, your way. Transformative leadership: We’ll give you the insights, coaching, and confidence to be the leader the world needs. Diverse and inclusive culture: You’ll be embraced for who you are and empowered to use your voice to help others find theirs. 
About EY GDSEY Global Delivery Services (EY GDS) is a dynamic and truly global delivery network of over 75,000 people working across the world, to provide innovative and strategic business solutions to our clients worldwide. We play a vital role in growth strategy, helping our clients become agile and efficient, and helping fulfill our purpose to build a better working world.From accountants to coders, we offer a wide variety of fulfilling career opportunities that span all business disciplines. We look for skills that are evergreen and our roles evolve with industry trends. We also work across Finance, Business Development, Technology, Talent, Procurement and Risk Management functions to help our teams operate as efficiently and effectively as possible.Across our 10 locations and 21 cities, we work with teams from all service lines, geographies, and sectors. We operate in Argentina, China, Hungary, India, the Philippines, Poland, Sri Lanka, Mexico, Spain and the United Kingdom.Our EY GDS Spain office is located at Malaga Technology Park and currently employs over 750 people.If you are interested in being part of our team, we kindly invite you to get in touch with us.The exceptional EY GDS experience. It’s yours to build."
Sviluppatore Bi/Data Engineer,TALEA GROUP SPA,"Viareggio, Tuscany, Italy (Hybrid)",https://www.linkedin.com/jobs/view/3715633198/?eBP=JOB_SEARCH_ORGANIC&refId=FpRCaotmX%2FOEwB4pjwvAng%3D%3D&trackingId=7GPqvqMsdZpGusLX2U8h0w%3D%3D&trk=flagship3_search_srp_jobs,3715633198,"About the job
            
 



      This job is sourced from a job board.
      Learn More



Talea Group Spa è alla ricerca per inserimento in organico di una figura di esperto Sviluppatore Bi/Data Engineer preferibilmente con esperienza in Talend, da inserire all'interno della funzione ICT.ResponsabilitàProgettare, sviluppare e mantenere soluzioni di integrazione dati utilizzando Talend;Collaborare con il team per comprendere le esigenze aziendali e tradurle in soluzioni tecniche efficaci;Eseguire analisi dei dati, identificare trend e fornire reportistica accurata;Gestire e ottimizzare il flusso dei dati per garantire l’integrità e la sicurezza dei dati;Monitorare le prestazioni del sistema e proporre miglioramenti.RequisitiComprovata esperienza come Sviluppatore Bi/Data Engineer;Conoscenza approfondita di Talend per l’integrazione dei dati o di strumenti simili;Capacità di lavorare con dati strutturati e non strutturati;Ottima comprensione del processo ETL (Extract, Transform, Load) e delle best practice di data integration;Conoscenza di linguaggi di query e scripting (SQL,Java, Python, etc.);Forti capacità analitiche e problem-solving.Cosa Troverai Da NoiUn ambiente di lavoro giovane e stimolante;Colleghi altrettanto appassionati con cui confrontarmi ed imparare;Possibilità di contribuire attivamente ai successi dell'azienda e di veder riconosciuti i tuoi meriti indipendentemente dalla tua seniority;Flessibilità, smart working e welfare;Incontri periodici di feedback che ti permetteranno di accrescere la tua professionalità e migliorare le tue performance;Momenti di aggregazione, condivisione e celebrazione dei successi;Iniziative volte alla formazione ed allo scambio di competenze.Sede di lavoro: Viareggio (HQ) + Smart Working"
Data Engineer (Scala),Signify Technology,"Berlin, Germany (Hybrid)",https://www.linkedin.com/jobs/view/3767601137/?eBP=CwEAAAGMQCtRAOn-ib6eHIHA7ybfSVexKnP8kCaOFFA8VzZcEy58DKkeMYoMmTwf8gE-Iw9fT8WM5rsLAbwL8J6H8iwmrUkd1u2A9Hh-viBb9MReZN2BjHRAbA3hWq28bDEtEQgmbyTDDHfoP4sS-9GjIqKIkxMvFabzKSs9sAydsJ874708-zMctkx641jA_ZmgbsMvkVddNVs10dqXWniL46t8h88xCu-IkTZXD46HXAiceWgpximuhZbRe1Qp7d2ZnhFwHqvJvMw3R-xpXZ-qcCtGAJ-QQqlFtGE-Qbu3sCU65YPjwHiJQWPOJekZiGp8Py_KVyY9rlFxfbXRDVzD2P5KLX2DmNmM2lGtTEF-bP7zjOGakBPVDJ4A3eN77wxt&refId=FpRCaotmX%2FOEwB4pjwvAng%3D%3D&trackingId=B9nYqE8ewacMl6Z%2Bx4Xf3g%3D%3D&trk=flagship3_search_srp_jobs,3767601137,"About the job
            
 
Data Engineer (Scala)The role in a nutshell:- 12 month contract- Hybrid (Berlin)Are you a passionate Scala expert with a flair for transforming financial data into actionable insights? We're on the lookout for a skilled and innovative Data Engineer to join a boutique finance company based in Berlin. What the role will include: Develop robust and scalable data pipelines using Scala, ensuring efficient processing and integration of financial data.Collaborate with cross-functional teams to understand and address specific data requirements, ensuring the seamless flow of financial information.Optimize data storage and retrieval processes, maintaining the integrity and security of financial data.
Requirements: Proven experience as a Data Engineer with a focus on Scala development.Strong proficiency in Scala programming and a solid understanding of functional programming concepts.Expertise in designing and implementing ETL processes for financial data.Experience with big data technologies such as Apache Spark for large-scale data processing.Knowledge of financial instruments, markets, and industry-specific data challenges.Familiarity with distributed systems and cloud platforms, preferably AWS, GCP, or Azure.
If this role sounds of interest, please apply / send me the most up to date version of your CV and I will be in touch.Interviews will commence backend of this week / start of next week.Behind every piece of technology, is a person. We connect diverse and innovative talent to organisations and companies that need them the most.Please let us know if you need any reasonable adjustments made during the process.We make an active choice to be inclusive towards everyone everyday. If your CV isn’t fully up to date don’t worry we will work with you to make it the best reflection for you."
Azure Data Engineer,Luxoft,"Wrocław, Dolnośląskie, Poland (Hybrid)",https://www.linkedin.com/jobs/view/3761050290/?eBP=CwEAAAGMQCtRAH4xJSw_T5l-ovAvzuEoSDB6hx511n-DlQBvRq9pV3OP43TcgdPNDJSRQBZzTROdqMgTom5XyhYY-6QU02TdmPWn5pd7jasIV4SCJ1hZ9X8B7Y9bcdjZzT5aSIkkDaMOpCsRITtjsiTDhFiD-UqSTYqwO7tmRO16RIsn8H6ZxCmuGIhwhgAf7415ioW6umQMMZK_haJl2PhhQzHk9k0CBi_9vaQhgbvmieKD5WTrv3XsKGN6BXOu_xMYfwqggO038QvCCk1cqRuBPqcVdBFsCI6hC1fYNYLmSm4El2vSG7P2RjxSyD3ABZvULXX1px5ujRKBX1xcLIdmGM7zicpdre2JjmtWyWSj3PwhJhh13FetAx6PM3xBtHq1vBM&refId=FpRCaotmX%2FOEwB4pjwvAng%3D%3D&trackingId=DMwu0r9I1TXiFIisIAb%2FZA%3D%3D&trk=flagship3_search_srp_jobs,3761050290,"About the job
            
 
Project DescriptionYou will be working in a global team within the Markets Regulation Technology. We are working on key business intelligence/reporting programs, supporting the bank in meeting its global regulatory obligations.Responsibilities• design and implement data solutions• develop and maintain scalable and efficient data pipelines• build reusable code, optimize and improve data processes• collaborate with team members and other teams in an agile environment• ensure the highest quality of deliverablesSkillsMust haveWe are seeking a highly experienced Data Engineer who possesses the following qualifications:• 5 to 10 years of experience in building data models and reporting solutions.• 1 to 2 years of experience working with native Cloud data and reporting solutions such as Azure SQL and Power BI.• SQL Development skills• Power BI Development skills• Pipeline in DevOps (CI CD pipeline experience in Azure & GitLab)• Azure Functions with C#• Familiarity with Azure big data services as a data engineer.• Experience using Azure for Compute, Containers, Big Data, and Data Analytics, including Data Lake, Data Factory, and Stream Analytics. You will be responsible for validating security configurations on Microsoft Azure cloud solutions.Nice to have• 4+ years of experience in building data processing and reporting solutions• Solid experience with a wide range of Azure services: Azure SQL DB, Databricks (Spark) and/or Synapse, Power BI• Strong Python programming skills• Understanding of Lakehouse architectureLanguagesEnglish: B2 Upper-Intermediate"
Data Engineer,Digital Turbine,"Warsaw, Mazowieckie, Poland (Hybrid)",https://www.linkedin.com/jobs/view/3773560857/?eBP=CwEAAAGMQCtRAUmte5YArDBeU6LjaQen5jF_j70k_yUKQlUYCROFFh-WQEXT2SgxeNupWINDqNpvYO8GzPJaOUcWvPtoVMiRDoaEF43ci9f-phhj1DrF-uwY-5DI4ZxIukyTXevmPaQ1J_DPN-6Mc9ofNXShTcRC15aCohOyzSa3t9JfMgB9Q92h7-2r7dz8xW9LOizZ8iD3OMhjykY5cYPOsyzUf4MUI7GIeIHnSLX2LGZNTv5cD-fwXg2JNAYmfX1mzNO4Gr91utp1cefJ_XFr9_M45NxQVlR5ufd4W3gOtbnAK0pxB-zqitgvw6nvg2t35bjHVuchkgiAu7XnpDnaPNip5n6UZoQARu97wZURuHI7sveJ2galk6dSPEOHNdkaI5s&refId=FpRCaotmX%2FOEwB4pjwvAng%3D%3D&trackingId=o%2FBtfKKXMLNAuAp%2B2U%2BXMw%3D%3D&trk=flagship3_search_srp_jobs,3773560857,"About the job
            
 
About us: Digital TurbineAt Digital Turbine, we make mobile advertising experiences more meaningful and rewarding for users, app publishers, and advertisers — intelligently connecting people in more ways, across more devices. We provide app publishers and advertisers with powerful ads and experiences that captivate consumers, fuel performance, and help telecoms and OEMs supercharge awareness, acquisition, and monetization. In a rapidly evolving industry, we are constantly innovating and creating better paths of discovery to connect consumers, publishers, and advertisers across the mobile ecosystem.Data EngineerWe are looking to hire a Data Engineer that can use insightful data to transform our systems and architecture, and make a long-term impact on our technical ecosystems. Key Responsibilities You will have the opportunity to join our exciting Tech Hub in Warsaw, as we continue to grow and strengthen our technical strategies. You will have the opportunity to work with industry experts and collaborate using leading technologiesYou will maintain high standards of software quality via code review, testing, automation standardization, and toolingYou will collaborate closely with both developers and business intelligence teams to contribute to our continuous improvement strategies.You will model front-end and back-end data sources to create a comprehensive picture of user flows throughout the system and enable powerful data analysisYou will build data pipelines that refine, transform, and aggregate data from a variety of sourcesYou will provide estimates and risk-reducing spike stories, and assist in collection and documentation of requirements from business
Key Requirements (What you'll have) You will have strong experience with Python, SQL, and data visualization/exploration tools in a practical settingYou will have strong cloud experience with (GCP or AWS ; Redshift and RDS)You will have experience with cloud-based ETL tools (i.e: EMR, Spark on K8s, or DatabricksYou will have excellent engagement skills, with an ability to take complex technical concepts and translate them into business communicationsYou will thrive in a fast-paced and dynamic environment; with the ability to shift and prioritise based on our evolving technology estate
For more insight, please apply. We are excited to have join our Digital Journey."
Senior AWS Platform Engineer – Dublin City Centre – Hybrid role,IT Search and Selection,Greater Dublin (Hybrid),https://www.linkedin.com/jobs/view/3778550006/?eBP=CwEAAAGMQCtRAVT13KbMdy2Lp-7n72DbAUSNJlcEcw_Wbikip2T0D5m8bE--o2xFI-2t7C80hQqPqjJGkdcEELGV53tdLqIwDLkZGEmGawK0I2SL28pMVRQJ0OPdDM9y-iAKsV6j_zmeUh94Q96t4KhfK4jMKBaiEifqhi2UDfKRDCwmKoB4z7fJsD41_X_qw60_yaPqHgRIQXPpOAHwSfymlCl2TzuNtq6u-FrVVYhYFxC_MYWkSMMLEB9-x9B3K_kJSJ5OfbN-x1LZ-wwwO3FhytWBAMYeamvFcobRkpHBhulRnEz5Ub6Tnh0BdTml4qJ35cFw1-dQJnas48qA6hQmTl3Stjp7WCBi0EYnjLyAJi90b0rCELJTsSfNbTQXBzJ5vEM&refId=FpRCaotmX%2FOEwB4pjwvAng%3D%3D&trackingId=VkCcK4MErgwRPPL84h5V0A%3D%3D&trk=flagship3_search_srp_jobs,3778550006,"About the job
            
 
Senior AWS Platform Engineer – Dublin City Centre – Hybrid roleBased in Dublin City our client is a well established firm (insurance) who are expanding their Platform team in their Dublin offices but candidates will have minimal requirement to be onsite.Alongside an exceptional benefits package, there is a strong base salary on offer and importantly the potential to grow within a large team and organisation, moving towards a more monitored, automated and operations focused squad.Ideally you’ll have: 6+ years of commercial Platform/SRE experience on AWS and within an Agile EnvironmentExperience in critical high traffic operations, with build, deploy, automation and maintenance, Kubernetes being the main tool within AutomationIncident addressing knowledge, working on release schedules and change managementConfiguration of components and related testing protocolsScripting and utilising IaC tools (Terraform, Ansible) as well as Confluence WorkspacesLinux Sys Admin experience will be very welcomeStrength in ongoing documentation and exceptional communication skillsExperience in working with both business users as well as internal IT Teams
To learn more, please forward your CV stating required salary and availability and we can arrange a confidential discussion.Please note; we can only accept applications from candidates eligible to work in the EU."
