job_title,company_name,location,job_link,job_id,job_description
Consultant stratégie cloud H/F,Avangarde Consulting,"Biot, Provence-Alpes-Côte d'Azur, France (Hybrid)",https://www.linkedin.com/jobs/view/3782388089/?eBP=JOB_SEARCH_ORGANIC&refId=2jQ5wkAQVCBaCnk9aB1SLg%3D%3D&trackingId=YNqNLae0bvfGk8z1LOCuYQ%3D%3D&trk=flagship3_search_srp_jobs,3782388089,"About the job
            
 
Avangarde Consulting est un acteur français de référence dans le domaine du conseil stratégique et opérationnel à destination des PME et des ETI. Véritable cabinet de conseil, nous accompagnons également les grands groupes à travers nos dispositifs spécialisés.Notre savoir-faire s’étend de la définition de stratégie d’entreprise, passant par l’élaboration de schéma directeur informatique, jusqu’à la réalisation des projets associés, dans les domaines du digital et de la cybersécurité.Notre forte croissance s’appuie sur un collectif de consultants, contributeurs actifs de notre développement dans sa dimension business, expertise et management.Au sein de notre équipe Sud-Est basée à Biot, vous aurez pour mission d‘accompagner nos clients.À ce titre, vos missions principales sont : Analyser et cadrer les besoins du client et définir la stratégie Cloud en intégrant les contraintes sécurité, réglementaires et techniquesDéfinir et mettre en place l'architecture Cloud la plus adaptée (en terme de performance, résilience et coût) ou optimiser les infrastructures existantes de nos clientsRédiger et présenter un business case cloud à destination de nos clientsDéfinir la stratégie de migration des applications et établir le plan global de ces migrations vers le CloudPiloter des projets opérationnels de move to cloudCréer des supports et dispenser des formations
Mais aussi... Prendre part aux actions de développement commercial du cabinet (contribution active à la création de nouvelles offres, avant-vente, participation aux soutenances clients...), actions de communication externe, représentation de l'entreprise dans le cadre d'évènements...
VOUS :De formation supérieure en informatique, vous justifiez d’une expérience de 3 ans minimum acquise dans une fonction proche. Polyvalent et adaptable, vous savez évoluer dans des domaines métiers variés et pluridisciplinaires.Vous disposez d’une aisance relationnelle et d’une excellente communication orale et écrite.Vous maitrisez l’anglais oral et écrit.Vous maîtrisez la structuration d’un business case de la migration CloudVous avez une expérience de conduite de projet ou de direction de programme technologiqueVous savez adapter votre langage auprès des différentes parties prenantes du projet (comités éxécutifs, techniques, opérationnels, direction financière et administrative...)Vous avez une connaissance approfondie pour l'un des acteurs majeurs du cloud public (AWS, GCP, Azure)
Rejoindre Avangarde Consulting c'est… Intégrer un groupe de taille intermédiaire qui saura vous accompagner dans un développement de carrière avec bienveillance et proximité.Rejoindre une équipe soudée et contribuer ensemble à la croissance du cabinet.Disposer d’un ancrage régional fort et travailler en proximité immédiate avec nos clients locaux.Maintenir et développer votre savoir-faire à travers des formations, des certifications et le partage de connaissance avec nos experts.
Si vous vous reconnaissez dans ces fondamentaux alors rejoignez-nous !"
Personalization Strategy Consultant,Mastercard,"Frankfurt, Hesse, Germany (Hybrid)",https://www.linkedin.com/jobs/view/3775085044/?eBP=CwEAAAGMTrHUujAtLiGffth1jrVCk-MqLQlL8h5YKL2q9ILHevXnaE0EHXFAMb1rmCVaKJR9GfBnX-JNx2EOlbeIwel9e8lU_GvACJvabRZ4YHg5R-ocj6VIlpKXsePKLXsIhJO2d73BdzoBFEa0gvwn9yNpCUBeTdLMm7HP9A1ZckOX_4NHsboTXytBo2MA7MGKWuA5vu37wMPd-CwtshcmMLGk7WJn72jNNNEJGKS78PHziSmRIIhIzG9Y9XriaGctoYtvj_Gn6glLwFErY7OYKLV452waKtc_4vwIoUm7Xhjjc0Z9gtf36uFhrprHUe4Hvd9cjKjgXyd1GpWqgeIpZQXXXPa0K9mg1pGMBlH9R_jEL_EHm4BWReIbt1kM6zIzZuU&refId=2jQ5wkAQVCBaCnk9aB1SLg%3D%3D&trackingId=2ixJUfGWieS0NTcMglj9AQ%3D%3D&trk=flagship3_search_srp_jobs,3775085044,"About the job
            
 
Our PurposeWe work to connect and power an inclusive, digital economy that benefits everyone, everywhere by making transactions safe, simple, smart and accessible. Using secure data and networks, partnerships and passion, our innovations and solutions help individuals, financial institutions, governments and businesses realize their greatest potential. Our decency quotient, or DQ, drives our culture and everything we do inside and outside of our company. We cultivate a culture of inclusion for all employees that respects their individual strengths, views, and experiences. We believe that our differences enable us to be a better team – one that makes better decisions, drives innovation and delivers better business results.Title And SummaryPersonalization Strategy ConsultantWho is Mastercard?Mastercard is a global technology company in the payments industry. Our mission is to connect and power an inclusive, digital economy that benefits everyone, everywhere by making transactions safe, simple, smart, and accessible. Using secure data and networks, partnerships and passion, our innovations and solutions help individuals, financial institutions, governments, and businesses realize their greatest potential.Our decency quotient, or DQ, drives our culture and everything we do inside and outside of our company. With connections across more than 210 countries and territories, we are building a sustainable world that unlocks priceless possibilities for all.Dynamic Yield, by Mastercard is on the lookout for a Personalization Strategy Consultant, charged with building personalization programs on behalf of our enterprise clients. We’re looking for experienced professionals, who are able to analyse and interpret e-commerce data from different sources and derive the right insights from this data to create an actionable and impactful strategic personalization program. As an outstanding communicator, our Personalization Strategy Consultant will present and refine those Personalization Strategies together with E-Commerce experts and Executives and also visualise and quantify the impact of their program for our clients.The right traits for the job include an analytical mindset, a good understanding of success factors across digital businesses from different industries, and a consultative approach with a customer centric mindset.As a part of our Professional Services team, the role will build and analyze reports, drive insights and recommend strategic plans that unlock business growth for our clients. In this role, cross functional collaboration will be expected in order to successfully collaborate and communicate with Sales Leadership, Marketing, Product and Engineering teams. The ultimate goal is to become a trusted advisor across multiple teams to provide strategic consulting, insight, and strategy to ensure growth for Dynamic Yield’s customer base.The Task-at-Hand  Perform sophisticated quantitative analyses (Google Analytics, Omniture, Tableau) that translates eCommerce data into actionable personalization strategy Coordinate and lead cross-functional teams to advance project execution based on the strategic plan Analyze and track progress against the plan and report back on the success of the program Advocate for personalization and lead clients toward adopting advanced personalization strategies Innovate on new ways of leveraging Dynamic Yield’s technology to create personalized customer experiences across different industry verticals Act as the main personalization strategy expert in front of executives in high profile clients and partners
Optimal Skills For Success  3+ years of consulting experience focusing UX optimization in eCommerce, media or finance sector is a must B.A./B.S. Degree (MBA strongly preferred Business fluency in English and German is a must Proven experience in campaign management, execution and reporting Exemplary quantitative and qualitative thinking, analytical ability, and problem-solving skills Strong desire to learn and grow within a fast-paced business environment Excellent verbal and written communication skills, with excellent presentation skills Strong interest in digital technology Ecommerce technology (e.g. CMS, Web Analytics, Email Marketing) experience, knowledge, or aptitude a plus
Corporate Security Responsibility All activities involving access to Mastercard assets, information, and networks comes with an inherent risk to the organization and, therefore, it is expected that every person working for, or on behalf of, Mastercard is responsible for information security and must: Abide by Mastercard’s security policies and practices;Ensure the confidentiality and integrity of the information being accessed;Report any suspected information security violation or breach, andComplete all periodic mandatory security trainings in accordance with Mastercard’s guidelines."
Strategy & transformation consultant,Badenoch + Clark,"Utrecht, Utrecht, Netherlands (On-site)",https://www.linkedin.com/jobs/view/3629737105/?eBP=CwEAAAGMTrHUupG4hgJ7QtGEIkNaAc8YhKI3O7H2ke-a3xSS0mToU3uB6F6vbHDVZGQaqsUBFTQAf81DQsNMCHjt_6mLME5jF8esLAwAw0s-dkIdm5iK_byKPlwUjU5XMF-p-eeZQBLuTq3jm7yB0IceaY_pPG3z7RcME0UaBM5FI7fs68EOqnf1voqwlvKbEBeE_YK4yBKvWSmIRZ2IN9CL6EntGUVI10nSdvRKjyH7Xvo5Mrqgb-2C3_YTEsk1hhEP2don5i1OyK_lVHQeHVeYWmBRQ-6RodlLsPD3RybZ87vIpmwenESrMoJhkesHODYlTTbiNFm2QMjLJJbTpyLzsOT90RIMV_Oorb8lMJsSEbFDMHtcavZlfh641YH-WLCfJAXM8A&refId=2jQ5wkAQVCBaCnk9aB1SLg%3D%3D&trackingId=4b89tFPcXaVzUmbQVJE8UQ%3D%3D&trk=flagship3_search_srp_jobs,3629737105,"About the job
            
 
Ben jij nu een strategie-consultant en mis je impact? Gloednieuw team, dat de link legt tussen strategie en operatie, zoekt versterking om hun propositie verder vorm te geven en uit te bouwen. Unieke kans voor een consultant die graag bij een grote naam werkt, maar tegelijkertijd graag meebouwt.Over de opdrachtgeverDeze trusted advisor voor toonaangevende klanten binnen operations management consulting is de afgelopen jaren flink gegroeid. Inmiddels is dit adviesbureau internationaal vertegenwoordigd en heeft het een sterke marktpositie en trackrecord. Naast het verbeteren van de operational performance, vragen hun klanten steeds vaker hulp bij strategische uitdagingen. Daarom trok dit adviesbureau een senior partner aan met veel kennis van strategie consulting, om de propositie Strategy & Transformation verder te laten groeien.Het Strategy & Transformation team is de schakel tussen de businessstrategie en operations. Zij geloven niet in papierwerk en zorgen ervoor dat een strategie ook in de praktijk werkt door vanaf de start nauw samen te werken met hun klanten. Ze denken niet alleen in ‘wat’, maar ook in ‘hoe’ om tot een daadwerkelijke en realistische executie over te gaan. Dit team is sterk in het vertalen van de businessstrategie naar een operationsstrategie, het definiëren van een businessarchitectuur en het vormgeven van een transformatie.Inmiddels werken er meer dan 600 gedreven consultants bij dit groeiende adviesbureau in Europa en in de UK. Door hun pragmatische werkwijze helpen zij toonaangevende klanten in topconditie te krijgen en klaar te stomen voor de toekomst. Denk aan Heineken, Rituals, Alliander en de NS. Ondanks hun groei heerst er een platte, betrokken en informele cultuur. Consultants zijn resultaatgericht, pragmatisch, no-nonsense en hebben veel oog voor de mens. Het Strategy & Transformation team bestaat momenteel uit vijf consultants.Over de functieAls Strategy & Transformation consultant in het gloednieuwe team lever jij een belangrijke bijdrage aan het succesvol neerzetten van projecten bij klanten. Je voert een analyse uit om de performance van de klant en marktontwikkelingen in kaart te brengen. Vervolgens help je de stip op de horizon te bepalen, de performance te verbeteren en je klant klaar te maken voor de toekomst. In deze rol acteer je op strategisch niveau en leg je de koppeling met de operatie. Je schakelt dus op topniveau én bent met de operatie in contact om vanaf de start draagvlak te creëren en de medewerkers mee te nemen in de verandering. Naast het oppakken en uitrollen van projecten lever je een belangrijke bijdrage aan de groei van dit bedrijfsonderdeel. Tot slot coach je (junior)consultants en begeleid je hen in hun persoonlijke ontwikkeling.Kortom, mooie strategie-executierol voor een consultant waarin je op strategisch niveau start, langdurige resultaten bij klanten neerzet en kan meebouwen aan een practice.Belangrijkste criteria Je hebt minstens 5 jaar advieservaring bij een gerenommeerd adviesbureau. Je hebt vwo, een wo-bachelor en master afgerond met interessante nevenactiviteiten. Je bent analytisch en communicatief ijzersterk, weet materie snel eigen te maken, processen en vraagstukken goed te doorgronden. Je hebt ervaring en een netwerk binnen logistiek, retail, FS, infrastructuur, manufacturing of energie. Je hebt ervaring met het coachen en trainen van collega’s, daarnaast is je stakeholdermanagement uitstekend. Je weet draagvlak te creëren (van directie tot de werkvloer) en werknemers in beweging te krijgen. 
Reden van de vacatureKlanten vragen steeds vaker om strategisch advies.. Nieuw geformeerd team springt daarop in en legt de link tussen de strategie en operatie. Om verdere groei te kunnen verwezenlijken binnen deze business unit zoekt onze opdrachtgever extra talent.De procedureNa een gesprek bij Badenoch + Clark volgen er drie bij deze opdrachtgever. Een business case en online assessment maken onderdeel uit van de procedure.ContactSpreekt deze rol je aan en voldoe je aan de criteria? Dan horen we graag van je. Solliciteer via de knop op deze pagina of stuur je cv en korte motivatie naar Merel Fennema (merel.fennema@badenochandclark.nl)."
Strategy Consultant,FI Group,"Madrid, Community of Madrid, Spain (Hybrid)",https://www.linkedin.com/jobs/view/3766567516/?eBP=CwEAAAGMTrHUu-WfEybVX8p8_aWVnOYGZS-KCXG3LS_FfYFewHTm4wPDWid34lC4K93YHQeyXMZBfO8g9WeBZuAJoLDAlSe1T9jtJyJRrlp5iN-5TMzRK6QVtcK5WjPy--ItoY5gi5gFJuWqKMR4_WLwvo0zzXj_3FqGxCWABDM25RM171hcE9fFeUxjBQHvro0MaBPDXJ5-mseGPbzlPcr3Yr8d4eGRl2LgIrLnBCJLfQGXrpkasFng2pbuVoDeWTTwoifw0h_rCVw0IY3-Mk7KUv_absdScYkfkjP5_sZNuam69rE3W9VVJSU1V1wba8pMyCyjBbhDSBhoYIn1lowbu5dqznXmyJNYgqx_qV9OncHlFf9EiW2VWLbtoJk29FoB_Sa74A&refId=2jQ5wkAQVCBaCnk9aB1SLg%3D%3D&trackingId=2vCJn62MVXA9W%2BqLlNz%2FWg%3D%3D&trk=flagship3_search_srp_jobs,3766567516,"About the job
            
 
¿Tienes experiencia en proyectos de innovación y quieres continuar desarrollándote en un ambiente joven y dinámico? ¡Te estamos buscando!Desde FI GROUP creemos en el progreso de la sociedad, y por ello apostamos por la I+D+i como la clave para cambiar el presente y mejorar el futuro. Como empresa líder en el sector, ayudamos a pequeñas y grandes empresas a desarrollar sus proyectos a través de la obtención de financiación (incentivos fiscales, ayudas o subvenciones), tanto a nivel nacional como internacional.¿Quiénes somos? Helping ideas GrowNuestro mayor valor son las personas que conforman FI Group. Simpatía, profesionalidad y honestidad son las señas de identidad de nuestro equipo humano. El esfuerzo, el entusiasmo y la pasión que nos caracterizan, nos motivan a emprender proyectos innovadores que convierten nuestro día a día en un reto.Actualmente estas buscando un perfil Strategy Consulting, para realizar funciones como:  Análisis de la actividad y del entorno de las organizaciones clientes.Recopilación y tratamiento de datos, incluyendo encuestas.Participación y desarrollo de talleres con agentes de interés.Establecimiento de conclusiones y consolidación de resultados.Identificación y análisis de oportunidades de financiación pública.
· Ideación, definición y caracterización de proyectos (agente responsable, modelo de financiación, indicadores, etc.). Monitorización de los proyectos en ejecución.Asesoramiento estratégico a alta dirección.Participación en la elaboración de propuestas.Establecimiento de métricas clave y de seguimiento continuo para evaluación.
¿Qué buscamos en ti? Grado universitario en Ingeniería, Administración y Dirección de Empresas o carreras afines relacionadas con el mundo de la empresa y la innovación.Experiencia de 2 años desarrollado actividades similares a las que serán tus responsabilidades.Experiencia e interés en la gestión de proyectos.Un perfil analítico y con orientación a resultados.Una actitud proactiva e innovadora, con pensamiento estratégico y capacidad de ejecución.Iniciativa personal para proponer y gestionar propuestas.Excelente capacidad para tratar con diferentes stakeholders (clientes, organizaciones, organismos públicos, etc.).Habilidades de diseño, capacidad de preparar presentaciones y criterio para coherencia visual.Excelentes habilidades de trabajo en equipo, en entornos dinámicos y multidisciplinares.
¿Qué beneficios tendrás? Posición estable y con perspectiva de desarrollo.Conciliación y flexibilidad. Disfrutarás de jornada flexible cada día y jornada intensiva los viernes y en verano.Modelo de trabajo híbrido (Presencial/Ework).Sistema de Retribución flexible. Podrás personalizarlo según tus intereses, teniendo opción a Ticket Restaurant, Tickets Guardería y/o Tarjeta Transporte.Dispondrás de fruta y snacks en la oficina.Plan de carrera y formación individualizados.Para nosotros es fundamental el buen ambiente, podrás disfrutar con tus compañeros/as de diferentes actividades (afterworks, actividades solidarias y deportivas, etc.).
¡Te esperamos con los brazos abiertos! ¿Te apuntas?---------F. Iniciativas España I+D+i, S.L.U le informa que sus datos han sido incorporados a un fichero automatizado con la finalidad de avanzar en los procesos de selección. Los datos recogidos son almacenados bajo la confidencialidad y las medidas de seguridad legalmente establecidas. Igualmente deseamos informarle que podrá ejercer sus derechos a través del siguiente correo electrónico: rgpd@fi-group.comPara conocer nuestra política de privacidad en mayor detalle pinche https://es.fi-group.com/politica-de-privacidad/"
Associate Strategy Consultant,Aon,"Rotterdam, South Holland, Netherlands (Hybrid)",https://www.linkedin.com/jobs/view/3738317838/?eBP=CwEAAAGMTrHUu30J1r95WdfX0GqS1rJrvhYDdd7yMGzWLPzCzVDPol-viA_tYKQrU5CF3E-Ua-JPLZ4inPQLLSK8dTfhUQKDHQnQh7cfqg5z7E69NZcdJui_zuvpbkPPy4jQamnOvrvvK3fuEmfd2HK3SwfMer1gQtqUS87jSScuE8udNAlvhNtYjGahsj4byOgg78RPeys68PNdfB0GK0XpbDwdUT6s7tn7nywnm-OfiuivTYGrYruX2k2onp4Vgri00PQx-6euD56tl-Yrq7QKiqS3npU5gfBxhywpXqq7dGZBcDFXTjy7Eb6zT6zM7mHobmyIbG2wweULnHygH2KCpZPRHeQDPozy-bGUhU8zxnVFAMrRdmxLOK5rC-vXIEIP0aY&refId=2jQ5wkAQVCBaCnk9aB1SLg%3D%3D&trackingId=h2NngIknXVNVDGkU6os04Q%3D%3D&trk=flagship3_search_srp_jobs,3738317838,"About the job
            
 
Beschrijving van het berichtAon is looking for an English-speaking Strategy Consultant Associate to work Hybrid, 2 days per week in office in Rotterdam, NL!(When applying, please submit your resume and cover letter in English. These are a requirement. Thank you!)Aon Inpoint provides advisory services and strategic implementation support to Aon Inpoint’s clients, which include many of the most prestigious insurance companies in the Global Property, Casualty and Health & Benefit (re)insurance market!Through our consultative approach, we help our clients to navigate a fluid market environment to drive profitable and balanced growth and business results. We have privileged access to Aon’s global network of (re)insurance industry authorities to derive outstanding and compelling insights into the sources of competitive advantage in our industry.An Associate’s responsibilities include:Support Client & Engagement Leaders in delivering business-focused relationship management and engagement services through critical initiatives, leading data analyses by applying Aon’s internal data sources and implementing strategic recommendationsInterpret data and deliver in-depth insights, conclusions and recommendations to clientsAssess client risk appetite, identify unrealized cross sell opportunities, analyze capability gaps and critical success factorsDevelop and maintain a fluency in the company's and insurers strategy, products, leadership and operations to enrich client outcomesDevelop your knowledge about Aon’s products and services and build relationships with Aon’s local and regional leadership and support sales efforts by conducting research on various markets and players and by preparing sales pitchesTo Be Considered Qualified for This Role Up to 5 years of business management, business strategy, project management, data analytics, insurances or similar fieldsAbility to build and maintain relationships with internal and external partnersExperience with analyzing large / complex data sets and distilling useful insights from themHighly developed interpersonal skills, relationship building, communication and international mentalityExperienced in Microsoft Office applications; Outlook, Excel and PowerPoint being extremely valuableMaster’s degreeInterest in developing a career in Insurance/Financial ServicesFluency in English, and any other European language is a plus
We will ensure that individuals with disabilities are provided reasonable accommodation and equal opportunity to participate in the job application or interview process, to perform essential job functions, and to receive other benefits and privileges of employment. Please contact us to request accommodation.We offer youAn amazing total rewards package, continuing education & training, and tremendous potential with a growing worldwide organization.Our Colleague Experience:From helping clients gain access to capital after natural disasters, to creating access to health care and retirement for millions, Aon colleagues empower our clients, communities, and each other every day. They make a difference, work with the best, own their potential, and value one another. This is the Aon Colleague Experience, defining what it means to work at Aon and realizing our vision of empowering human and economic possibility. To learn more visit Aon Colleague Experience.About Aon:Aon plc(NYSE:AON) is a leading global professional services firm providing a broad range of risk, retirement and health solutions. Our 50,000 colleagues in 120 countries empower results for clients by using proprietary data and analytics to deliver insights that reduce volatility and improve performance.Aon provides equal employment opportunities (EEO) to all employees and applicants for employment without regard to race, color, religion, creed, sex, sexual orientation, gender identity, national origin, age, disability, veteran, marital, or domestic partner status. Aon is committed to a diverse workforce and is an affirmative action employer.Nothing in this job description restricts management's right to assign or reassign duties and responsibilities to this job at any time.2521380"
