job_title,company_name,location,job_link,job_id,job_description
Core Infrastructure Engineer - Networking,Kraken Digital Asset Exchange,European Union (Remote),https://www.linkedin.com/jobs/view/3756657176/?eBP=CwEAAAGMRJcq2sj0p6p-JEgEIiwClkHKAQ18I7-9vJQV2yB039dpxn2_OTr58K-k868lGkSQoIHi6_VNhJkjs9dWxfPnePHyp35axjDFmjMIcdm4FE03N22hqj80M_dL-sZlAbMvzxmuu6PCTtRf2pHAJKmtbzHo3-x5JaCstFIJOn-mcnfFIl1ZNvLP1wT87dmVZSq1PGKK_EvZ1BjIDVn2rL4e8eaZG_ccUZ1_n0DFcLjAb-Tv6kcElDHpFdhItk7bbPj8jaHi35t398f-vpt89Ow0aIgJ4oJ_UR5uaBvAp0p5CB8BrYYkh_rJoDUorxKnqgu7dkviiUHRAGfPdaPnN50QE_NPjBlzX44j22CIX27TXwqFcZ1rr8LUjj8YUxl3Mv9n5X4Bgx0&refId=Yl0fj3JHOQuAJZVhed8Kzg%3D%3D&trackingId=5ZFYN1rBxDpZG7wXsA%2B03g%3D%3D&trk=flagship3_search_srp_jobs,3756657176,"About the job
            
 
Building the Future of Crypto Our Krakenites are a world-class team with crypto conviction, united by our desire to discover and unlock the potential of crypto and blockchain technology.What makes us different?Kraken is a mission-focused company rooted in crypto values. As a Krakenite, you’ll join us on our mission to accelerate the global adoption of crypto, so that everyone can achieve financial freedom and inclusion. For over a decade, Kraken’s focus on our mission and crypto ethos has attracted many of the most talented crypto experts in the world.Before you apply, please read the Kraken Culture page to learn more about our internal culture, values, and mission.As a fully remote company, we have Krakenites in 60+ countries who speak over 50 languages. Krakenites are industry pioneers who develop premium crypto products for experienced traders, institutions, and newcomers to the space. Kraken is committed to industry-leading security, crypto education, and world-class client support through our products like Kraken Pro, Kraken NFT, and Kraken Futures.Become a Krakenite and build the future of crypto!Proof of workThe teamIf you thrive in a challenging, fun and fast-paced environment, the Core Infrastructure Engineer at Kraken is for you! Not only is this role a strategic hands-on role that is critical to the continuing success of Kraken; you will join a highly dedicated team that is responsible for managing the entire network and compute infrastructure for one of the leading cryptocurrency exchanges in the world. We are looking for a dynamic and innovative self-starter with the ability to think “outside of the box” to solve complex problems in a sustainable way.Find our more about Core Infrastructure Engineering in our latest engineering blogpost!This role is fully remote. We prefer candidates in European Timezones, to cover current needs.The opportunity Design, implement, manage, and defend a “zero trust”, defense-in-depth networkImplement and evolve enterprise network access controlsManage and deploy ""infrastructure as code""Write good quality policies, procedures, and technical documentationCoordinate with internal development teams and other stakeholders to ensure network security principles are ""built-in"" from the beginningWork with Engineering and IT Security teams to ensure that product features are securely deployed and monitoredMonitor and maintain all physical infrastructure (network, security, and compute), cloud data center environments, remote office locations, and respond to critical network problems to maximize service uptimeAssist in various projects with network related requirementsMentor and evangelize security practices through cross-functional work with internal stakeholders and teamsAssume on-call responsibilities and duties per the scheduleTravel as needed to support physical datacenter and office locations
Skills You Should HODL 5+ years of network engineering background including offensive/defensive securityDeep experience in public (AWS or Azure or Google), private and/or hybrid cloud infrastructureExperience with network security management tools and techniquesFamiliarity with security testing tools (performance and threat-based)Proficient in network and security design, implementation, and administration leveraging industry standard platforms from vendors such as: Palo Alto Networks, Cisco, Juniper, and ArubaExperience with Switching (Capacity Planning & VLAN’s), Routing (OSPF, EIGRP, BGP, ECMP, PBF), WAN Technologies (MPLS, VPLS, VPN), public cloud networking, and Security (IPS, RBAC, etc.)Previous experience monitoring and management of intrusion detection systems and firewall devicesDemonstrated experience researching, building and implementing defensive security systems that are used against internal and external attack vectorsExcellent communication skills: demonstrated ability to explain complex technical issues to both technical and non-technical audiencesExcellent analytical and problem-solving skillsAbility to perform well under pressure, high attention to detailStrong desire / interest in learning new technologyHighly motivated and passionate about infrastructure engineering and securityThis role requires the ability to travel. For this reason, a valid passport will be mandatory
Location Tagging: #EUKraken is powered by people from around the world and we celebrate all Krakenites for their diverse talents, backgrounds, contributions and unique perspectives. We hire strictly based on merit, meaning we seek out the candidates with the right abilities, knowledge, and skills considered the most suitable for the job. We encourage you to apply for roles where you don't fully meet the listed requirements, especially if you're passionate or knowledgable about crypto!As an equal opportunity employer, we don’t tolerate discrimination or harassment of any kind. Whether that’s based on race, ethnicity, age, gender identity, citizenship, religion, sexual orientation, disability, pregnancy, veteran status or any other protected characteristic as outlined by federal, state or local laws.Stay in the knowFollow us on TwitterLearn on the Kraken BlogConnect on LinkedIn"
Junior Data Engineer,HireMeFast LLC - Career Accelerator - Land A Job,"Milwaukee, WI (Remote)",https://www.linkedin.com/jobs/view/3780155059/?eBP=JOB_SEARCH_ORGANIC&refId=Yl0fj3JHOQuAJZVhed8Kzg%3D%3D&trackingId=GK0rgt27wp5tzMFzErJ37A%3D%3D&trk=flagship3_search_srp_jobs,3780155059,"About the job
            
 
This is a remote position. Job Title: Junior Data Engineer Employment Type: Full-Time Salary: $64,000 - $76,000 per annum Experience Required:  Minimum 1 year of project experience How to Apply: visit hiremefast.net  to learn more & apply.About us: HireMeFast is a leading staffing and recruitment agency specializing in connecting businesses with top-tier talent across various industries. Our mission is to bridge the gap between exceptional candidates and organizations needing their skills, expertise, and unique qualities. Our team of experienced and dedicated recruitment specialists utilizes innovative sourcing strategies, and a vast network to identify and attract top talent. We conduct comprehensive procedures to ensure that only the most qualified candidates are presented to our clients.Position SummaryJoin the fast-paced, innovative, and collaborative environment focused on providing an AIOps platform that enhances the intelligence of the CVS Health infrastructure. Work closely with subject matter experts and colleagues to build and scale out machine learning and AI solutions that will detect, predict, and recommend solutions to correct issues before system impact and enhance efficiency, reliability, and performance of CVS Health’s IT operations.Key Responsibilities include: Data pipeline development: Designed, implemented, and managed data pipelines for extracting, transforming, and loading data from various sources into data lakes for processing, analytics, and correlation. Data modeling: Create and maintain data models ensuring data quality, scalability, and efficiency Develop and automate processes to clean, transform, and prepare data for analytics, ensuring data accuracy and consistency Data Integration: Integrate data from disparate sources, both structured and unstructured to provide a unified view of key infrastructure platform and application data Utilize big data technologies such as Kafka to process and analyze large volumes of data efficiently Implement data security measures to protect sensitive information and ensure compliance with data and privacy regulation Create/maintain documentation for data processes, data flows, and system configurations Performance Optimization- Monitor and optimize data pipelines and systems for performance, scalability and cost-effectiveness 
Characteristics of this role: Team Player: Willing to teach, share knowledge, and work with others to make the team successful. Communication: Exceptional verbal, written, organizational, presentation, and communication skills. Creativity: Ability to take written and verbal requirements and come up with other innovative ideas. Attention to detail: Systematically and accurately research future solutions and current problems. Strong work ethic: The innate drive to do work extremely well. Passion: A drive to deliver better products and services than expected to customers. 
Required Qualifications 2+ years of programming experience in languages such as Python, Java, SQL 2+ years of experience with ETL tools and database management (relational, non-relational) 2+ years of experience in data modeling techniques and tools to design efficient scalable data structures Skills in data quality assessment, data cleansing, and data validation 
Qualifications Knowledge of big data technologies and cloud platforms Experience with technologies like PySpark, Databricks, and Azure Synapse. 
EducationBachelor’s degree in Computer Science, Information Technology, or related field, or equivalent working experienceWhy HireMeFast LLC?At HireMeFast, we understand that finding the right individuals to join your team is crucial for success and growth of your organization. We are committed to streamlining the hiring process for our clients, ensuring they have access to a diverse pool of highly qualified candidates who are a perfect fit for their specific needs."
Data Engineer,Otter Products,"Fort Collins, CO (Remote)",https://www.linkedin.com/jobs/view/3766728302/?eBP=JOB_SEARCH_ORGANIC&refId=Yl0fj3JHOQuAJZVhed8Kzg%3D%3D&trackingId=RZT%2FPZGNcVBv13J4bFpZ0Q%3D%3D&trk=flagship3_search_srp_jobs,3766728302,"About the job
            
 
Overview Otter Products is currently recruiting for a Data Engineer to join our Data team! You can be based in our Fort Collins, CO office with flexibility to work a portion of your time remotely, or 100% Remote in the U.S.The Data Engineer applies professional experience, concepts, and company objectives toward building and operationalizing the minimally inclusive data necessary for the enterprise data initiatives following industry standard practices and tools. The bulk of the Data Engineer's work would be in designing, managing and optimizing data pipelines, then moving these data pipelines effectively into production for key data and analytics consumers like business/data analysts, data scientists or other stakeholder that needs curated data for data and analytics use cases across the enterprise. The Data Engineer also ensures compliance with data governance and data security requirements while creating, improving and operationalizing these integrated and reusable data pipelines to enable faster data access, integrated data reuse and vastly improved time-to-solution for data and analytics initiatives. Additionally, the Data Engineer will be expected to collaborate with other data team members and data consumers working on the models and algorithms developed by them toward optimization for data quality, security, and governance to put them into production leading to potentially large productivity gains. About Otter Products Otter Products, we grow to give. From our founder's garage in 1998 to the global technology leader we are today, Otter Products continues to drive growth through innovation.Through our industry-leading brands - OtterBox, Liviri and OtterCares - we provide our partners the number-one selling and most trusted products in our categories. Our philanthropic spirit is the foundation on which we foster our partner relationships, allowing us to grow and to give - together.By way of our charitable arm, the OtterCares Foundation, we support our communities and invest in our future through education that inspires kids to change the world.And even as our global community of Otters continues to grow, our founder's core values are still at the heart of everything we do. We measure our success by our ability to give back to our communities and strengthen opportunities for all.For more information visit otterproducts.com Responsibilities  Complete analysis, design and development of BI solutions using Azure SQL ServerFamiliarity with Data Warehouse conceptsExperience coding the extraction, transformation, and loading (ETL) processesDatabase development primarily in SSIS, Data Factory and SQLPartner with the business to determine end user database/reporting needs and requirementsGenerate ad hoc reports using Power BI or SSRSCollaborate with other developers to create and implement best approach solution(s)Troubleshoot Azure tools, systems, and softwareReview queries for performance issues, making changes as neededCollaborate with team to performance-tune Azure application as necessaryAssist with the analysis and extraction of relevant information from large amounts of historical business data to feed data science initiativesParticipate and support the design and documentation of processes for large scale data analyses, model development, model validation and model implementationSupport and maintain a positive safety culture by following all safety policies and procedures and actively contributing to a safe working environmentOther duties as required
 Qualifications  Bachelor's degree required. Degree in Computer Science or Mathematics preferredMinimum of four years of experience in an IT or analytical role required. Experience in database development, report writing and/or statistics preferred.
 EEO Otter Products, LLC is an equal employment opportunity employer. All qualified applicants will receive consideration for employment without regard to race, color, religion, age, marital status, pregnancy, sex, sexual orientation, gender, gender identity or expression, national origin, disability, veteran status, or any other characteristic or status protected by law. For US Based Roles Only - Compensation Range Minimum USD $90,000.00/Yr. For US Based Roles Only - Compensation Range Maximum USD $120,000.00/Yr. Additional Total Rewards Profit Sharing Program Eligible, Benefits Eligible - Full Time- check out otterproducts.com/careers/why for more info"
Data Engineer,"ISC (Integrated Specialty Coverages, LLC)","Carlsbad, CA (Remote)",https://www.linkedin.com/jobs/view/3778293528/?eBP=JOB_SEARCH_ORGANIC&refId=Yl0fj3JHOQuAJZVhed8Kzg%3D%3D&trackingId=e315feS7SbJXPKluOL9pIw%3D%3D&trk=flagship3_search_srp_jobs,3778293528,"About the job
            
 
About Integrated Specialty CoveragesIntegrated Specialty Coverages LLC (ISC) is a growth stage technology and data-driven insurance company leading innovation in the market.Backed by one of the leading private equity firms, KKR, and led by a forward-thinking management team, ISC is combining the worlds of insurance and technology to create an Insurtech powerhouse. As a leading online distributor of insurance products for a range of industries and ""Main Street USA"", we are looking for the right people to help us in our mission of achieving exponential growth. We strive to be the number one place to go for brokers and agents to source insurance. To accomplish this, we're building a digitally focused team that deeply understands the intersection between user experience, data, and AI/ML to optimize the way we engage with our customers and partners.Job SummaryThe Data Engineer role will be the technical liaison between multiple groups including a data science team, the engineering team, product management, and business stakeholders. You do not need any insurance knowledge prior, however, you must quickly dive deep into the insurance world and ask questions to become a subject matter expert. You will be responsible for building a data platform to facilitate the data science team. You must be a self-starter that can build out features such as a data pipeline from scratch. There will be support from both engineering and data science for any buildout.Job Responsibilities Create and maintain optimal data pipeline architecture. Assemble large, complex data sets that meet functional / non-functional business requirements. Identify, design, and implement internal process improvements: automating manual processes, optimizing data delivery, re-designing infrastructure for greater scalability, etc. Build the infrastructure required for optimal extraction, transformation, and loading of data from a wide variety of data sources using AWS technologies, SQL, and Python. Work with stakeholders including the Executive, Product, Data Science, and Engineering teams to assist with data-related technical issues and support their data infrastructure needs. Work with data science and analytics teams to strive for greater functionality in our data systems. 
Minimum Qualifications: Advanced working SQL knowledge and experience working with relational databases, strong query authoring (SQL) as well as working familiarity with a variety of databases (Snowflake, Redshift, MySQL, MSSQL, etc.)Experience building and optimizing data pipelines, architecture and data sets. Experience performing root cause analysis on internal and external data and processes to answer specific business questions and identify opportunities for improvement. Build processes supporting data transformation, data structures, metadata, dependency, and workload management. A successful history of transforming, processing and extracting value from large disconnected, datasets from a variety of data sources (Flat files, Excel, databases, etc.)Strong analytic skills related to working with unstructured datasets. Strong project management and organizational skills. Experience supporting and working with cross-functional teams in a dynamic environment. Ability to mentor/guide/collaborate with other team members. 
We are looking for a candidate with 3-5 years of experience in a Data Engineer role. They should also have experience using the following software/tools: Experience with relational and MPP databases, including Snowflake and MySQL. Experience developing software in an agile environment from the requirements stage to production. Experience with version control: gitExperience with container technologies: DockerExperience with data pipeline and workflow management tools: Airflow, Jenkins, AWS Glue, Azkaban, Luigi, etc. Experience with AWS cloud services: EC2, ECS, Batch, S3, EMR, RDS, RedshiftExperience with other cloud services: Snowflake, AirflowExperience with object-oriented/object function scripting languages: Python, Java, C++, etc. Experience with data modeling and data warehouse designExperience with data visualization tools (PowerBI, QuickSight)
The starting annual pay scale for this position is listed below. Actual starting pay will be based on factors such as skills, qualifications, training, and experience. In addition, the company offers comprehensive benefits including medical, dental and vision insurance, 401(k) plan with match, paid time off, and other benefits.ISC's salary ranges are determined by role and level. The range displayed on each job posting reflects the minimum and maximum target for new hire salaries for the position across all US locations and could be higher or lower based on a multitude of factors, including job-related skills, experience, and relevant education or training.National Pay Range$100,000—$110,000 USDBenefits of Working at ISC Competitive vacation and flexible working arrangementsComprehensive and inclusive health benefitsA variety of professional development and mentorship opportunitiesChoice of technology whether at home or in the office
ISC's Ownership Behaviors Do the Right Thing *Be Relentless. Pursue Excellence. *Personal Responsibility & Own OutcomesTry Fast. Learn Fast. Fail Fast. Think Big. *Build Extraordinary Owners & Join Forces *Grit & Determination
Applicants with disabilities may contact ISC HR department via e-mail, and other means to request and arrange accommodation. If you need assistance to accommodate a disability, you may request accommodation at any time. Please contact ISC at HR@ISCMGA.com.ISC believes in creating long-term relationships by being responsive and relevant and by consistently delivering value to our community of customers. Specifically, with our employees, we focus on attracting, developing, and retaining the best talent for our business, challenging our people, demonstrating a ""can-do"" attitude, and fostering a collaborative and mutually supportive environment. ISC is an equal opportunity employer and a participant in the US federal E-Verify program (US).Diversity creates a healthier atmosphere: All qualified applicants will receive consideration for employment without regard to race, color, religion, sex, national origin, age, gender, gender identity, sexual orientation, marital status, medical condition, genetic information, mental or physical disability, military or veteran status, or any other characteristic protected by local, state, or Federal law."
ENTRY LEVEL DATA ENGINEER (REMOTE),SynergisticIT,"Jacksonville, FL (Remote)",https://www.linkedin.com/jobs/view/3767587909/?eBP=JOB_SEARCH_ORGANIC&refId=Yl0fj3JHOQuAJZVhed8Kzg%3D%3D&trackingId=qddFbj5Z3mAQHmr2PGh9Fg%3D%3D&trk=flagship3_search_srp_jobs,3767587909,"About the job
            
 
SYNERGISTICIT wants every candidate to know that the Job Market is Challenging and to stand out, you need to have exceptional skills and technologies and that's where we come in to make sure you get the attention which you needSynergisticIT understands the complex nature of the job market and how difficult it can be to secure a position, especially for fresh graduates. Therefore, we assist and help tech-savvies to convert their passions into professions. We go above and beyond to keep you working in your niche.As we focus on long-term success, we provide complete career development solutions. From job search to upskilling portfolio and interview preparation, we can guide you at every step of your career.SynergisticIT spares no efforts to connect you with a large network of tech giants, including Google, Apple, PayPal, Dell, Cisco, Client, etc. Presently, we are actively looking for ENTRY LEVEL DATA ENGINEER a driven mindset. Get the right opportunity and gain experience in building web-centric solutions on Java.Who Should Apply : Recent Computer science/Engineering /Mathematics/Statistics or Science Graduates or anyone looking to make their career in IT IndustryWe also assist in filing for STEM extension and H1b and Green card filing.Candidates who are serious about their future in the IT Industry and have set big goals for themselves.Candidates having difficulty in finding jobs or cracking interviews or who wants to improve their skill portfolio. We also offer Skill Enhancement Programs if the candidates are missing skills or experience which our clients need with great outcomesCandidates can benefit from skill enhancement if they fall into the below categories. If they are qualified with enough skills then no need for skill enhancementCandidates Who Lack ExperienceHave had a break in careersLack Technical Competencycandidates who want to get employed and make a career in the Tech Industry Please Also Check The Below Linkshttps://www.synergisticit.com/candidate-outcomes/https://www.synergisticit.com/java-track/https://www.synergisticit.com/data-science-track/https://www.synergisticit.com/which-is-the-best-option-for-tech-job-seekers-staffing-companies-consulting-companies-bootcamps-or-synergisticit/https://www.synergisticit.com/contact-us/If the skills are not a match candidates can opt for Skill enhancement. Or their resume can be sent out to clients to see if responses are achievableREQUIRED SKILLS For Java/Software Programmers Bachelors degree or Masters degree in Computer Science, Computer Engineering, Electrical Engineering, Information Systems, ITHighly motivated, self-learner, and technically inquisitiveExperience in programming language Java and understanding of the software development life cycleKnowledge of Core Java , javascript , C++ or software programmingSpring boot, Microservices and REST API's experienceExcellent written and verbal communication skills
For data Science/Machine learningRequired Skills Bachelors degree or Masters degree in Computer Science, Computer Engineering, Electrical Engineering, Information Systems, ITHighly motivated, self-learner, and technically inquisitiveExperience in programming language Java and understanding of the software development life cycleKnowledge of Statistics, Python, data visualization toolsExcellent written and verbal communication skills
Preferred skills: NLP, Text mining, Tableau, Time series analysisTechnical skills are required by clients for selection even if its Junior or entry level position each additional Technical skill helps a candidate's resume to be picked by clients over other job seekers.Clients hire candidates with the right technical skills which they need and reject candidates who lack the required technical skills.No third party candidates or c2c candidatesPlease apply to the postingNo phone calls please. Shortlisted candidates would be reached out"
