job_title,company_name,location,job_link,job_id,job_description
Data Engineer,Care.com,"Austin, TX (Remote)",https://www.linkedin.com/jobs/view/3765031801/?eBP=JOB_SEARCH_ORGANIC&refId=t9HE8VvUb%2BJaHM%2Brfs1tnA%3D%3D&trackingId=wSyaXPVtWIgnMO3Ah7lOjA%3D%3D&trk=flagship3_search_srp_jobs,3765031801,"About the job
            
 
About Care.comCare.com is a consumer tech company with heart. We're on a mission to solve a human challenge we all face: finding great care for the ones we love. We're moms and dads and pet parents. We have parents and grandparents, so we understand that everyone, at some point in their lives, could use a helping hand. Our culture and our products reflect that.Here, entrepreneurs, self-starters, team players, and big thinkers unite behind a common cause. Here, we're applying data analytics, AI, and the latest technologies to solve universal problems and connect people in new ways. If you like having autonomy, if you thrive on collaboration and building new things, and if you're all about using your talent for good, Care.com is the place for you.What Your Days Will be Like:The Data Engineer will be focusing on building out data feeds and tooling from our application platform and enable rapid ingestion into our centralized Data Lake/Data Warehouse. The Data Engineer will work across business areas and application teams at Care.com to rationalize data and design, build and maintain reusable data feeds which and ultimately empower analytics consumption at Care.com.The ideal candidate will have professional experience building data pipelines in a technical environment. S/he will have an understanding of application development, data warehousing, demonstrate strong business judgment, and be able to prioritize in a fast-paced environment.What You'll Be Working On:  Collaborate and partner with application teams to understand data collection/generation and design and partner to build and implement data feeds from our product tech stackDesign, develop, and build code for rapid feeds and ingestion into the Data WarehouseIdentify data sources used for building out data architecture diagrams/modelsEstablish engineering practices and setup frameworks for ""Data as a Service""Collaborate with relevant delivery teams, including infrastructure, operations, site reliability engineering, product development, and others to perform evaluations, POCs, and ultimately implement and operationalize new technology. Solve code level problems quickly and efficiently Participate in demos and code reviews Promote software best approach, standards, and processes Shape development processes to promote a high-quality output while continuing to iterate quickly Incorporate best practices for security, performance, and data privacy into data pipelines
What You'll Need to Succeed: BS or MS in Computer Science or relevant engineering experience5+ years work experience in Data Engineering/data pipelines3+ years SQL experience is a must1+ years Unix/batch scripting preferred1+ years Python experience is a plus1+ years Windows server admin experience is a plusExperience interfacing with business teams and turning requirements and vision into a technical realityMySQL & Vertica Experience a plus/preferredAWS experience is a plusAbility to drive efforts from start to finish as a self-motivatorKnowledge in Data Warehousing is a MUSTProven ability to maintain performance level in a fast-paced agile environment Pragmatic and realistic with solutions
For a list of our Perks + Benefits, click here!Care.com supports diverse families and communities and seeks employees who are just as diverse. As an equal opportunity employer, Care.com recognizes the power of a diverse and inclusive workforce and encourages applications from individuals with varied experiences, perspectives, and backgrounds. Care.com is committed to providing reasonable accommodations for qualified individuals with disabilities. If you need assistance or accommodation, please reach out to talent@care.com.Company Overview:Available in more than 20 countries, Care.com is the world's leading platform for finding and managing high-quality family care. Care.com is designed to meet the evolving needs of today's families and caregivers, offering everything from household tax and payroll services and customized corporate benefits packages covering the care needs of working families, to innovating new ways for caregivers to be paid and obtain professional benefits. Since 2007, families have relied on Care.com's industry-leading products—from child and elder care to pet care and home care. Care.com is an IAC company (NASDAQ: IAC).Salary Range: 110,000 to 135,000. The base salary range above represents the anticipated low and high end of the national salary range for this position. Actual salaries may vary and may be above or below the range based on various factors including but not limited to work location, experience, and performance. The range listed is just one component of Care.com's total compensation package for employees. Other rewards may include annual bonuses and short- and long-term incentives. In addition, Care.com provides a variety of benefits to employees, including health insurance coverage, life, and disability insurance, a generous 401K employer matching program, paid holidays, and paid time off (PTO)."
Senior Data Engineer,Nike,"Beaverton, OR (Remote)",https://www.linkedin.com/jobs/view/3775090168/?eBP=JOB_SEARCH_ORGANIC&refId=t9HE8VvUb%2BJaHM%2Brfs1tnA%3D%3D&trackingId=ZEBIiByV1lxJoGmISAE8tg%3D%3D&trk=flagship3_search_srp_jobs,3775090168,"About the job
            
 
Work options: RemoteTitle: Senior Data EngineerLocation: Remote, Beaverton, ORDuration: 6 Month ContractBecome a Part of the NIKE, Inc. TeamNIKE, Inc. does more than outfit the world's best athletes. It is a place to explore potential, obliterate boundaries and push out the edges of what can be. The company looks for people who can grow, think, dream and create. Its culture thrives by embracing diversity and rewarding imagination. The brand seeks achievers, leaders and visionaries. At Nike, it’sWhat You Will Work OnWe are looking for an experienced Senior Data Engineer to join our data team. You will be responsible for maintaining and improving our production Airflow pipelines, as well as developing new features using Python. This role requires strong Python programming skills, expertise with Airflow, and experience with SageMaker pipelines. Maintain and improve existing Airflow DAGs that move data through our analytics pipelineWork closely with data scientists and analysts to understand requirements for new pipelines and data transformation logicDevelop reusable Python modules and libraries for data transformation and integration Migrate existing Airflow pipelines to SageMaker pipelines utilizing our proprietary ETL libraryImplement new features for our Deployment Optimization platform using PythonMonitor pipeline health, troubleshoot issues, and resolve bugs in a timely mannerFollow best practices for version control, testing, and code reviews
What You Bring 5+ years of experience building and maintaining Airflow pipelinesExpert knowledge of Python, including modules like Pandas, NumPy, and SQLAlchemyExperience developing and deploying SageMaker pipelinesStrong understanding of data structures, algorithms, distributed computing, and data modeling Experience with Git, CI/CD, and automated testing frameworksExcellent communication and collaboration skills"
Remote Entry Level Data Analyst/Engineer,SynergisticIT,"White Plains, NY (Remote)",https://www.linkedin.com/jobs/view/3774171423/?eBP=JOB_SEARCH_ORGANIC&refId=f6As7U02xhgNmK54aPROHg%3D%3D&trackingId=NY7Vx63VHcR6A8j%2B2TkZ0w%3D%3D&trk=flagship3_search_srp_jobs,3774171423,"About the job
            
 
At SynergisticIT, we're all about making connections. Whatever IT goals you have, our software programmers can help achieve those. Our Software development teams can take up turnkey projects and execute them in an effective and efficient manner. If you are looking to source talent our recruiters will find the ideal IT talent for your company. What's the secret to our success? Well, it all starts with taking quality time to listen to each client's specific needs. After we have a thorough grasp of your IT goals, we can better customize our Developments as per your specific needs. We can also tailor make recruiting programs to exceed your expectations. Since our founding in 2010, SynergisticIT's strategies have earned the company an enviable position in the software development, IT staffing and IT skill enhancement fields. SynergisticIT continues to work with hundreds of satisfied American clients with our software programmers working on our projects and after gaining hands on experience on cutting edge technologies moving to contribute their skills to great clients like Apple, Google, Client, Ebay, Paypal, Kroger, the Walt Disney Company and hundreds more. If you are tired of working with inefficient programmers who take a lot of time to ramp up we want you to try us. Our software programmers can hit the ground running and get you the maximum return on your investment. You have already tried the rest its time you tried the best. SynergisticIT - Home of the Best Data Scientists and Software Programmers in the Bay Area. Why Us ? SynergisticIT has a proven track record of successfully skill enhancement and staffing IT employees for some of the world's most iconic brands. Our team takes the time to fully understand every client's needs so we could best meet your IT staffing requirements. The knowledgeable staff at SynergisticIT is always more than happy to work with clients to ensure they reach their software development goals. Besides staffing, SynergisticIT is also committed to helping young IT professionals advance their career with a robust upskill program . Everyone who goes through SynergisticIT's program learns all the skills necessary to succeed in many IT fields ranging from Java to Machine Learning. Additionally, everyone trained at SynergisticIT has been through extensive mock and technical interview screenings to bolster their career prospects. Last, but certainly not least, SynergisticIT takes great care to respect the privacy considerations for every client. All companies who work with SynergisticIT can rest assured their confidential data is protected using the most up-to-date encryption technologies. SynergisticIT also complies with all the latest NDA agreements. REQUIRED SKILLS For Java /Software Programmers   Bachelors degree or Masters degree in Computer Science, Computer Engineering, Electrical Engineering, Information Systems, IT  Highly motivated, self-learner, and technically inquisitive  Experience in programming language Java and understanding of the software development life cycle  Project work on the skills  Knowledge of Core Java , javascript , C++ or software programming  Spring boot, Microservices, Docker, Jenkins and REST API's experience  Excellent written and verbal communication skills 
 For data Science/Machine learning Required Skills  Bachelors degree or Masters degree in Computer Science, Computer Engineering, Electrical Engineering, Information Systems, IT  Project work on the technologies needed  Highly motivated, self-learner, and technically inquisitive  Experience in programming language Java and understanding of the software development life cycle  Knowledge of Statistics, SAS, Python, Computer Vision, data visualization tools  Excellent written and verbal communication skills 
 Preferred skills: NLP, Text mining, Tableau, PowerBI, Time series analysis  We regularly interact with the Top Tech companies to give our candidates a competitive advantage-Please see us exhibiting at Oracle Cloud world /Oracle Java one (Las vegas) -2022 and at Gartner Data Analytics Summit (Florida)-2023 Oracle CloudWorld Event (OCW) Las Vegas 2022 | SynergisticIT - YouTube https://www.youtube.com/watch?v=OAFOhcGy9Z8  https://www.youtube.com/watch?v=EmO7NrWHkLM  https://www.youtube.com/watch?v=NVBU9RYZ6UI  https://www.youtube.com/watch?v=Yy74yvjatVg SynergisticIT at Gartner Data and Analytics Summit 2023 - YouTubeFor preparing for interviews please visit  https://www.synergisticit.com/interview-questions/  We are looking for the right matching candidates for our clients  Please apply via the job posting  REQUIRED SKILLS For Java /Full Stack/Software Programmer   Bachelors degree or Masters degree in Computer Science, Computer Engineering, Electrical Engineering, Information Systems, IT  Highly motivated, self-learner, and technically inquisitive  Experience in programming language Java and understanding of the software development life cycle  Project work on the skills  Knowledge of Core Java , javascript , C++ or software programming  Spring boot, Microservices, Docker, Jenkins and REST API's experience  Excellent written and verbal communication skills 
 For data Science/Machine learning Positions Required Skills  Bachelors degree or Masters degree in Computer Science, Computer Engineering, Electrical Engineering, Information Systems, IT  Project work on the technologies needed  Highly motivated, self-learner, and technically inquisitive  Experience in programming language Java and understanding of the software development life cycle  Knowledge of Statistics, SAS, Python, Computer Vision, data visualization tools  Excellent written and verbal communication skills 
 Preferred skills: NLP, Text mining, Tableau, PowerBI, Tensorflow  If you get emails from our skill enhancement team please ask them to take you off their distribution list and make you unavailable as they share the same database with the client servicing team.  No phone calls please.  Shortlisted candidates would be reached out. No third party or agency candidates or c2c candidates"
Data Engineer II - Remote,Net Health,"Pittsburgh, PA (Remote)",https://www.linkedin.com/jobs/view/3779192681/?eBP=JOB_SEARCH_ORGANIC&refId=f6As7U02xhgNmK54aPROHg%3D%3D&trackingId=ZcbCZSjyf2ddIhp4b2AqMA%3D%3D&trk=flagship3_search_srp_jobs,3779192681,"About the job
            
 
Job DetailsDescriptionAbout Net HealthBelong. Thrive. Make a Difference.Are you looking for a meaningful and satisfying career where you have endless opportunities to grow and be financially rewarded? Net Health may be the perfect place for you.A high-growth and profitable company, we help caregivers harness data for human health. We also honor and respect the needs of our Net Health family and staff, which is why we offer a work-from-anywhere environment and unlimited PTO. Our welcoming and collaborative culture paired with progressive benefits makes Net Health the ultimate career home!As a leading-edge SaaS company in healthcare, we deliver solutions that help patients get better, faster, and live more fulfilling lives. Our software and predictive analytics cover the continuum of care, from hospital-to-home, across various medical specialties. Come join us and start the next chapter of your exciting career while helping others to live better lives.World-Class Benefits That Reflect Our World-Class Culture.Click Here to Learn More!:#WorkFromAnywhere #UnlimitedPTO #ComprehensiveBenefitsPackage #EmployeeResourceGroups #CasualDressCode #PrioritizedEmployeeWellness #DiversityAndInclusion #AVoice #NewHireSupport #CareerDevelopment #EducationalAssistance #EmployeeReferralBonus #ProgressiveParentalLeaveJob OverviewDesigns, models, documents, and guides the logical and conceptual relationship of data and database changes for complex applications. Analyzes needs and requirements of existing and proposed systems, and develops technical, structural, and organizational specifications. May also develop, implement, and maintain data systems to meet designs, models and specifications. This person will analyze client production issues and create SQL statements to fix the issue.Responsibilities And Duties Will work with development wen new features or changes happen to the schemaCreate and maintain internal procedures and documentation around reusable SQL scripts or new additions to the data schema due to newly deployed features and functionalityAssist support with triaging complex client issuesProvide ad-hoc reportsAnalyze data to spot anomalies, trend and correlate similar data setsAnalyze large, complex datasets to drive actionable insights and recommendationsEvaluate failures, defects, systemic problems and hardwareConfer with clients to identify problems, replicate the problems, and troubleshoot for root causeParticipate in Agile/Scrum process to refine, prioritize, and build solutions to meet customer needsCreate and maintain internal procedures and documentation around reusable SQL scripts or new additions to the data schema due to newly deployed features and functionalityPerform other related duties as required and assigned
Qualifications Bachelor’s degree or equivalent experience2-4 years of relevant experience
Required Software Experience MS Excel or Google Spreadsheets2-4 years SQL (both DML and DDL)Exposure to 1-2 relational Database Systems (Postgres, Oracle, SQl Server, Snowflake, RedShift, BigQuery etc.)2-4 years Data Visualization, Analysis, or reporting1-2 years with at least 1 scripting language (Javascript, Python, PHP, Bash, Powershell)0-2 years building and maintaining an enterprise Data Warehouse
Note: This job description is not intended to be all-inclusive. Employee may perform other related duties as requested to meet the ongoing needs of the organization.Colorado Pay Law: If you are a Colorado resident and this role is available in Colorado or remote, you may be eligible to receive additional information about the compensation and benefits for this role, which we will provide upon request. Please send an email to Recruiting@NetHealth.comIf you are a CA, CT, CO, IL, MD, NV, RI, WA or NY City resident and this role is available in one of those locales or remote, you may be eligible to receive additional information about the compensation and benefits for this role, which we will provide upon request. Please send an email to Recruiting@NetHealth.com"
Data Engineer,Smile ID (formerly Smile Identity),"San Francisco, CA (Remote)",https://www.linkedin.com/jobs/view/3641780519/?eBP=JOB_SEARCH_ORGANIC&refId=f6As7U02xhgNmK54aPROHg%3D%3D&trackingId=yVD7H%2F83Eg1M%2FrhlHAlc7A%3D%3D&trk=flagship3_search_srp_jobs,3641780519,"About the job
            
 
Smile Identity builds trust.Smile Identity is Africa's leading identity verification, and digital Know Your Customer (KYC) provider. We help companies scale rapidly across Africa by confirming the true identity of their users in real time, using any smartphone or computer. Our technology is powered by proprietary Machine Learning algorithms designed specifically for African faces, devices and network connections.Our team is a diverse group of hardworking, truth-seeking, and fun-loving Smilers spanning 5 offices, 10 countries and 8 time zones. Our products are already making waves across many industries, from Banking to Fintech and Telecoms. We recently announced a $20M Series B raise and are backed by leading global investors, including Norsken22, Costanoa, CRE, Future Africa, Susa Ventures, Commerce Ventures, Courtside Ventures, Two Culture Capital, Latitude, Valuestream Ventures, Intercept Ventures and Vinod Khosla who are supporting us every step of the way.Do you like working alongside a team of intelligent individuals? Do you want to have fun while making a real difference? Here at Smile Identity, you'll get the freedom and autonomy you need to do your best work, the flexibility to be creative, and the opportunity to grow and put your unique stamp on our mission.What are you waiting for? Come with us on this amazing journey!The RoleWe are looking for a data engineer who loves bringing order to chaos. The individual in this role will maintain our data warehouse and associated data infrastructure and provide the entire organization with the data they need to be successful. This role is open to candidates across the globe. You will be working with colleagues ranging from the US West Coast to Eastern Africa, with that in mind candidates working in timezones between US Eastern and GMT are preferred.What You Will Do Work with our entire organization based in the US, London, Berlin, Lagos, Nairobi, and Cape Town to centralize our data and maintain our data warehouses/lakes. You will select the right tools and services to bring our data together and provide a solid foundation for all our product and business analytics. Your north star? Empowering the entire organization with data to make the best possible decisions. Design, build and launch extremely efficient and reliable data pipelines to move data. Architect, build and launch new data models that provide intuitive analytics. Manage the delivery of high impact dashboards, tools and data visualizationsBuild data expertise and own data quality, including defining and managing SLAs for data sets. Partner with leadership, engineers, commercial, and data scientists to understand data needs. Influence short- and long-term strategy with cross-functional teams to drive impact. Educate your partners: Use your data and analytics experience to discover opportunities, identifying and addressing gaps in existing logging and processes. 
Requirements 4+ years experience with data infrastructure, ETL design, data warehousing, schema design and dimensional data modeling2+ years of experience in SQL, Python, or similar languagesExperience with designing and implementing real-time pipelinesExperience with code management tooling such as Git, GithubExperience with data migrations in production settingsYou have a deep understanding of modern data tooling and infrastructureYou are comfortable working independently with periodic guidance from engineering & business teamsYou are a strong believer in scale and automationYou are entrepreneurial — you take initiative, solve problems and love to troubleshoot. You are a great collaborator and can communicate effectively. You enjoy teaching and learning from your colleaguesYou are not ideological about programming languages or tools. You have opinions but are open to discussion and tradeoffsYou are a pragmatistYou are a seeker of truth
Preferred Qualifications Experience querying big data using Spark, Presto, Hive, Impala, etc. Experience with data quality and validationExperience with SQL performance tuning and E2E process optimizationExperience creating reports and dashboards with modern business intelligence tools (Tableau, Metabase preferred)Experience working with Postgres, Hevo, and cloud or on-prem Big Data/MPP analytics platform (i.e. Snowflake, AWS Redshift, Google BigQuery, Azure Data Warehouse, Netezza, Teradata, or similar). Interest or experience in working in the African Fintech EcosystemExperience in a high-growth team and/or startup experienceAbility to communicate and prioritise effectively with a distributed team around the world
Compensation Salary commensurate with experienceStock options HealthcareOpportunities for travel (Post-Covid19)
Autonomy and a chance to work at a mission-driven company with purposeWhat Success Looks LikeSuccesses in your first 3 months include Take the time and learn the ins and outs of our data warehouse and dashboards. Investigate how data is being logged in our systems and what existing data pipelines exist across our two data warehouses (Postgres and Redshift). Evaluate existing dashboards, data quality, and pipelines and identify gaps. Get introduced to the Product and Engineering team and their bi-weekly sprint processes. At this point you are mostly observing the dynamics and taking on tasks by the team, while building a partnership and exploring support opportunities. 
In your first 6 months Based on your initial exposure to our data stack, you have already built several improvements based on the gaps you've identified. You are able to manage the flow of data across the stack. You have extended our system capabilities as needed and have improved efficiency and simplicity of shared tools and libraries. You are deeply embedded in how we set up data logging and are able to manage and successfully execute on data requirements from teams across the company (e.g. Engineering, Product, CVML, Data Science, Marketing, Commercial). You proactively develop technical methodologies or tools which can solve important classes of problems. You can evangelize these methodologies and tools to other data scientists and engineers to scale multiple people. 
In your first 12 months You are the company expert in our data, infrastructure, and technical architecture, and are actively involved in product and business operations to either improve existing data tools or suggest new methodologies to accelerate team execution, including influencing data best practices. You drive scalable solutions across teams. You are able to solve challenging technical problems faced by multiple teams and provide significant technical advice to newer or less-technical analysts."
