job_title,company_name,location,job_link,job_id,job_description
Entry Level Data Engineer (Remote),SynergisticIT,"Savannah, GA (Remote)",https://www.linkedin.com/jobs/view/3767597153/?eBP=JOB_SEARCH_ORGANIC&refId=Yl0fj3JHOQuAJZVhed8Kzg%3D%3D&trackingId=ORiZaPFIsQc7kifgaghNwQ%3D%3D&trk=flagship3_search_srp_jobs,3767597153,"About the job
            
 
The Job Market is Challenging due to almost 300,000 Tech Layoffs since October 2022 due to which thousands of laid off Techies are competing with existing Jobseekers. Entry level Job seekers struggle to get responses to their applications forget about getting client interviews. As the Saying goes ""when the Going gets tough the Tough get going” Candidates who want to make a tech career they need to differentiate themselves by ensuring they have exceptional skills and technologies to be noticed by clients.Since 2010 Synergisticit has helped Jobseekers differentiate themselves by providing candidates the requisite skills and experience to outperform at interviews and clients. Here at SynergisticIT We just don't focus on getting you a Job we make careers.All Positions are open for all visas and US citizensWe are matchmakers we provide clients with candidates who can perform from day 1 of starting work. In this challenging economy every client wants to save $$$'s and they want the best value for their money. Jobseekers need to self-evaluate if they have the requisite skills to meet client requirements and needs. Clients now post covid can also hire remote workers which increases even more competition for jobseekers.We at Synergisticit understand the problem of the mismatch between employer's requirements and Employee skills and that's why since 2010 we have helped 1000's of candidates get jobs at technology clients like apple, google, PayPal, western union, Client, visa, Walmart labs etc. to name a few.We have an excellent reputation with the clients. Currently, We are looking for entry-level software programmers, Java Full stack developers, Python/Java developers, Data analysts/ Data Scientists, Machine Learning engineers for full time positions with clients.Who Should Apply Recent Computer science/Engineering /Mathematics/Statistics or Science Graduates or People looking to switch careers or who have had gaps in employment and looking to make their careers in IT IndustryWe assist in filing for STEM extension and also for H1b and Green card filing to Candidates We also offer optionally Skill and technology enhancement programs for candidates who are either missing skills or are lacking Industry/Client experience with Projects and skills. Candidates having difficulty in finding jobs or cracking interviews or who wants to improve their skill portfolio. If they are qualified with enough skills and have hands on project work at clients then they should be good to be submitted to clients. Shortlisting and selection is totally based on clients discretion not ours.please check the below links to see success outcomes of our candidateshttps://www.synergisticit.com/candidate-outcomes/We regularly interact with the Top Tech companies to give our candidates a competitive advantage-Please see us exhibiting at Oracle Cloud world /Oracle Java one (Las vegas) -2023/2022 and at Gartner Data Analytics Summit (Florida)-2023https://youtu.be/Rfn8Y0gnfL8?si=p2V4KFv5HukJXTrnhttps://youtu.be/-HkNN1ag6Zk?si=1NRfgsvL_HJMVb6Qhttps://www.youtube.com/watch?v=OAFOhcGy9Z8https://www.youtube.com/watch?v=EmO7NrWHkLMhttps://www.youtube.com/watch?v=NVBU9RYZ6UIhttps://www.youtube.com/watch?v=Yy74yvjatVgFor preparing for interviews please visit https://www.synergisticit.com/interview-questions/We are looking for the right matching candidates for our clientsPlease apply via the job postingREQUIRED SKILLS For Java /Full Stack/Software Programmer Bachelor's degree or Master's degree in Computer Science, Computer Engineering, Electrical Engineering, Information Systems, ITHighly motivated, self-learner, and technically inquisitiveExperience in programming language Java and understanding of the software development life cycleProject work on the skillsKnowledge of Core Java, JavaScript, C++ or software programmingSpring boot, Microservices, Docker, Jenkins and REST API's experienceExcellent written and verbal communication skills
For data Science/Machine learning PositionsRequired Skills Bachelor's degree or Master's degree in Computer Science, Computer Engineering, Electrical Engineering, Information Systems, ITProject work on the technologies neededHighly motivated, self-learner, and technically inquisitiveExperience in programming language Java and understanding of the software development life cycleKnowledge of Statistics, SAS, Python, Computer Vision, data visualization toolsExcellent written and verbal communication skills
Preferred skills: NLP, Text mining, Tableau, PowerBI, TensorFlowIf you get emails from our skill enhancement team please ask them to take you off their distribution list and make you unavailable as they share the same database with the client servicing team.No phone calls please. Shortlisted candidates would be reached out. No third party or agency candidates or c2c candidates"
Data Engineer (Remote),Cascade Debt,United States (Remote),https://www.linkedin.com/jobs/view/3755336571/?eBP=JOB_SEARCH_ORGANIC&refId=Yl0fj3JHOQuAJZVhed8Kzg%3D%3D&trackingId=4Xx4Px9sacyprSRPhO%2B4mQ%3D%3D&trk=flagship3_search_srp_jobs,3755336571,"About the job
            
 
Do you want to work in a small team where you can make a real difference in a company? Would you embrace the challenge of building a high impact platform that is used globally? Then we want to speak with you!About CascadeCascade is a fintech startup backed by Canadian and US investors that empowers companies to grow by democratizing access to institutional debt. We are building tools that modernize how companies raise and manage debt, lowering the barriers to entry to the $7 trillion specialty finance and alternative credit market for companies around the world. Founded just last year, we are gearing up for our next phase of technical development and are seeking a talented Data Engineer to lead the way.About The RoleAs a Data Engineer you’ll be an early member of a growing team building a pioneering platform in the debt infrastructure space. You will design, build, and launch efficient, scalable, and reliable data pipelines to move and transform data .What You’ll Do  Building databases, data lakes and data ingestion pipelines to integrate customer databases and datasets to our systems  Ingesting financial datasets from external customers, then u pdating and maintaining accurate and complete data mappings to ensure that our product s are displaying high quality data  M onitoring and alerting across our data pipelines in order to make sure that our data ingests are reliable and correct  Translat ing business goals and stakeholder requirements into new data flows and deliver analytical insights ensuring that the data flows create real business value continuously 
Skills And Experience  2 + years experience in a data engineering or data analyst role  E xperience with relational SQL and NoSQL databases, including PostgreSQL , MySQL, MariaDB, MongoDB, Bigtable, etc.  E xperience working with ETL technologies , such as Databricks, Fivetran , or dbt  Proficiency in writing SQL queries and knowledge of analytical data warehouses such as RedShift, BigQuery , and Snowflake  Some experience with CI/CD automation such as GitHub Actions  Developing APIs and integrating with 3rd party APIs  Bonus: experience in fintech / SaaS / credit analysis 
People Who Thrive At Cascade Are  Self-starters, who take the initiative to tackle challenges in a remote work environment  Good communicators, who can operate without ego to discuss, learn, grow, and help others do the same  Passionate about creating great digital experiences for users  Problem solvers who are not satisfied with the status quo 
Benefits Remote: we are a remote-first company and are very flexible on hours as long as things get done Home-office: there’s a $1000 USD home office allowance to set yourself up Equity: we expect you to have an owner-mentality, and have the equity plan to match Benefits: health, dental, vision, and more Perks: we offer free lunches weekly and off-site trips Job satisfaction: we offer autonomy, ample opportunities for mastery, and an opportunity to make a difference for companies around the world"
Data Engineer,Anika Systems,"Leesburg, VA (Remote)",https://www.linkedin.com/jobs/view/3766103708/?eBP=JOB_SEARCH_ORGANIC&refId=Yl0fj3JHOQuAJZVhed8Kzg%3D%3D&trackingId=cuppQtLIdpAZqAuixSZ32Q%3D%3D&trk=flagship3_search_srp_jobs,3766103708,"About the job
            
 
Anika Systems is a fast growing, woman-owned small business that specializes in providing innovative IT solutions for federal government agencies. Our expertise lies in accelerating delivery in Data and Analytics, Intelligent Automation, Application Development, and IT Modernization. We are currently expanding our Federal team and are seeking a passionate and talented Data Engineer. This opportunity is 100% remote.Must be a U.S. Citizen with the ability to obtain and maintain a government suitability clearanceResponsibilities Designs, develops, builds, analyzes, evaluates, and installs database management systems to include database modeling and design, relational database architecture, metadata, and repository creation and configuration management.Defines and oversees database organizations, standards, controls, procedures, and documentation. Provides technical consulting in the definition, design, and creation of a database environment.Advises applications development staff and users on data-based solutions to business problems, data architectures, database management system facilities and capabilities, and the operation and tuning of databases.Designs and implements databases with respect to access methods, access time, batch processes, device allocation, validation checks, organization, protection and security, documentation, and statistical methods.Uses data mapping, data mining, and data transformational analysis tools to design and develop databases.Determines data storage and optimum storage requirements.Prepares system requirements, source analysis, and process analyses and designs throughout the database implementation.
Required Skills And Experience BA/BS and 1 year of relevant experienceExperience with DataBricks, SQL, PythonApplications development experience with data-based solutions to business problems, data architectures, database management system facilities and capabilities, and the operation and tuning of databases.Excellent communication skills (both oral and written) with process-oriented organizational skills to ensure project success
Desired Skills And Experience Demonstrated successful development experience with the full life cycle of government database management systems including database modeling and design, relational database architecture, metadata and repository creation, and configuration management.
Powered by JazzHRTlKWIorucJ"
Entry Level Software Engineer - Data Backend Engineer (Remote - Canada),Yelp,United States (Remote),https://www.linkedin.com/jobs/view/3752881757/?eBP=JOB_SEARCH_ORGANIC&refId=Yl0fj3JHOQuAJZVhed8Kzg%3D%3D&trackingId=fxvTFBElWeCrjvilzqYiIw%3D%3D&trk=flagship3_search_srp_jobs,3752881757,"About the job
            
 
Yelp engineering culture is driven by our values: we’re a cooperative team that values individual authenticity and encourages creative solutions to problems. All new engineers deploy working code their first week, and we strive to broaden individual impact with support from managers, mentors, and teams. At the end of the day, we’re all about helping our users, growing as engineers, and having fun in a collaborative environment. Interested in exploring data and finding innovative ways to collect it, curate it, and make it easily accessible for others to use? How about doing that at an enormous scale? Yelp’s datasets contain billions of interactions between users and local businesses around the globe. If working with our vast amount of data sounds exciting, come and join us!The Marketplace Data Observability team is responsible for managing, governing, and monitoring all of Yelp’s Ads data to protect our revenue stream and also support offline analysis that aids in making long term company decisions. We build tools that help us to better understand our data quality, and we strive to uncover data issues before they impact our consumers.As a Data Backend Engineer on this team, you will be responsible for building elegant and scalable data products that serve critical, up-to-date, structured information to support different types of analytics within Yelp. As a core contributor to our growing data modeling and data warehousing engineering efforts, you will help design and own mission-critical data flow pipelines and datastores to enable decisions including effective A/B testing and company investments. This opportunity is fully remote and does not require you to be located in any particular area in Canada. We welcome applicants from throughout Canada. We’d love to have you apply, even if you don’t feel you meet every single requirement in this posting. At Yelp, we’re looking for great people, not just those who simply check off all the boxes.  Build systems that can effectively store and crunch terabytes of data.Design and develop data models for efficient data storage, retrieval, and reporting.Create and maintain conceptual, logical, and physical data models using industry-standard modeling tools.Collaborate with cross-functional teams, including engineers, data analysts, business analysts, and data scientists, to understand data requirements and translate them into effective data models.Participate in data integration efforts, including ETL processes and data migration.Stay up-to-date with industry best practices, emerging technologies, and trends related to data warehousing.Support on-call rotations as needed to operate the team.
  Understanding of high performing and scalable data systems.Experience in building and orchestrating ETL pipelines.Experience with Data Lake or Data Warehouse landscape.A hunger for tracking down root causes and fixing them in systematic ways.Ability to communicate effectively to technical and non-technical cohorts alike. Exposure to some of the following technologies: Python, AWS Redshift, AWS Athena / Apache Presto, Big Data technologies (e.g S3, Hadoop, Hive, Spark, Flink, Kafka etc), NoSQL systems like Cassandra, DBT."
Remote Opportunity: Quantexa Data Engineer,SPAR Information Systems LLC,United States (Remote),https://www.linkedin.com/jobs/view/3680073191/?eBP=JOB_SEARCH_ORGANIC&refId=Yl0fj3JHOQuAJZVhed8Kzg%3D%3D&trackingId=2BCFtMnhgLQPfSo0rttHIA%3D%3D&trk=flagship3_search_srp_jobs,3680073191,"About the job
            
 
Hello All, Hope you are doing great!! Please go through the job descriptions and let me know your interest. Role: Quantexa Data engineer  Location: Remote Duration: Long Term Contract Job Description: 1. End to End usage of Quantexa including guiding our client team on how to use from both front end and data ingestion Reason they are asking for Certification 2. Resolve Entity issues with data 3. Knowledge of Scala and Hive which requires coding experience using parquet 4. Advanced SQL knowledge requiring writing SQL queries 5. Experience having worked with GCP data lake 6. Quantexa certification requiredThanks & Regards,Satnam SinghDirect: 201 623 3660Email : Satnam.singh@sparinfosys.com"
Data Engineer,Catalist,"Washington, DC (Remote)",https://www.linkedin.com/jobs/view/3744951279/?eBP=JOB_SEARCH_ORGANIC&refId=Yl0fj3JHOQuAJZVhed8Kzg%3D%3D&trackingId=GCYrVMiSgKtcUGLgYv%2FP6A%3D%3D&trk=flagship3_search_srp_jobs,3744951279,"About the job
            
 
For over 17 years, Catalist has been a leader in civic data and data science innovation. Our mission is to provide progressive organizations with the data, software, and services needed to better identify, understand, and communicate with the people they need to engage and mobilize. Our clients include the largest, most influential organizations in the U.S. active in civic engagement, advocacy, and political campaigns.Catalist is home to a dedicated, creative team of technologists, data scientists, and campaign experts committed to using our talents and technology to nurture a vibrant and growing progressive community.As a Data Engineer at Catalist, you will work closely with the Analytics and Technology departments to design, build, support, and maintain various data pipelines and processes with an end goal of providing data and intelligence to the progressive community. This role primarily involves translating data architecture designs into functional processes, code, and systems.The ideal candidate will be a highly motivated individual with excellent technical skills, a strong desire to learn new skills, and an interest in progressive politics. Catalist values creativity and problem-solving. Our work is on the cutting edge of data-driven politics, and your support will help Democratic candidates and progressive organizations conduct successful advocacy and electoral campaigns.This position reports to the Deputy Chief Data Officer. The Data Engineer is a part of a growing Data team that supports all underlying work at Catalist.This position is included in our CWA bargaining unit.Principle Duties & Responsibilities Develop scalable, production processes, code, and systems for data ingest, transformation, modeling, and reporting across a variety of platformsTranslate mock-ups and designs into functional processes, code, and systemsCreate architecture designs when neededProvide quality assurance and testing on processes, code, systems, and productsBecome an internal subject matter expert on various datasets and support other Catalist departments/teams on usage of those datasetsExecute ad-hoc data and database maintenance tasks as requiredProject manage cross-departmental efforts, with direct responsibility for stakeholder engagement, management, and execution of technical elements
Requirements BS or BA in a technical field, or relevant experience1-2 years of experience working with SQL databasesExperience with data cleaning or ETL processesExperience with distributed computing systems and/or distributed datastores (particularly the Hadoop ecosystem)Experience managing projectsFamiliarity with Catalist data, progressive politics, voter files, and/or commercial dataBackground check required
Preferred Skills & Abilities Willingness to be a problem solver and produce results in a fast paced environmentAbility to be creative and personable, and articulate ideas clearlyExperience working with SQL databasesProficiency with Python or another object-oriented programming language (R, Java, Scala, etc…)Experience working in cloud environments (AWS, GCP, etc.)Experience working in command line environments such as BashExperience with a version control tool such as git or github
BenefitsMedical, Dental, Vision, Prescription DrugCatalist offers Medical, Dental, Vision, and Prescription Drug coverage for eligible staff and their eligible dependents. Catalist’s Medical plan is a comprehensive PPO program including Prescription Drug coverage with 85% of the premium paid by Catalist. Dental and Vision coverage is provided at no cost to employees.Group Term Life Insurance and Long-Term & Short-Term Disability CoverageGroup Term Life Insurance and Long-Term and Short-Term Disability coverage is available for eligible staff. These benefits are provided at no cost to Catalist employees.401(k) Safe Harbor PlanA 401(k) Safe Harbor Plan is available to eligible staff with a 3% contribution from Catalist from the date of hire. Employees may contribute pre-tax or post-tax from their salary up to the legal limits set forth by the IRS.Medical and Dependent Care Flexible Spending Accounts (FSAs)Catalist offers an FSA Program that gives eligible staff the ability to pay out-of-pocket medical/dental/vision/child care expenses from pre-tax earnings.Transit BenefitsCatalist also makes available a Transit benefit FSA program to eligible employees using pre-tax contributions with a company match.Professional Development and Remote Work ExpensesEligible employees may be reimbursed up to $750 each year for professional development / education and remote work expenses.Student Loan PayDown or SaveUpCatalist offers a Student Loan PayDown and College SaveUp benefit for eligible staff.Vacation, Personal Leave, Sick Leave BenefitsCatalist offers generous vacation benefits to all eligible staff. Eligible employees also receive:  14 Paid Holidays Personal Days Sick Leave Parental Leave
Hybrid Office/Remote WorkCertain positions at Catalist are eligible for Office/Remote Hybrid or full Remote status."
"Data Engineer (Associate Consultant), June 2024",UDig,"Nashville, TN (Remote)",https://www.linkedin.com/jobs/view/3716039960/?eBP=JOB_SEARCH_ORGANIC&refId=Yl0fj3JHOQuAJZVhed8Kzg%3D%3D&trackingId=ipnILYcX%2F%2BiycJaullk23Q%3D%3D&trk=flagship3_search_srp_jobs,3716039960,"About the job
            
 
Can UDig It? UDig designs, builds, and implements technology solutions that deliver on business objectives. People join our team because they are excited to have an impact on the future of our organization, passionate about delivering meaningful results, and energized by solving complex problems. Oh, and they like working with other driven, smart, and authentic people!UDig is proud to be recognized as a ""Best Places to Work"" in Virginia and Tennessee. We're committed to fostering a transparent environment where leadership is accessible, professional development opportunities are abundant, and you are empowered to achieve your career goals. You'll collaborate, develop deep relationships with teammates, and accelerate your success while having fun!If you're graduating in May 2024 and excited by the idea of impacting organizations by building data solutions to achieve business goals, you should consider joining our growing technology team.How Things Go DownAs a new, entry-level teammate, you'll take part in our ""Breaking Ground"" training program designed to help you quickly get up-to-speed on UDig's delivery approach within a project team. The program covers: UDig delivery process and methodologies such as gathering requirements and delivering projects using agileTechnical guidance and instruction on the best practices from Data leaders at UDigDelivering executive and technical presentationsCoaching to prepare you to for success on your first client project at UDig
A typical day might entail: Project standups and check-insDesign and development of data pipelines, BI reports, and morePlanning and participating in project demosContributing to internal UDig projectsCareer and job growth through UDig-provided trainingCreating long-lasting friendships with teammates through fun activities as well as your projects (including social events, winning a prize for guessing the weight of pumpkin, or sharing experience on cool tech side projects)
UDig believes it is important for Associate Consultants going through our Breaking Ground program to reside in one of our major markets (Richmond, VA or Nashville, TN metro area) for at least the first year of employment.Want to learn more? Hear directly from our teammates by checking out our 'A Day in the Life' blog series: https://www.udig.com/digging-in/breaking-ground-2023/Sound Interesting? Here's the Technical PieceBelow are a few boxes you should be able to check if you're interested: Don't check every box? Go ahead and apply! 1+ year of experience with relational database management systems such as Microsoft SQL Server, MySQL, or OracleUnderstanding of the full lifecycle of design, development, and implementation of data solutions including architecture design, development, testingSome experience in ETL development or reporting is a plusAbility to present technical ideas and high-level concepts and solutions to internal and external team members with varying degrees of technical knowledgeBachelor's Degree in in computer science, information technology, or any science or business disciplineAbility to take your work seriously but also seriously enjoy a good time with your UDig colleagues
What's in It For You? At UDig, you will build your career alongside talented and experienced developers while gaining experience and having fun! We provide continuous challenges and professional development opportunities. Additionally, we offer:  Competitive salary, merit reviews, and career advancement pathsFlexible, hybrid environmentIndividual $1500 Training BudgetRegular team building and social activities (virtual and/or in-person)Transparent culture with strong communication and access to leadershipGreat benefits like Generous Paid Time Off, company holidays, and parental leaveMultiple Single and Family Health Insurance plans to choose fromDental & Vision coverageShort-Term and Long-Term disabilityOptional accident and critical illness coverageMatching 401(k)and more!"
