job_title,company_name,location,job_link,job_id,job_description
Data Engineer,Maven Workforce Inc.,"Budapest, Hungary (Hybrid)",https://www.linkedin.com/jobs/view/3771892488/?eBP=CwEAAAGMQBV_eQ0XDOpyZXV6Qra1C7orIc6v3AjII0nq25CxVVNzrg8lKaxq3O6cUKDauThEddW5Gg4ZUxjO2sHyIpSnOMw763gp45IAsanTcP5uR7aFL8pqWf4pZt7tsXvo7VJpyCMO8vaQpdICy3nmxL2vikPGWOVugrSB99drY9fC4y0e2vyL7tvwQlrKGYbcYa-NijdVlxcHs--3PRkt-Xo8zyEPc43c3SyYRZh9Yn5t9v8bbi7qzk07bCkSXlZ2SON1_q2Ks7_F57p7GIlXxxRkVRndaGLWKLhYTXBKn4UDOsK9CBH_Om-Y4TuSj9oH0wworu5Hw_f5fFHauxPJna_-xdb4eNLsNytFgtruBK7kMHJxxPHF_YIQ9QP-idRA&refId=Zzm30IqhBVvf80Si0PuBcQ%3D%3D&trackingId=KzAeP2ldSoQ%2BDswDuj6FbA%3D%3D&trk=flagship3_search_srp_jobs,3771892488,"About the job
            
 
Experience (ideally, type script / Java), Palantir knowledge, ""• Data Engineer with several years of experience at big companies (ideally insurance/financial industry)• Experience with ingestion, processing and reporting of structured and unstructured data• Experience with Scrum/Agile development methodologies• Familiarity with data structures, algorithms, storage systems, cloud infrastructure• Proficient in Python / PySpark and Spark SQL• Experience with version control systems like GIT• Front-end application experience (ideally, type script / Java)• Ability to communicate complex technical concepts and results to non-technical audiences """
Data Engineer,HCLTech,"Gothenburg, Vastra Gotaland County, Sweden (Hybrid)",https://www.linkedin.com/jobs/view/3771904376/?eBP=CwEAAAGMQBV_eVVE1em9xJRspxis_7ZLvEVBuI617s26dS1W-xjKmLNng9e1JvMVbwKZGpJoxLHzp6J-NzaDobHiSq5RBiXaDWfEKNAd46rAjfGFATg47pHqCx0gpksgA-NuOSwDU73izg9UxWY5fs_2xiN2HZ8-gAtVxHs9NqHSlnIsBPm_Ox_8lNid8Yaa7tBSyZdiUMBqrQzNxzVX9cPrwAlVa0C_kUjJf_sQyU4Oea0Qko9Mpceg_nPcQd_L_k0NKan-6wuMW4g9eZcalvXcX5bMMYnUfDEmdiRUf5c5yRHhRp-kMIOFGYTulRnnD7a8evezwFPTg0tu6Vjq-FGAht5BiyedOIUVpyT1s6j15ODWYXGuIT1Grbd0iQDU8Q&refId=Zzm30IqhBVvf80Si0PuBcQ%3D%3D&trackingId=oOULYeudBo2had%2BB6MA20A%3D%3D&trk=flagship3_search_srp_jobs,3771904376,"About the job
            
 
We are hiring for Azure Data Engineer for SwedenKindly share the cv if keen for the roleJD for Azure Data Engineer : Data pipeline designCode developmentImplementation of data pipelines in SAP Deep understanding and good hands-on experience on:MandatoryProgramming languages – Any one of JAVA, Scala or PythonCloud data analytics related services – Experience in any of the cloudUnderstanding of cloud Security, PII data handlingLogging & monitoringGood to haveStreaming data processingAdvanced analytics and Dashboarding in SAPMetadata driven development"
Data Engineer,Tickmill,"Tallinn, Harjumaa, Estonia (Hybrid)",https://www.linkedin.com/jobs/view/3761861909/?eBP=CwEAAAGMQBV_eTFlnhL6ImzXk58lpnFRhHmprAkodKU3_QJD7olc6X0y66MX2yKbEkRyTRgjd7ZP3E6azr90pnMXkTGHPDIK0hpIG-jf2QHZKRMUtAOkyj0x2hlMx1zlYEbWh7Gl2xumIude_lIwhddgNU6Wan4mejR4mWsFC1DhVfP4PXnljOseBi5tcsGNevjXTnrKMmuNCQrgVUsJ73vYqcwCRedmTYi0_wP5MZudcJ6L0oNGKfOSDsEpU8NQ1cyWFD7HYeTOgfwQHLzO6W9DhSfRuO7SfZ-ulsm4bkWVUAGpcTfgmbPlphoTOc9W9bGCj2LcNPgPsGkag7-VMHVa6J9eBwSruMfDwrlFEBu7uDOLhgfm5aSBd1iK9zwUvwgA&refId=Zzm30IqhBVvf80Si0PuBcQ%3D%3D&trackingId=cw6WtuBoHbg4UXNleosRVQ%3D%3D&trk=flagship3_search_srp_jobs,3761861909,"About the job
            
 
Are you looking for the next professional opportunity, that will challenge you and advance your career? Join our team now!Tickmill is looking to hire a Data Engineer to join our rapidly expanding business.About Tickmill. Tickmill is an award-winning, multi-regulated broker offering a wide range of asset classes including CFDs on Forex, Stocks, Indices, Commodities, Cryptocurrencies and bonds, as well as Exchange Traded Derivatives (Futures & Options).The Tickmill Group was established in 2014 and employs over 280 individuals through its offices in London, Cyprus, Estonia, South Africa, and several other regional offices globally.Our philosophy is based on trust, transparency, and diversity, reflected in both our workplace culture and outstanding customer support. Our employees, a multilingual team of highly skilled professionals from every continent, are the backbone of the company. Their hard work and dedication are what makes it possible to rank among the best in the industry. Tickmill offers a competitive benefits package, hybrid work model, team-building events, and many opportunities for professional growth.What the job looks like?As the Data Engineer, your key responsibilities will be: Develop data integration solutions for the extraction, transformation and loading of data into Datalake and/or Data Warehouse using modern cloud-based solutions.Design and develop rich data models for data analysis purposes.Develop import procedures for gathering, storing, and analyzing corporate data from various other sources.Actively contribute to the continued design and development of organization's current data estate.Analyse business requirements and develop unique simple solutions to meet the immediate and long-term BI demands of the group
What will you need to be able to do the job? BSc/MSc in Computer Science, Data Science, or related field.At least 4 years' experience in a similar position in a financial services organization.Strong SQL skills along with strong Data Warehouse design principles knowledge.Good understanding of Datalake design practices along with basic storage formats like csv, json, parquet etc.Good understanding of object-oriented programming languages like Python and Scala.Ability to translate complex source data into a consumable format and structure.Strong business acumen, analytical skills, logical analysis, conceptual thinking, and problem-solving skills.Design and implement complex, multi-step pipelines that orchestrate data movement across different data stores.Ability in liaising with product management and content owners to produce impactful visualizations.Excellent knowledge of the English Language both written and oral is a must.Team player and having excellent communication skills is a must.
Will be considered an advantage if you have: Interest in data modelling and statistical analysis with Python or R.Familiarity with Azure cloud ecosystem.Experience in financial markets.Good knowledge in data visualization, including dashboard development and design principles using Power BI or Tableau or other reporting tools.Written and verbal communication skills and the ability to influence others.
By joining us, you can expect: A Unique Opportunity for a career in a global, fast-growing company.Attractive remuneration package based on qualifications and experience.An international team of skilled colleaguesand a modern and professional work environment.Multiple events to bond with the team and the group through Quarterly/Semestrial Team Activitiesfor all the Company.Opportunities to learn and growthrough our “Employee Training & Development program”.A great chance to focus on your Health and Wellness through our Sports compensation program.Birthday Half Day off plus a gift.Weekly complimentary breakfast.Hybrid working schedule.Loyalty benefits.
Make your next Career step and apply NOW!*Due to the great number of applications, we receive for each of our open vacancies, we are unable to respond on an individual basis."
Data Engineer,poolia.it,Helsinki Metropolitan Area (Hybrid),https://www.linkedin.com/jobs/view/3767390692/?eBP=CwEAAAGMQBV_eZM3HMJd_vegWU6A638RgBMS2Z0iIPEVFA-T8gA8JY15R8aqSgXWnGTm_-rjeHwP5yVJ_8hp4bQ4Whs5Sm3G_o837DE2F0-Flklk1V6h8p5RA7pCxBIh8NrskSSpPoW3PqI1gDpl_tOZxqozjy5TofAWuXbXZFHs1KLKCDbOrha1cx56O1YeYH_v4tuGr7RYNEqYtp5CJDfzEZHdSQPbffLgMatba-JeITp5ya6NmxT6Ojt4DpI7Ob0vqoDNziC3Z4SaQVDYqS9iin8PXvxz375YCudxRErEWNoWcRPDM8yDSsy8InwHQ4-Ya8MdRkDPQP5tUc6fSzIvGKObO8xNpTHJku0OQNcHVzjiwSglQdkwUCmP6fvvv7nY&refId=Zzm30IqhBVvf80Si0PuBcQ%3D%3D&trackingId=v3qkodeeNYXky%2BZ%2F%2BsIwVA%3D%3D&trk=flagship3_search_srp_jobs,3767390692,"About the job
            
 
Haluatko päästä kehittämään Starian kokonaisvaltaisia BI-ratkaisuja? Starian BI & Planning Service- tiimi etsii nyt kehitysorientoitunutta Data Engineeria vakituiseen työsuhteeseen. Kansainvälisessä moniasiakasympäristössä pääset jättämään oman käden jälkesi Sarian tarjoamiin BI-ratkaisuihin ja kehittämään teknisiä taitojasi innostavassa ympäristössä. Mitä työpäiväsi pitävät sisällään?Data Engineerina työskentelet back office puolella kehittäen Starian tarjoamia Business Intelligence ja planning ratkaisuja. Yhdessä tiimin Head of Service Deliveryn kanssa vietät päiväsi miettien, miten kehitätte valmiita tietomallinnus, visualisointi ja planning sovelluksia, jotka voidaan BI konsulttien toimesta asentaa ja räätälöidä asiakkaiden tarpeisiin. Tässä tehtävässä menestyykin teknisesti orientoitunut henkilö, jota kiinnostaa monistettavissa olevien standardisoitujen kokonaisratkaisuiden kehittäminen.Päivittäisessä työssäsi olet mukana käyttöönottoprojektien ensimmäisessä konfiguraatiovaiheessa, jonka jälkeen konsultit rakentavat asiakkaan liiketoimintatarpeen pohjalta toimivan datamallinnuksen, raportoinnin sekä ennuste- ja budjetointiratkaisut. Käyttöönottoprojekteja lukuun ottamatta työskentelet sisäisissä projekteissa kehittämässä ratkaisuja käyttäen Starian omaa BI & Planning -työkalua, Naviloqia ja PostgreSQL:llaa. Uuden asiakkuuden alkaessa olet mukana onboardauksessa. Et kuitenkaan työskentele asiakasrajapinnassa vaan mietit, kuinka käyttöönottoprosessia edelleen kehitetään ja automatisoidaan.Ympärilläsi oleva BI & Planning Service -tiimi huolehtii Starian asiakkaista, jotka ovat niin suomalaisia kuin kansainvälisiäkin kasvuyhtiöitä, jotka hakevat kilpailuetua tiedolla johtamisesta. Palvelu tarjotaan asiakkaille avaimet käteen ratkaisuna tiedonhallinnan-, BI-raportoinnin- ja Planning-ratkaisujen saralla. Ratkaisujen pohjana toimii aina Starian itse kehittämä Naviloq BI & planning ratkaisu. Starialla huolehditaan asiakkaiden kokonaisuudesta kuukausittaisena palveluna alkaen implementaatiosta ja ylläpidosta aina liiketoiminnan sovelluksiin sekä tukeen asti.Mitä Staria voi tarjota sinulle? Tilaisuuden työskennellä Starian tarjoamien BI-ratkaisuiden kehittämisen parissa, jonka mahdollistaa heidän erinomainen BI-järjestelmänsä, joka yhdistää parhaat palat yhdeksi saumattomaksi kokonaisuudeksi sisältäen myös tietovaraston ja planningin.Loistavan mahdollisuuden työskennellä kansainvälisessä ympäristössä ja aidosti sinusta välittävän työyhteisön.Sitoutuneen ja lojaalin tiimin, jossa ongelmia ratkotaan yhdessä ja toisia autetaan sekä tuurataan tarvittaessa.Tilaisuuden nähdä oman käden jälkesi konkreettisesti ja edesauttaa oman tiimisi työskentelyä sekä menestystä.Tukea ammatillista kehittymistäsi koulutusten ja Starian jatkuvan kasvun kautta myös kasvavien uramahdollisuuksien avulla.Upeat ja uudet toimistotilat Helsingin ytimessä Mikonkadulla sekä joustavat etätyömahdollisuudet.Liukuvan työajan, ergonomisen työpisteen, sähköiset työvälineet, kilpailukykyisen palkkauksen, virike-edun, lounasedun ja työterveyden Mehiläisessä sekä tapaturmavakuutuksen.Matalahierarkisen organisaation, jossa panostetaan asiantuntijoiden viihtymiseen. Staria on saanut Future Workplaces –sertifioinnin osoituksena erinomaisesta työntekijäkokemuksestaan.Uratarinoiden kautta voit tutustua tuleviin työkavereihisi sekä Starian työkulttuuriin: https://staria.com/fi/yritys/meilletoihin/uratarinat/.
Menestyäksesi tässä tehtävässä sinulta toivotaan: Useamman vuoden kokemus Data Warehouse- työtehtävistä.Tietovirtojen ymmärrystä ja taitoa sanallistaa niitä.Ymmärrystä prosesseista, relaatioista ja syy-seuraussuhteista.Kokemusta SQL:lla työskentelystä (käytössä PostgreSql)Kiinnostusta prosessien ja asioiden tehostamista kohtaan.Kokemusta BI-ratkaisujen tuottamisesta joko ulkoisesti tai sisäisesti.Kykyä suunnitella ja johtaa omaa työskentelyä deadlinet huomioiden.Innokkuutta oppia uutta ja päästä kehittymään suurempien aihealueiden osaajaksi.Sujuvaa englannin kielen taitoa.
Lisäksi etuna nähdään kokemus BI raportointityökaluista (esim. Power BI, QlickView, Tableau).Kiinnostuitko?Mikäli kaikki tämä sai sinussa aikaan innostuksen väristyksiä, jaa meille LinkedIn profiilisi tai CV:si ja valjasta osaamisesi hakemuksen muotoon palkkatoiveen kera. Huomaathan, että otamme hakijoita käsittelyyn jo hakuaikana ja tehtävä täytetään heti sopivan henkilöiden löydyttyä, joten haethan tehtävää pian. Lisätietoja tehtävästä antaa Poolialta Starian rekrytointikumppanit Janette Andersson (janette@poolia.fi, p. 020 7290 839) ja Maria Kostenko maria@poolia.fi, 020 7290 847).StariaOlemme vuonna 2003 Suomessa perustettu yritys, joka on kokonaan henkilöstön sekä kotimaisen Vaaka Partnersin omistama. Mahdollistamme asiakkaillemme tehokkaimmat palvelut ja työkalut moderniin liiketoimintaan sekä seuraavan sukupolven kirjanpitoon maailmanlaajuisesti. Starian palveluihin kuuluvat paikalliset ja kansainväliset tietojärjestelmä-, talous-, HR- ja palkkaratkaisut sekä asiantuntijapalvelut sekä BI & Planning -ratkaisut. Staria on ainoa yritys Euroopassa, joka pystyy tarjoamaan laajat kansainväliset talouden- ja toiminnanohjauksen palvelut yli 40 maahan asiakaskohtaisella tiimillä. Staria on myös Pohjoismaiden palkituin NetSuite-kumppani."
Data Engineer - CARAT,Natixis in Portugal,"Porto, Porto, Portugal (Hybrid)",https://www.linkedin.com/jobs/view/3776268249/?eBP=JOB_SEARCH_ORGANIC&refId=Zzm30IqhBVvf80Si0PuBcQ%3D%3D&trackingId=MRhteobGfAm3BSYKS1tqJQ%3D%3D&trk=flagship3_search_srp_jobs,3776268249,"About the job
            
 
Company DescriptionNatixis in Portugal is fully integrated in the global organization of Natixis, a French multinational financial services firm specialized in Asset & Wealth Management, Corporate & Investment Banking, Insurance and Payments. As part of Groupe BPCE, Natixis counts nearly 16.000 employees across 38 countries.Based in Porto, Natixis Centre of Expertise mission is to transform traditional banking by developing innovative solutions for the bank’s business, operations and work culture worldwide, as a key driver of the company’s culture of agility and innovation. Teams of IT and Banking Support Activities work in an integrated, inclusive and transversal way, supporting all the business lines and country platforms.Counting with more than 1500 employees, Natixis in Portugal is the best combination of a “start-up mindset” with a large, solid structure. Its unique culture gives true meaning to a “beyond banking” personality: to be a real entrepreneur, self-challenging, ever striving to excel and go that extra mile.Job DescriptionWithin CARAT, as a data engineer, you’ll take part in developments of several modules developed in Spark with Scala, on Hive, Hbase, Indexima and with interactions with Rest API and external databases like SQLServer and Oracle.You will work in SCRUM within a team whose members are in Porto and Paris.You’ll participate to the technical design of the modules, their implementation, and the automation of tests. You will also have to interact with the Ops to deploy the modules.QualificationsRequirements: Experience with Big Data and NoSQL Technology (Hadoop, Spark, Hive, SolR, HBase, Kerberos)Experienced with functional programming (Scala, SBT)English B2+
Nice to have: Experience in an Agile environment (SCRUM)Knowledge of ZIO, MONIX, CATS libraries is valued (functional programming)Knowledge of Kafka and Schema RegistryKnowledge of Rest API
Additional InformationAt Natixis, we are committed to fostering a working environment where each and every one of our people is treated with dignity and respect and where every voice is heard. Our differences make us collectively stronger and are a source of fulfilment, innovation and performance.In the framework of its Diversity, Equity & Inclusion policy, Natixis in Portugal has implemented a Blind CV Screening process, with the purpose of reducing hiring bias. A blind CV excludes any personal details which refer to the applicant’s gender, age or ethnicity. When applying for our positions, please submit a blind CV, that is, with no picture, name, gender, age, nationality, ethnicity and address. Your personal statement, work experience, courses and certifications, education, skills and contact information is what matters to us.#MuchMoreThanJustAJobEarly morning. Campo 24 de Agosto. In 4 minutes, you are clocking in at the office. After grabbing a cup of coffee and fresh fruit, pick up your laptop and choose your spot for the day. It's going to be a busy one: French class before lunch and, just after, quick medical appointment at Natixis doctor's office.Lunch break. Outside in the big terrace (look at your crops at the Urban Garden; ready to harvest!) or, if you feel like stretching your legs, walk downtown to grab lunch.Back inside. Quick sprint review (working together anywhere means virtual happy birthday to that colleague in Paris that just turned 35). The afternoon went flying (tasks, reports, calls, some jokes with your teammates). End it on a high note: just one PlayStation game or the final match for that ping-pong tournament.Tomorrow, you complete that certified technical training and the day after, you will work from home, taking advantage to finally do that online course on Udemy. Once you are done with your tasks for the day, you can visit the office for a board games session or show up at the rehearsal of one of Natixis bands. If that is too steady for you, meet your colleagues to surf some waves or join them in a football match."
Data Engineer,Standard Chartered Bank,"Warsaw, Mazowieckie, Poland (Hybrid)",https://www.linkedin.com/jobs/view/3771817268/?eBP=CwEAAAGMQBV_eeW_b_82j-5lTbel-93BRCDEybIvZpPQeVefbqJ3k7Vf8mOXXZ3d3eHP-C7f0VzvRXEYufqGMwv1QO6oxr5oQpUFoAQ2F2ugcqU4tNSviDO_eppkpqADej6uFkn6ARxv8e1dj4BUMVYcM4zn31oxq1C3XTqbY3Ee8BWX9ZICBPWZlg8J8WjR19EHU7pONqKWesms75P-JsxMinhSPT_ME0_nTEf6GdKi7FTgpm0NpbQ2O-WL4IajQSK529ZMjYHoYktkF99YdTf-ukABwIzhbBSzz_D_OpSzWvqEG7KdwWiliTwQinAEFVPfKsfQSwt3JHuaHhFrD5w8CNVIJt--IzNOKwQtJvnB0mjtFFWuLc4AwxiguJCv6w&refId=Zzm30IqhBVvf80Si0PuBcQ%3D%3D&trackingId=YHOGi2YKAXUxEuKq3e9W%2BA%3D%3D&trk=flagship3_search_srp_jobs,3771817268,"About the job
            
 
Our role  The main objective of this role is to actively participate in Treasury innovation and digitalisation programme, through creating and embedding in-house data-driven solutions for stakeholders globally. Our goal is to help influence top-level decision-making process. We aim to achieve that by providing critical, data-driven business insights via developing and introducing advanced analytical tools. This requires combining technical know-how (e.g. systems, data, programming) with a commercial mindset (business opportunities, regulatory constraints).   The successful candidate will be part of an agile squad, delivering data modelling and analysis solutions for balance sheet optimisation. The candidate will be responsible for data sourcing, transformation, analysis and architecture, combining all necessary inputs into one aligned and complete data stream needed to deliver all required business views, metrics and simulations. Responsibility Translate business requirements into data requirement / data model, working with technology Data Engineers to design the relevant data extracts as inputs to models and solutions. Analyse data extracts from source systems and validate if meets business requirements; working with Data Engineers to enhance the extracts. Working with product owner to create business logic / mapping for stitching multiple different sets of data together and / or add business-related attributes. Implement end to end data flow (pipes) in the in-house platform from raw data extract to final results table. This includes ETL, any transformations / stitching of different data set and enrichment with business logic. Working with technology to build and maintain the relevant database / tables based on the agreed architecture. Maintain and update all key tables for business mappings & logics. Some Excel prototyping work on forecasting using the data set. Independently conduct deep-dive data analysis to investigate any issues. Propose, create, and deliver business-oriented MI to share with wider business audiences. Run period process to ensure product of these MI (i.e. monthly). Document all underlying business mapping methodologies, design, assumptions and exceptions
 Requierments 3+ years of experience in data analysis, data architecture, data transformations, building end to end inhouse data flows (pipes) from source to output, preferably in a bank environment. Proficiency in Python and either R or SQL. Outstanding analytics and problem-solving skills. Excellent written and verbal communication in English. Ability to work in a fast-paced environment, openminded and willing to learn new skills (both business and technical knowledge). 
Advantages (good to have) Previous experience in end to end data extraction, ETL, transformation and MI building. Previous experience working in an agile environment. Understanding and practical experience in liquidity risk, ALM, banking products and/or balance sheet optimisation. Prior experience with Dataiku data platform or with Balance Sheet Management platforms (Moody's Analytics, RiskPro, QRM, Oracle, etc.) or booking platforms (Murex, Kondor, etc.). 
  You will be offered Career development in a fast-growing company with a clear business strategy. Opportunity to expand international experience and build global professional relations. Competitive benefits package (incl. health & life insurance, pension plan, meal & sports cards). 3 days of paid volunteering leave our employees can use to support the cause of their choice. Convenient location (next to Rondo Daszyńskiego) with subway, tram and bus lines. Comfortable office space with chillout areas, free coffee/tea & fruit supply. Contribution to building our newest Global Business Services centre. 26 days of leave per year for all the employees. 
 About Standard Chartered   We're an international bank, nimble enough to act, big enough for impact. For more than 160 years, we've worked to make a positive difference for our clients, communities, and each other. We question the status quo, love a challenge and enjoy finding new opportunities to grow and do better than before. If you're looking for a career with purpose and you want to work for a bank making a difference, we want to hear from you. You can count on us to celebrate your unique talents. And we can't wait to see the talents you can bring us. Our purpose, to drive commerce and prosperity through our unique diversity, together with our brand promise, to be here for good are achieved by how we each live our valued behaviours. When you work with us, you'll see how we value difference and advocate inclusion. Together we: Do the right thing and are assertive, challenge one another, and live with integrity, while putting the client at the heart of what we doNever settle, continuously striving to improve and innovate, keeping things simple and learning from doing well, and not so wellBe better together, we can be ourselves, be inclusive, see more good in others, and work collectively to build for the long term
Visit our careers website www.sc.com/careers"
