job_title,company_name,location,job_link,job_id,job_description
Strategy Insights & Planning Consultant,ZS,"Frankfurt, Hesse, Germany (On-site)",https://www.linkedin.com/jobs/view/3745515343/?eBP=CwEAAAGMTrHQcCL4Vc-_WfiaUhAJ9HoMO5w8C9ya6z6L2cC9T1QnpSWExI_xdbDO3rxvHpRCj-yKMiETZ2z_ubWHfg7n05mxkFOC_Y6RKwBl8L6FAH98gP16cHdGDOsJr2Eq5vXXkJSRPshOoa6rEi0pMN45a1v5xYYHhvY15YQz7wGKfAWXyLXUvZXiEhZhNOz_mOaX85Zv3PFhN80QBxd6I4SPd0PovPldQ_pA_HhELot3o1wLhOXjLq2JLstIfCA-78LxpqW3aWHbnRqZA7sUv0HFDQxaj_3n-7PTchtLC0IrfVtEU4uGH9hBNb8Mixn3_aEvmeytUjqE7c4pHprjeRdgthovwkPLYBkzZOG-5hvd_3x-Ooabt7zmPFIPFx13WLc&refId=baiwHeb3l%2Fl%2BPSjfKlQBUg%3D%3D&trackingId=EkxtPHxXqc0wgBOnOTjgjg%3D%3D&trk=flagship3_search_srp_jobs,3745515343,"About the job
            
 
ZS ist eine Unternehmens- und Technologieberatung, die sich auf die Transformation des globalen und lokalen Gesundheitswesen spezialisiert hat. Dabei verstehen wir unsere Mitarbeitenden als unsere wertvollste Resource. Du arbeitest Seite an Seite mit einem leistungsstarken Team, um Lösungsansätze von Anfang bis Ende mitzugestalten. Dabei gehen wir andere und innovative Wege, um die vielseitigen Herausforderungen unserer Kunden im Gesundheitsmarkt effektiv und langfristig zu lösen. Dabei definierst Du Deinen eigenen Weg und wirst innovative Ideen und Projekte aktiv mitgestalten. Gemeinsam mit unseren Kunden entwicklst Du im Team wirksame Lösungen und schaffst Mehrwert für Unternehmen, deren Kunden und Patienten. Unsere Teams unterstützen Kunden in den Bereichen Portfoliostrategie, Vertriebsstrategie, Marktforschung, Forschung und Entwicklung, betriebliche und technologische Transformation, Marketingstrategie und vieles mehr.STRATEGY INSIGHTS & PLANNING CONSULTANTAls Strategy Insights & Planning Consultant (SIPC) leitest du Projektteams um unseren Kunden hochwertige Lösungen zu liefern. Dabei nutzt du fortschrittliche Datenanalysen- und Problemlösungstechniken sowie ausgeprägte Synthese- und Kommunikationsfähigkeiten. Insbesondere steuerst du als SIPC Projektpläne und erabeitest gemeinsam mit deinem Team Frameworks um Lösungen für die vielseitigen Herausforderungen unserer Kunden zu entwickeln.Desweiteren unterstützt du Veränderungsprozesse und setzt standardisierte analytische Techniken ein, um Kundenentscheidungen zu erleichtern. Nach Bedarf arbeitest du an mehreren Projekten gleichzeitig. Während deiner beruflichen Weiterentwicklung hast du die Möglichkeit, dich auf eine bestimmte Industrie, einen Unternehmensbereich und/ oder auf Kundenbeziehungen zu spezialisieren.Für unser Büro in Frankfurt am Main oder Berlin suchen wir ab 2024 mehrere Strategy Insights & Planning Consultants (m/w/d).Deine Aufgaben: Gemeinsam mit der Projektleitung definierst Du den Projektumfang und entwickelst die Vorgehensweise; Du leitest die Projektausführung in dem du Fortschritte festhältst, Projektdaten organisierst und Teammeetings koordinierstDu entwirfst Analysen und stellst Hypothesen zur Lösung von Kundenproblemen aufDu entwickelst qualitative und quantitative Analysen zum Testen und Analysieren der HypothesenDu fasst die Ergebnisse zusammen und kommunizierst diese an Kunden und ZS-TeamsDu koordinierst und betreust Kundenprojektteams um sicher zu gehen, dass die Bedürfnisse unserer Kunden adressiert werdenDu baust Kundenbeziehungen auf, die über die Projektausführung hinaus gehen. Dies fördert Diskussionen sowie ein harmonisches Kundenverhältnis mit neuen Perspektiven Du unterstützt Aktivitäten im Bereich Business DevelopmentDu wirkst bei internen Firmenaktivitäten mitDu fungierst als Coach und Mentor für unsere junior Teammitglieder
Dein Profil: Abgeschlossenes Studium der Wirtschaftswissenschaften, Marketing, Psychologie, Naturwissenschaften, Ingenieurswesen, Angewandte Mathematik, Statistik (Bachelor, Master, PhD oder MBA) oder einer vergleichbaren Studienrichtung5 bis 8 Jahre relevante BerufserfahrungHohe Motivation, gute Arbeitsmoral, Reife und EigeninitiativeErfahrung und Freude an der Leitung eines TeamSehr gute mündliche und schriftliche Kommunikationsfähigkeiten die einen positiven Einfluss bei Entscheidungsträgern auf hoher Ebene ermöglichen Liebe zum Detail und qualitätsorientierte DenkweiseAnalytische Fähigkeiten zur Problemlösung und Einbringen von kreativen und innovativen IdeenKundenorientierung
Das kann ZS Dir bieten:  ZS ist ein echter Hidden Champion – in Europa fokussieren wir uns auf den Bereich Life Sciences mit europäischen Büros in London, Cambridge, Frankfurt, Berlin und ZürichWir leben eine einzigartige Firmenkultur, in der die Mitarbeitenden im Mittelpunkt stehen. Daher finden regelmäßig Firmenevents und Socials statt, um das Miteinander sowie Inklusion & Diversität zu fördernZS bietet langfristige Karriereperspektiven und Entwicklungsschancen. Es gibt zahlreiche Programme für Mitarbeitende in verschiedenen Lebensphasen- beispielsweise die Women´s Leadership Initiative, FamilieZS, oder flexible ArbeitszeitmodelleWir unterstützen Dich aktiv in Deiner Karriereentwicklung. Ein gutes Supportsystem aus Mentoren und Personal Development Coaches, individueller Beratung sowie Gruppentrainings begleiten Dich auf Deinem beruflichen Weg bei ZS
Weitere Benefits: Betriebliche AltersvorsorgeEin professionelles Umfeld, das Dich in Deiner persönlichen Karriere fordert und fördert Eine umfangreiche Einarbeitung mit Onboarding/ Training in einem unserer BürosMöglichkeit zur Teilnahme und Unterstützung unserer firmeninternen Initativen Regelmäßige (sportliche) Gruppenaktivitäten mit dem TeamKostenlose Teilnahme an Veranstaltungen im TaunusTurm (z.B. Yoga, Zumba, Sound Meditation, Opera Night auf unserem Rooftop, uvm.)Team Lunch während unserer Office MeetingsBreakfastclub: Im monatlichen Turnus bereiten die KollegInnen ein reichhaltiges Frühstück vorSehr gute Verkehrsanbindung zum Willy-Brandt-Platz im Herzen FrankfurtsZudem bieten wir verschiedene Getränke, Obst, Snacks und im Sommer EIS!
Hier findest Du weitere Informationen:www.zs.com,"
Business Transformation Consultant,Stealth iT Recruitment,Germany (Remote),https://www.linkedin.com/jobs/view/3766008211/?eBP=CwEAAAGMTrHQcDew8Nl3BsInPkMQmKIoWL4L4-jjBgsbhe2TC_Z7z5nlPpdEa64fybSjDzD8g4fM5OEZHJWc1V4JX5j0WRWTQd1MKXC1rpabHq7utq8DNekflf9-sraEFqM7_cRayM1wJAxsPcDtclvAnirLBrEOWk_c3GnRZ0vdp3vJkNgW_ge2WyuultmtViBlm5xEKZC5kCm2rb9OItXWNX0490C_3j-_ZInF3U5lLMeVXFeewJ-9kcSvwyWax-nKG6MmgABz2NBVX-_fVcuvv7mDW9zjRwJvK25Vq9Mbcc4gPqgj_4GHCiVvX0ZzLmsXFHlcdpN0Notm0LxcV68MbGE7fA3pO75_qYDjjEXjpGMs1_Su3VHxuYi8YI_X8khv3w4&refId=baiwHeb3l%2Fl%2BPSjfKlQBUg%3D%3D&trackingId=s4AjBL42rpAxPZfNFxbh9A%3D%3D&trk=flagship3_search_srp_jobs,3766008211,"About the job
            
 
Business Transformation Consultant Salary range – 85,000-100,000 euros + bonus Location – Germany, (Berlin, Hamburg, Duesseldorf/Koeln, Munich, Ehningen)Flexible working available Candidates must have a consulting background with experience of Healthcare Insurance sector. The RoleYou will work with visionaries from different industries to improve the hybrid cloud and AI journey for the world's most innovative and important companies. Curiosity and a constant quest for knowledge are the foundation of our clients organisation. In and beyond your role, you will develop ideas and find creative solutions that make a difference for a broad network of clients. Our clients organisation encourages your career growth and development opportunities in an environment that recognizes your individual skills and experience. Role and Responsibilities : Business Consultants from our organisation support our clients in identifying and implementing future oriented solutions. Become part of our highly qualified team of consultants who shape the solutions of tomorrow for the insurance industry in a dynamic environment. You will support our clients from strategic consideration through to successful implementation. This is based on your specialist knowledge, industry expertise and strong soft skills as well as a strong focus on business development and transformation projects in the field of digitalization. We offer exciting, challenging projects with insurance customers in Germany, Austria, Switzerland and beyond, and the opportunity to develop your own career in a successful team. Are you analytical, a communicator, passionate about finding solutions, an innovator? Then we are looking for you! What we are looking for:• University degree, preferably in business administration, business informatics, industrial engineering, mathematics or comparable courses of study • Expertise in insurance processes and insurance software products • Proven project experience in the introduction of standard software and transformation of business processes in the insurance industry • Team and/or project management experience • Knowledge of IT trends and their impact on business success • Excellent communication and presentation skills • Language skills: German and English fluent • Willingness to travel in a dynamic project environment What we offer: • Responsible for creating solutions to our clients' business challenges • Teamwork in a global network of experts • Modern solutions, technologies and tools are used in our projects • Personal career development in a global company that adapts to your life plan • Training framework including generally recognized certification options for individual further training • Flexible working models with home office options • Attractive additional benefits, employee leasing, pension scheme and company health management"
Business Consultant,Plat4mation,"Frankfurt, Hesse, Germany (Hybrid)",https://www.linkedin.com/jobs/view/3761455760/?eBP=CwEAAAGMTrHQcLu2pxQp_5bzfzKJorPW4gwCKtTwMnPqqF9Fl8nGIzaUm6gD_BXGloU4HXh51d5E0tbtLdYfpT2tcHVxZs8sULc1wJjafZ-_Tt2y7d7jWxpcRZHYG8kYrV36lrzykuAIUY880ORosCTQRkPaV9KQPPflN6SUASwRYMgzJxPs9ygBQUfS61VbgWYTj6rGfzQy02txoqYoTXn6VfAyG4vJgqZsZv5_RyjuLqq4Aj9Nb_4KhogMhWE-jdcHWGYizLo08Bu_d1yVsFTLbKIlJxmMEl31So1UsXWXgOdTdRLqGwMOAYzjkJjoyPh6H_3Qx0b5rtuVEAKTgnL5Hz1trUib8ceuvbi1CZ4Um7Uxv4wT0bnUw-w7y6qI5R-f&refId=baiwHeb3l%2Fl%2BPSjfKlQBUg%3D%3D&trackingId=zQl51k6wLw08PlXKGHmMBw%3D%3D&trk=flagship3_search_srp_jobs,3761455760,"About the job
            
 
Are you a highly motivated individual that likes to propose and pitch solutions to customers? Are you able to maximize the customer value realization during implementations? And can you organize and communicate easily as a trusted advisor? Then we are looking for you as our next ServiceNow colleague for our German entity!What will you do?We are looking for a Business Consultant to join our team of PaaS-specialists in our entity in Germany. Our company is 100% dedicated to delivering world-class digital business capabilities powered by ServiceNow. We are a global strategic partner for our customers ensuring they get the most value from the platform. Our broad services portfolio is exclusively built around ServiceNow, making us the one-stop-shop for all ServiceNow related advisory services, implementations, custom app developments and application maintenance & support. So, join us in our mission to be THE strategic ServiceNow advisory and implementation partner and make people’s work flow! As a Business Consultant, you will join our team to help us improve the customer experience across the organization. You will play a significant part to the realization of the customer organization’s goals and needs by implementing a more business-focused approach aligned with their strategy.Scope of work: You will be primary point of contact for a customer and make recommendations for effective and cost-efficient workflows. As Trusted Advisor you create and maintain effective customer relationships to ensure customer satisfaction.You will be assisting our colleagues with pre-sales and RFP’s.You will be responsible for capturing the customer needs and translating these into a workable solution.You will be guiding and conducting workshops in explaining the solution in ServiceNow to the customer.You will be giving presentations and demonstrations of ServiceNow and discuss and analyze GAPS between ServiceNow and the customer’s processes.Tailor the Plat4mation value proposition to client requirements based on in-depth research of specific business conditions and driversYou monitor the progress and report on milestones and budget to the customer and/or the manager at Plat4mation pro-actively.
We ask Bachelor or equivalent in experience. Master is preferred.Fluent in English and German.Minimum of 3 years of experience working in a big consultancy organization dealing with complex IT-projects and finding solutions within Enterprise Software.ITIL certification is required. Strong preference for candidates with a ServiceNow ITSM certificate.Experience with giving presentations and pitching solutions to the customer.Actively contribute to the company’s solution portfolio, by providing knowledge to methodologies based on experience gained from customer projects.Authorized to work in Germany.As Trusted Advisor you create and maintain effective customer relationships to ensure customer satisfaction.
What’s in it for you  Competitive salary30 days’ vacation allowancePension contributionFlexible work environment in modern officesLaptopInternet and phone allowanceTransportation allowanceEnvironment where you can implement your own ideas and strategies
Our cultureWorking at Plat4mation evolves around working from your internal drive to make a difference for people in combination with having fun. We always go the extra mile to deliver on what we promise! Joy is what connects us and what drives us to get the best out of ourselves. That’s why we host several Fun4U activities each year, like a global hackathon, drinks and inspiring lunch sessions (check out our Instagram page!). Your development is our number one priority. This means you get room to grow. We strongly believe that personal development and ambitions are key to our company’s success. Because when you keep learning, you continuously improve yourself. That’s why we coach you on the job, but also help you to explore and develop your interpersonal skills.About Plat4mationWe are a global pure-play ServiceNow partner that makes work flow. Our goal is to boost workforce productivity and happiness by implementing solutions that provide great experiences and ensure work flows intelligently across and between organizations. Furthermore, we future-proof our solutions by enabling our customers to continually measure and improve performance.Besides offering world-class ServiceNow Implementation and Managed Services, we provide thought leadership to strategically guide our customers to take full advantage of all ServiceNow capabilities. Our award-winning ServiceNow Application Development Services ensure we can transform any business need into a powerful digital business application.Interested?Do you accept the challenge? Do you think you fit the profile described above and have we made you enthusiastic? Please send your CV and motivation letter to careers.de@plat4mation.com or apply directly by filling out the form below."
Student Consultant - Digital Consulting & Transformation (m/w/d),Capgemini,"Vienna, Vienna, Austria (Hybrid)",https://www.linkedin.com/jobs/view/3731072187/?eBP=JOB_SEARCH_ORGANIC&refId=baiwHeb3l%2Fl%2BPSjfKlQBUg%3D%3D&trackingId=o%2BEtjEi%2BN86ORBD%2FOktfvw%3D%3D&trk=flagship3_search_srp_jobs,3731072187,"About the job
            
 
Sammle bei bevorstehendem Studienabschluss praktische Erfahrungen in einem global führenden IT-Beratungsunternehmen und werde als Student Consultant Teil unseres Teams Digital Customer Experience.FactsStart: ab 2024 möglichAusmaß: Vollzeit (40h / Woche)Dauer: 6 Monate (mit Aussicht auf Übernahme zu einer Fixanstellung in Vollzeit nach einem halben Jahr)Deine Aufgaben Eigenverantwortliche Übernahme von Aufgaben im Rahmen unserer Beratungs- & Transformationsprojekte bei nationalen und internationalen Kunden Analyse und Optimierung von Geschäfts- und IT-Prozessen Unterstützung bei der Bearbeitung von Projektaufgaben und interne Tätigkeiten, um die Capgemini Service Angebote voranzutreiben Laufende persönliche Weiterentwicklung (Trainings und Zertifikate z.B. SCRUM Master, Business Analyse)
In Deiner Laufbahn als Student Consultant in unserem DCX Team kannst Du Dich in verschiedene Themengebiete einarbeiten und verwirklichen:  Pega:
Mithilfe der Pega Low-Code Plattformarchitektur, A.I. und Smart Robotics lassen sich Enterprise-Applikationen für sämtliche Arten von Geschäftsfällen entwickeln und automatisieren.Um Dich hier auf schnellstem Wege zum Experten / zur Expertin zu entwickeln, bieten wir limitierte Teilnahmeplätze an einem 6 wöchigen Pega Trainingsprogramm.Mehr Infos Bereitschaft Vollzeit bei uns einzusteigen Rasche Umstellung zu Fixanstellung geplant Salesforce : Die cloudbasierte CRM-Plattform unterstützt Unternehmen dabei personalisierte 360-Grad-Kundenerlebnisse zu erzeugen und ist der Marktführer unter den CRM-Lösungen. Frontend UI/UX: Gemeinsam kreiert unser Immersive Experiences Team emotionale Bindungen und Werte für den Kunden. Mithilfe von verschiedenen Interaktionsformen, wie traditionellem UI (Web und mobile Apps) sowie modernen Design Tools entwickeln wir maßgeschneiderte Anwendungen.
Dein Profil Kurz vor oder nach dem Abschluss eines wirtschaftlichen oder technischen Studiums (Informatik, Wirtschaftsinformatik, Mathematik, Physik oder ein vergleichbarer Studiengang)IT-Affinität und Interesse für digitale Technologien Erste einschlägige Berufspraxis von Vorteil Sehr gute Deutsch- und Englischkenntnisse Zeige Eigeninitiative 
Benefits Arbeite flexibel und mobil in unserem Office im Millennium-Tower oder bei Dir zuhause Bekomme von uns Deine Homeoffice- und persönliche IT-Ausrüstung (Bürostuhl, Monitor, Laptop und Handy) und monatliche EssengutscheineEntwickle Dich durch hausinterne und externe Angebote weiter (z.B. Coursera) Dich erwartet ein offener und flexibler Karrierepfad mit Aufstiegschancen Komm klimafreundlich in das Capgemini Büro – Wir zahlen Dein Wiener Linien Ticket Ein Buddy begleitet Dich für ein erfolgreiches Onboarding Arbeite mit internationalen Teams Viel Raum für Eigeninitiative
Unser Unternehmen unterliegt dem „Kollektivvertrag für Angestellte in Information und Consulting“. Für die ausgeschriebene Position bieten wir ein monatliches Bruttogehalt von EUR 1.900,00.Wir freuen uns über Deine Bewerbung auf Englisch, ausschließlich über unser Bewerbungsportal und unter Angabe von dem frühestmöglichen Eintrittszeitpunkt."
Consultant transformation digitale H/F,Almond,"Sèvres, Île-de-France, France (Hybrid)",https://www.linkedin.com/jobs/view/3764265293/?eBP=CwEAAAGMTrHQcNzlIRyz08x3NLObh-KgwQgzfnQvxyEqxk6AfU-7Ug1lBrZZMuZDV-ZFeI1mF6rD2m_jZxHFYYDHyl6a_XgKlQCDuNN8jJj-GYAoz6LMPVA8acxocQtVWVo050VUNdVG1qqKSWfHNyVDC6vv7C96dTv7fOUVnkq6NC9ZZtJNdB6Aj7gtCXu7L8v1u5sZpewojIocFML2JNrxp3IwQOb7FGRXJRWRqrvH4pT7QeHDzC6dhSL6fyf9qXZlr6Y_kBkcfbf02M5DmhtU-R0weCrAbu2MOkLV1znkJ-S35zPYwDBo01jEzktKsp5dOZEPfk5jpCJapKEzsmOl2janb9HnqdJR_6Br4hXBxyYFMS6N2exskOndTFyWazyh9SY&refId=baiwHeb3l%2Fl%2BPSjfKlQBUg%3D%3D&trackingId=OaqVOoLWA4FaFSzT2OlbQA%3D%3D&trk=flagship3_search_srp_jobs,3764265293,"About the job
            
 
Description de l'entreprise :Almond se positionne comme un acteur français indépendant incontournable de l’Audit, du Conseil, de l'Intégration et des Services Managés dans les domaines de la Cybersécurité, du Cloud et des Infrastructures.Almond en quelques chiffres : 400 collaborateurs5 implantations : Sèvres, Nantes, Strasbourg, Lyon et Genève
Description du poste :Ton rôle dans l’équipeNotre pari : Accompagner nos clients DSI dans la transformation de leur organisation et de leurs systèmes d’informationContribuer à la transformation digitale de l'entreprise
Tes missions :Tu es rattaché(e) à la BU Strategy, Governance & Transformation pour la réalisation opérationnelle de missions d’audit et de conseil auprès de clients Grands Comptes et Entreprise de Taille Intermédiaire touchant les champs d’intervention suivants : Diagnostic et audit IT, technique et organisationnelSchéma Directeur SI & définition de trajectoires Cloud et DataPilotage de road map de transformationAccompagnement sur les projets DSI, Cloud, Data, RPAOrganisation de la fonction SI et modèle opérationnelPilotage de la performance, optimisation des coûts (FinOps)Aide au choix de partenaires et de solutionsEn fonction de ton expérience sur les sujets traités, tu seras accompagné et soutenu par ton manager et tes collègues experts tout au long de tes missions.
QualificationsIdéalement tu es/as :  Diplômé(e) d’une école d’ingénieur ou formation universitaire équivalenteUne première expérience réussie dans les métiers du conseil ou chez un client finalUne forte capacité d'analyse et de solides compétences rédactionnelles
Disposer de certifications sera considéré comme un plus, mais n’est pas obligatoire.Et si tu souhaites t’investir encore plus dans la société, tu en auras l’occasion !Être consultant chez Almond, c’est aussi : publier des articles, participer au développement des offres de services, prendre part à des avant-vente, conduire des appels d’offres, contribuer au recrutement…"
Business Consultant,CGI Nederland,"Rotterdam, South Holland, Netherlands (Hybrid)",https://www.linkedin.com/jobs/view/3752488933/?eBP=CwEAAAGMTrHQcLBQzfIHa-iaXLafn3WAAx-1jsrxlEYPBdIRCOHTKq58R_ojU8oMzuaSN0uh9DtWCu--S2ohkrHLqjjILzpNyK6-ilVbtDujMWVmAvPs1q981zoBDvcWalWI3iplTbAjS4UByxLQwfpYsrtZu5ZNI2NBhGYczAYQNVucwQVw3b26HFCUr9kEmvw74D-KYSzZcO3hjWwqfu88H4KchjpG0vTNKPVJ4aJ2JxiNJH3pX7Slo-9SJIHYkTGA9Xzuf40-b8WCYHXHF30NXyFFg5cDugL2jLuXD9Fj4Sgvyt2Wli97NniN3SxZRegG7_eKqHcIvnjBiZggUvocMj8qURQxWhsUz-xWUATFmO5I464KtYiJLVJlDtsgBh3EeRY&refId=baiwHeb3l%2Fl%2BPSjfKlQBUg%3D%3D&trackingId=srUuyQPdSBlwoDsMApyE3Q%3D%3D&trk=flagship3_search_srp_jobs,3752488933,"About the job
            
 
Werk aan het vernieuwen of verbeteren van processen bij een van onze klanten en zorg voor maximale impact.Jouw rol in ons teamAls Business Consultant ben je onderdeel van een unit die de klant centraal zet en er alles aan doet om ervoor te zorgen dat de klant tevreden is over de verleende diensten. Je werkt aan het vernieuwen of verbeteren van processen bij een van onze klanten. Het totale proces, van offerte tot evaluatie, wordt door het team verzorgd. Je draagt bij aan de digitale transformatie van onze klanten en helpt hen om aan te haken bij de digitale transformatie.Hoe jij ons team versterktWe zoeken een veelzijdige, proactieve en analytische professional met een sterke toewijding aan teamwork en resultaten. De ideale kandidaat heeft de volgende kwalificaties: Een (bijna) afgeronde wo-opleiding op het gebied van bedrijfskunde, bestuurskunde, of business & ITAffiniteit met informatievoorziening, consultancy, of beideDe ambitie om je eigen carrière vorm te gevenZin om aan de slag te gaan met opdrachten voor klanten die ervoor zorgen dat Nederland blijft draaien
Waarom CGI?CGI is één van 's werelds grootste IT-consultancy bedrijven. Onze mensen houden Nederland draaiende. Overheidsinstellingen, banken, lucht- en ruimtevaart, infrastructurele organisaties en energie- en productiebedrijven zijn klanten van CGI.We werken aan interessante projecten die het alledaagse leven van miljoenen mensen raken. We zijn regionaal aanwezig, versterkt met wereldwijde domeinkennis, ons ecosysteem en collega's verspreid over de hele wereld.We zijn trots op de impactvolle projecten die we samen met onze collega’s tot een succes maken.Bij CGI hechten we veel waarde aan diversiteit en inclusie, omdat dit niet alleen de samenwerking bevordert, maar ook vaak leidt tot betere resultaten. We kijken uit naar jouw bijdrage aan ons team!Werken in kleine zelfsturende teams bestaande uit experts in je vakgebied.• De regie over je eigen carrière met daarbij de ruimte om jezelf te blijven ontwikkelen.• Je werkt met de nieuwste technologieën.• Een uitstekend salaris en aantrekkelijke secundaire arbeidsvoorwaarden• Direct een vast contract• Parttime mogelijkheden• En de mogelijkheid om CGI aandeelhouder te wordenWaar kom je terecht?Je werkt binnen de Defensie-unit, onderdeel van de sector Defense, Transport & Logistics. Je maakt deel uit van een toegewijd team en hebt de kans om te werken in een uitdagende omgeving. We zijn een partner voor defensieorganisaties in verschillende NATO-landen, waarbij onze activiteiten variëren van cybersecurity, informatiegestuurd optreden, cloud computing, biometrie en secure hosting tot elektronische oorlogsvoering en command & control, evenals ICT-beheer, systeemintegratie en strategische advisering.Sluit je aan bij ons team van experts en solliciteer direct!Solliciteer direct! We nemen dan zo snel mogelijk contact met je op. Vragen over de functie?Stel ze aan Robert van den Berg, Director Consulting Services, via +31 6 2293 2306 of via robert.van.den.berg@cgi.com.Vragen over de sollicitatieprocedure? Neem contact op met Lilija Alesjkevitsj (Recruitment Business Partner) via 06 2558 7597 of via lilija.alesjkevitsj@cgi.com.We werken niet samen met externe recruitment partijen. Acquisitie wordt daarom niet op prijs gesteld."
